20-07-1451-43,26-021,CHIQUIMULA,ESQUIPULAS,EDAC - PRONADE -,CASERIO EL JICARO ALDEA JAGUA,79430352,PROYECTO SEPREDI,,PRIMARIA,OFICIAL,RURAL,CERRADA DEFINITIVAMENTE,BILINGUE,MATUTINA,DIARIO(REGULAR),CHIQUIMULA
20-07-1452-43,26-021,CHIQUIMULA,ESQUIPULAS,EDAC - PRONADE -,CASERIO EL PEDREGAL CHANMAGUA,79430352,PROYECTO SEPREDI,,PRIMARIA,OFICIAL,RURAL,CERRADA DEFINITIVAMENTE,BILINGUE,MATUTINA,DIARIO(REGULAR),CHIQUIMULA
20-07-1453-43,26-021,CHIQUIMULA,ESQUIPULAS,EDAC - PRONADE -,CASERIO BARRIAL SAN NICOLAS,,PROYECTO SEPREDI,,PRIMARIA,OFICIAL,RURAL,CERRADA DEFINITIVAMENTE,BILINGUE,MATUTINA,DIARIO(REGULAR),CHIQUIMULA
20-07-1454-43,26-020,CHIQUIMULA,ESQUIPULAS,EDAC - PRONADE -,CASERIO PESOTE LAS PEÑAS,,PROYECTO SEPREDI,,PRIMARIA,OFICIAL,RURAL,CERRADA DEFINITIVAMENTE,BILINGUE,MATUTINA,DIARIO(REGULAR),CHIQUIMULA
20-07-1455-43,26-038,CHIQUIMULA,ESQUIPULAS,EDAC - PRONADE -,CASERIO HORNO DE VIDES,,PROYECTO FUNDAP,,PRIMARIA,OFICIAL,RURAL,CERRADA DEFINITIVAMENTE,BILINGUE,MATUTINA,DIARIO(REGULAR),CHIQUIMULA
20-07-1456-43,26-021,CHIQUIMULA,ESQUIPULAS,EDAC - PRONADE -,ALDEA SAN CRISTOBAL CUEVITAS,,PROYECTO SEPREDI,,PRIMARIA,OFICIAL,RURAL,CERRADA DEFINITIVAMENTE,BILINGUE,MATUTINA,DIARIO(REGULAR),CHIQUIMULA
20-07-1457-43,,CHIQUIMULA,ESQUIPULAS,EDAC - PRONADE -,CASERIO EL SALITRE,,,,PRIMARIA,OFICIAL,RURAL,CERRADA DEFINITIVAMENTE,BILINGUE,MATUTINA,DIARIO(REGULAR),CHIQUIMULA
20-07-1458-43,,CHIQUIMULA,ESQUIPULAS,EDAC -PRONADE-,CASERIO LOS PERICOS CARRIZAL,,,,PRIMARIA,OFICIAL,RURAL,CERRADA DEFINITIVAMENTE,BILINGUE,MATUTINA,DIARIO(REGULAR),CHIQUIMULA
20-07-1459-43,,CHIQUIMULA,ESQUIPULAS,EDAC - PRONADE -,CASERIO MALCOTALITO,,,,PRIMARIA,OFICIAL,RURAL,CERRADA DEFINITIVAMENTE,BILINGUE,MATUTINA,DIARIO(REGULAR),CHIQUIMULA
20-07-1480-43,26-020,CHIQUIMULA,ESQUIPULAS,EDAC - PRONADE -,CASERIO CAÑADA DEL PINO ALDEA TIMUSHAN,79430352,PROYECTO SEPREDI,,PRIMARIA,OFICIAL,RURAL,CERRADA DEFINITIVAMENTE,BILINGUE,MATUTINA,DIARIO(REGULAR),CHIQUIMULA
20-07-1510-43,20-07-1176,CHIQUIMULA,ESQUIPULAS,CEES LOS CAMPEONES,COLONIA SAN JOSE OBRERO,42188220,DONELIA SARAÍ GUERRA ARANA,TELMA LETICIA RECINOS FUENTES,PRIMARIA,OFICIAL,RURAL,ABIERTA,MONOLINGUE,MATUTINA,DIARIO(REGULAR),CHIQUIMULA
20-07-1511-43,,CHIQUIMULA,ESQUIPULAS,CEES 'LOS CAMPEONES',3A AV 9-20 ZONA 2,,,,PRIMARIA,OFICIAL,RURAL,CERRADA DEFINITIVAMENTE,MONOLINGUE,MATUTINA,DIARIO(REGULAR),CHIQUIMULA
20-07-1550-43,20-07-1173,CHIQUIMULA,ESQUIPULAS,COLEGIO PRIVADO MIXTO RENACIMIENTO,5A. AVENIDA 2-25 ZONA 1,79432012,LANDELINO CRÚZ GARCÍA,,PRIMARIA,PRIVADO,URBANA,ABIERTA,MONOLINGUE,MATUTINA,DIARIO(REGULAR),CHIQUIMULA
20-07-1581-43,26-020,CHIQUIMULA,ESQUIPULAS,EDAC - PRONADE -,CASERIO EL ZAPOTALITO ALDEA EL ZARZAL,,PROYECTO SEPREDI,,PRIMARIA,OFICIAL,RURAL,CERRADA DEFINITIVAMENTE,BILINGUE,MATUTINA,DIARIO(REGULAR),CHIQUIMULA
20-07-1608-43,,CHIQUIMULA,ESQUIPULAS,EDAC - PRONADE -,CASERIO SAN CRISTOBAL ALDEA OLOPITA,,,,PRIMARIA,OFICIAL,RURAL,CERRADA DEFINITIVAMENTE,MONOLINGUE,MATUTINA,DIARIO(REGULAR),CHIQUIMULA
20-07-1609-43,26-020,CHIQUIMULA,ESQUIPULAS,EDAC - PRONADE -,CASERIO MALCOTALITO ALDEA SAN ISIDRO,,PROYECTO SEPREDI,,PRIMARIA,OFICIAL,RURAL,CERRADA DEFINITIVAMENTE,MONOLINGUE,MATUTINA,DIARIO(REGULAR),CHIQUIMULA
20-07-1732-43,26-020,CHIQUIMULA,ESQUIPULAS,EDAC - PRONADE -,CASERIO LOS VADOS ALDEA VALLE DOLORES,,PROYECTO SEPREDI,,PRIMARIA,OFICIAL,RURAL,CERRADA DEFINITIVAMENTE,MONOLINGUE,MATUTINA,DIARIO(REGULAR),CHIQUIMULA
20-07-1733-43,26-020,CHIQUIMULA,ESQUIPULAS,EDAC - PRONADE -,COLONIA LOMA LINDA,,PROYECTO SEPREDI,,PRIMARIA,OFICIAL,RURAL,CERRADA DEFINITIVAMENTE,MONOLINGUE,MATUTINA,DIARIO(REGULAR),CHIQUIMULA
20-07-1822-43,20-035,CHIQUIMULA,ESQUIPULAS,COLEGIO CRISTIANO SHALOM,5A. AVENIDA A 4-60 ZONA 1,79433008,VICTORIA NOEMÍ RECINOS VIDAL DE HERNÁNDEZ,OSWALDO RAFAEL SALINAS BRENES,PRIMARIA,PRIVADO,URBANA,CERRADA DEFINITIVAMENTE,MONOLINGUE,MATUTINA,DIARIO(REGULAR),CHIQUIMULA
20-07-1917-43,26-020,CHIQUIMULA,ESQUIPULAS,EDAC -PRONADE-,"CASERIO EL PORTESUELO, ALDEA SANTA ROSALIA",,PROYECTO SEPREDI,,PRIMARIA,OFICIAL,RURAL,CERRADA DEFINITIVAMENTE,MONOLINGUE,MATUTINA,DIARIO(REGULAR),CHIQUIMULA
20-07-1919-43,26-020,CHIQUIMULA,ESQUIPULAS,EDAC -PRONADE-,LOTIFICACION VALLE MARIA,,PROYECTO SEPREDI,,PRIMARIA,OFICIAL,RURAL,CERRADA DEFINITIVAMENTE,MONOLINGUE,MATUTINA,DIARIO(REGULAR),CHIQUIMULA
20-07-1920-43,26-020,CHIQUIMULA,ESQUIPULAS,EDAC -PRONADE-,"CASERIO LOS FIERROS, ALDEA TIMUSHAN",,PROYECTO SEPREDI,,PRIMARIA,OFICIAL,RURAL,CERRADA DEFINITIVAMENTE,MONOLINGUE,MATUTINA,DIARIO(REGULAR),CHIQUIMULA
20-07-1921-43,26-020,CHIQUIMULA,ESQUIPULAS,EDAC -PRONADE-,"CASERIO AGUA ZARCA, ALDEA ATULAPA",,PROYECTO SEPREDI,,PRIMARIA,OFICIAL,RURAL,CERRADA DEFINITIVAMENTE,MONOLINGUE,MATUTINA,DIARIO(REGULAR),CHIQUIMULA
20-07-1923-43,26-020,CHIQUIMULA,ESQUIPULAS,EDAC -PRONADE-,CASERIO OLOPITA CENTRO,,PROYECTO SEPREDI,,PRIMARIA,OFICIAL,RURAL,CERRADA DEFINITIVAMENTE,MONOLINGUE,MATUTINA,DIARIO(REGULAR),CHIQUIMULA
20-07-1969-43,26-020,CHIQUIMULA,ESQUIPULAS,EDAC -PRONADE-,"RESIDENCIALES DEL VALLE, ZONA 3",,PROYECTO SEPREDI,,PRIMARIA,OFICIAL,RURAL,CERRADA DEFINITIVAMENTE,MONOLINGUE,MATUTINA,DIARIO(REGULAR),CHIQUIMULA
20-07-1975-43,20-015,CHIQUIMULA,ESQUIPULAS,EORM,CASERIO VALLE DE LA MUERTE ALDEA JAGUA,,LANDELINO CRUZ GARCIA,,PRIMARIA,OFICIAL,RURAL,CERRADA DEFINITIVAMENTE,MONOLINGUE,MATUTINA,DIARIO(REGULAR),CHIQUIMULA
20-07-1998-43,26-020,CHIQUIMULA,ESQUIPULAS,EDAC PRONADE,CASERIO EL INCIENSO ALDEA LAS PEQAS,,PROYECTO SEPREDI,,PRIMARIA,OFICIAL,RURAL,CERRADA DEFINITIVAMENTE,BILINGUE,MATUTINA,DIARIO(REGULAR),CHIQUIMULA
20-07-2029-43,26-020,CHIQUIMULA,ESQUIPULAS,EDAC -PRONADE-,CASERIO EL EMPEDRADO ALDEA JAGUA,,PROYECTO SEPREDI,,PRIMARIA,OFICIAL,RURAL,CERRADA DEFINITIVAMENTE,MONOLINGUE,MATUTINA,DIARIO(REGULAR),CHIQUIMULA
20-07-2030-43,26-020,CHIQUIMULA,ESQUIPULAS,EDAC -PRONADE-,CASERIO EL CAPUCAL ALDEA SAN ISIDRO,,PROYECTO SEPREDI,,PRIMARIA,OFICIAL,RURAL,CERRADA DEFINITIVAMENTE,MONOLINGUE,MATUTINA,DIARIO(REGULAR),CHIQUIMULA
20-07-2300-43,20-014,CHIQUIMULA,ESQUIPULAS,EMRM,CASERIO CANOAS ALDEA ATULAPA,,ERICK ESTUARDO ALVARADO GALVÁN,,PRIMARIA,MUNICIPAL,RURAL,CERRADA DEFINITIVAMENTE,MONOLINGUE,MATUTINA,DIARIO(REGULAR),CHIQUIMULA
20-07-2301-43,20-07-1176,CHIQUIMULA,ESQUIPULAS,EMRM ESCUELA MUNICIPAL RURAL MIXTA,CASERIO SAN CRISTOBAL ALDEA OLOPITA,58894692,DONELIA SARAÍ GUERRA ARANA,DULCE MARÍA VILLEDA ROSA,PRIMARIA,MUNICIPAL,RURAL,ABIERTA,MONOLINGUE,MATUTINA,DIARIO(REGULAR),CHIQUIMULA
20-07-2302-43,20-07-1175,CHIQUIMULA,ESQUIPULAS,ESCUELA MUNICIPAL RURAL MIXTA,CASERIO EL CERRON ALDEA ATULAPA,39671172,EDNA ODILIA ACEVED0,EDGAR JHOSSUE LÓPEZ GARCÍA,PRIMARIA,MUNICIPAL,RURAL,ABIERTA,MONOLINGUE,MATUTINA,DIARIO(REGULAR),CHIQUIMULA
20-07-2303-43,20-07-1171,CHIQUIMULA,ESQUIPULAS,EORM,"CASERIO VARALES, ALDEA CHANMAGUA",58910227,HEIDY ELIZABETH LÓPEZ GUERRA,ALBA LETICIA LEIVA ARGUETA,PRIMARIA,OFICIAL,RURAL,ABIERTA,MONOLINGUE,MATUTINA,DIARIO(REGULAR),CHIQUIMULA
20-07-2304-43,20-07-1175,CHIQUIMULA,ESQUIPULAS,EORM,"FINCA EL CASCAJAL, CASERIO EL BARRIAL, ALDEA SAN NICOLAS",41359677,EDNA ODILIA ACEVED0,OTONIEL RENE DIAZ ERAZO,PRIMARIA,OFICIAL,RURAL,ABIERTA,MONOLINGUE,MATUTINA,DIARIO(REGULAR),CHIQUIMULA
20-07-2369-43,20-014,CHIQUIMULA,ESQUIPULAS,EMRM,CASERIO EL ZAPOTE ALDEA BELEN,,ERICK ESTUARDO ALVARADO GALVÁN,,PRIMARIA,MUNICIPAL,RURAL,CERRADA DEFINITIVAMENTE,MONOLINGUE,MATUTINA,DIARIO(REGULAR),CHIQUIMULA
20-07-2370-43,20-07-1176,CHIQUIMULA,ESQUIPULAS,EOUM,"17A. QUINTA CALLE, COLONIA SAN MATEO 2, ZONA 2",49454565,DONELIA SARAÍ GUERRA ARANA,GLENDA ARGENTINA SÁNCHEZ,PRIMARIA,OFICIAL,URBANA,ABIERTA,MONOLINGUE,MATUTINA,DIARIO(REGULAR),CHIQUIMULA
20-07-2390-43,20-07-1175,CHIQUIMULA,ESQUIPULAS,EMRM ESCUELA MUNICIPAL RURAL MIXTA,"CASERIO DOS RIOS, ALDEA SAN ISIDRO",53801006,EDNA ODILIA ACEVED0,SANDY SUCELY LEMUS CORONADO,PRIMARIA,MUNICIPAL,RURAL,ABIERTA,MONOLINGUE,MATUTINA,DIARIO(REGULAR),CHIQUIMULA
20-07-2393-43,20-07-1175,CHIQUIMULA,ESQUIPULAS,EMRM,"CASERIO SAN NICOLAS ARRIBA, ALDEA SAN NICOLAS",49846975,EDNA ODILIA ACEVED0,REBECA NOVA MALDONADO,PRIMARIA,MUNICIPAL,RURAL,ABIERTA,MONOLINGUE,MATUTINA,DIARIO(REGULAR),CHIQUIMULA
20-07-2394-43,20-014,CHIQUIMULA,ESQUIPULAS,EMRM,CASERIO HORNO DE VIDES ALDEA ATULAPA,,ERICK ESTUARDO ALVARADO GALVÁN,,PRIMARIA,MUNICIPAL,RURAL,CERRADA DEFINITIVAMENTE,MONOLINGUE,MATUTINA,DIARIO(REGULAR),CHIQUIMULA
20-07-2395-43,20-07-1173,CHIQUIMULA,ESQUIPULAS,EMRM ESCUELA MUNICIPAL RURAL MIXTA,CASERIO EL MIRADOR ALDEA OLOPITA,46179694,LANDELINO CRÚZ GARCÍA,DINA MARIBEL PÉREZ,PRIMARIA,MUNICIPAL,RURAL,ABIERTA,MONOLINGUE,MATUTINA,DIARIO(REGULAR),CHIQUIMULA
20-07-2396-43,20-07-1175,CHIQUIMULA,ESQUIPULAS,EMRM,CASERIO CUESTA DEL PEDRERO ALDEA SAN ISIDRO,53063387,EDNA ODILIA ACEVED0,AXEL NEHEMIAS SANTOS MEJÍA,PRIMARIA,MUNICIPAL,RURAL,ABIERTA,MONOLINGUE,MATUTINA,DIARIO(REGULAR),CHIQUIMULA
20-07-2400-43,20-07-1173,CHIQUIMULA,ESQUIPULAS,EMRM ESCUELA MUNICIPAL RURAL MIXTA,CASERIO EL PEDREGAL ALDEA CHANMAGUA,32554146,LANDELINO CRÚZ GARCÍA,YASMÍN ESTEFANÍA CONTRERAS SAGASTUME,PRIMARIA,MUNICIPAL,RURAL,ABIERTA,MONOLINGUE,MATUTINA,DIARIO(REGULAR),CHIQUIMULA
20-07-2401-43,20-07-1176,CHIQUIMULA,ESQUIPULAS,EMRM ESCUELA MUNICIPAL RURAL MIXTA,CASERIO LA RINCONADA ALDEA CAFETALES,32368706,DONELIA SARAÍ GUERRA ARANA,DALIA MARÍA ARITA LANDAVERRY,PRIMARIA,MUNICIPAL,RURAL,ABIERTA,MONOLINGUE,MATUTINA,DIARIO(REGULAR),CHIQUIMULA
20-08-0001-43,20-08-1178,CHIQUIMULA,CONCEPCION LAS MINAS,EORM,CASERIO YAJAL ALDEA APANTES,54607020,VICTORIA NOEMÍ RECINOS VIDAL DE HERNÁNDEZ,MARÍA ANATALIA DUBÓN ALARCÓN,PRIMARIA,OFICIAL,RURAL,ABIERTA,MONOLINGUE,MATUTINA,DIARIO(REGULAR),CHIQUIMULA
20-08-0002-43,20-08-1178,CHIQUIMULA,CONCEPCION LAS MINAS,EORM,CANTON LAS GUACAMAYAS,55568618,VICTORIA NOEMÍ RECINOS VIDAL DE HERNÁNDEZ,SANDRA LORENA VÁSQUEZ,PRIMARIA,OFICIAL,RURAL,ABIERTA,MONOLINGUE,MATUTINA,DIARIO(REGULAR),CHIQUIMULA
20-08-0003-43,20-08-1177,CHIQUIMULA,CONCEPCION LAS MINAS,EORM,CASERIO LAS ANONAS ALDEA MONTE BARROSO,31441630,RICARDO URIEL SAMAYOA TRIGUEROS,YENY ODETH DÍAZ ROMERO,PRIMARIA,OFICIAL,RURAL,ABIERTA,MONOLINGUE,MATUTINA,DIARIO(REGULAR),CHIQUIMULA
20-08-0015-43,20-08-1178,CHIQUIMULA,CONCEPCION LAS MINAS,EORM,CASERIO EL LLANO ALDEA RODEO EL ESPINO,30287801,VICTORIA NOEMÍ RECINOS VIDAL DE HERNÁNDEZ,HILDA ROSSMARY MARTÍNEZ ALARCÓN,PRIMARIA,OFICIAL,RURAL,ABIERTA,MONOLINGUE,MATUTINA,DIARIO(REGULAR),CHIQUIMULA
20-08-0023-43,20-08-1177,CHIQUIMULA,CONCEPCION LAS MINAS,ESCUELA OFICIAL RURAL MIXTA,ALDEA MONTE BARROSO,47449822,RICARDO URIEL SAMAYOA TRIGUEROS,--,PRIMARIA,OFICIAL,RURAL,ABIERTA,MONOLINGUE,MATUTINA,DIARIO(REGULAR),CHIQUIMULA
20-08-0336-43,20-08-1178,CHIQUIMULA,CONCEPCION LAS MINAS,EOUM FERNANDA VELASQUEZ TORRES,A UN COSTADO DE LA MUNICIPALIDAD,56916921,VICTORIA NOEMÍ RECINOS VIDAL DE HERNÁNDEZ,MARÍA LETICIA MEJÍA MORALES,PRIMARIA,OFICIAL,URBANA,ABIERTA,MONOLINGUE,MATUTINA,DIARIO(REGULAR),CHIQUIMULA
20-08-0337-43,20-08-1178,CHIQUIMULA,CONCEPCION LAS MINAS,EORM ABRAHAM LINCOLN,ALDEA APANTES,48757147,VICTORIA NOEMÍ RECINOS VIDAL DE HERNÁNDEZ,YESENIA AMARILIS SANABRIA SAGASTUME,PRIMARIA,OFICIAL,RURAL,ABIERTA,MONOLINGUE,MATUTINA,DIARIO(REGULAR),CHIQUIMULA
20-08-0338-43,20-08-1178,CHIQUIMULA,CONCEPCION LAS MINAS,EORM,ALDEA GUACAMAYAS,30028499,VICTORIA NOEMÍ RECINOS VIDAL DE HERNÁNDEZ,MARTA LIDIA TRIGUEROS RAMÍREZ,PRIMARIA,OFICIAL,RURAL,ABIERTA,MONOLINGUE,MATUTINA,DIARIO(REGULAR),CHIQUIMULA
20-08-0339-43,20-08-1178,CHIQUIMULA,CONCEPCION LAS MINAS,EORM,ALDEA EL SOCORRO,33086912,VICTORIA NOEMÍ RECINOS VIDAL DE HERNÁNDEZ,EDGAR LEONEL FUENTES LEÓN,PRIMARIA,OFICIAL,RURAL,ABIERTA,MONOLINGUE,MATUTINA,DIARIO(REGULAR),CHIQUIMULA
20-08-0340-43,20-08-1177,CHIQUIMULA,CONCEPCION LAS MINAS,EORM,ALDEA CRUZ CALLE,55147650,RICARDO URIEL SAMAYOA TRIGUEROS,URBINA DEL CARMEN PALACIOS POSADAS,PRIMARIA,OFICIAL,RURAL,ABIERTA,MONOLINGUE,MATUTINA,DIARIO(REGULAR),CHIQUIMULA
20-08-0341-43,20-08-1177,CHIQUIMULA,CONCEPCION LAS MINAS,EORM,ALDEA ANGUIATU,46707269,RICARDO URIEL SAMAYOA TRIGUEROS,LOURDES VANESSA RIVERA QUIJADA,PRIMARIA,OFICIAL,RURAL,ABIERTA,MONOLINGUE,MATUTINA,DIARIO(REGULAR),CHIQUIMULA
20-08-0342-43,20-08-1177,CHIQUIMULA,CONCEPCION LAS MINAS,EORM,ALDEA SAN ANTONIO,42378780,RICARDO URIEL SAMAYOA TRIGUEROS,FREDY GEOBANY ORTEGA CANALES,PRIMARIA,OFICIAL,RURAL,ABIERTA,MONOLINGUE,MATUTINA,DIARIO(REGULAR),CHIQUIMULA
20-08-0343-43,20-08-1178,CHIQUIMULA,CONCEPCION LAS MINAS,EORM,ALDEA EL SACRAMENTO,42810648,VICTORIA NOEMÍ RECINOS VIDAL DE HERNÁNDEZ,JENIFFER IDANIA ROLDÁN PÉREZ,PRIMARIA,OFICIAL,RURAL,ABIERTA,MONOLINGUE,MATUTINA,DIARIO(REGULAR),CHIQUIMULA
20-08-0344-43,20-08-1178,CHIQUIMULA,CONCEPCION LAS MINAS,EORM,ALDEA DOLORES,53392292,VICTORIA NOEMÍ RECINOS VIDAL DE HERNÁNDEZ,MARITZA AZUCENA PORTILLO TRIGUEROS,PRIMARIA,OFICIAL,RURAL,ABIERTA,MONOLINGUE,MATUTINA,DIARIO(REGULAR),CHIQUIMULA
20-08-0345-43,20-08-1178,CHIQUIMULA,CONCEPCION LAS MINAS,EORM,ALDEA SAN JOSE,49832553,VICTORIA NOEMÍ RECINOS VIDAL DE HERNÁNDEZ,EDVIN ROLANDO POSADAS PORTILLO,PRIMARIA,OFICIAL,RURAL,ABIERTA,MONOLINGUE,MATUTINA,DIARIO(REGULAR),CHIQUIMULA
20-08-0346-43,20-08-1178,CHIQUIMULA,CONCEPCION LAS MINAS,EORM,ALDEA EL CAPULIN,30849926,VICTORIA NOEMÍ RECINOS VIDAL DE HERNÁNDEZ,ALVARINO DE JESÚS DUARTE MARTÍNEZ,PRIMARIA,OFICIAL,RURAL,ABIERTA,MONOLINGUE,MATUTINA,DIARIO(REGULAR),CHIQUIMULA
20-08-0347-43,20-08-1178,CHIQUIMULA,CONCEPCION LAS MINAS,EORM,ALDEA RODEO EL ESPINO,47797248,VICTORIA NOEMÍ RECINOS VIDAL DE HERNÁNDEZ,LUCIA BRILLITH POSADAS LÓPEZ,PRIMARIA,OFICIAL,RURAL,ABIERTA,MONOLINGUE,MATUTINA,DIARIO(REGULAR),CHIQUIMULA
20-08-0348-43,20-08-1178,CHIQUIMULA,CONCEPCION LAS MINAS,EORM,ALDEA EL JICARO,30960438,VICTORIA NOEMÍ RECINOS VIDAL DE HERNÁNDEZ,MARIELA JULISSA CORTEZ GUERRA,PRIMARIA,OFICIAL,RURAL,ABIERTA,MONOLINGUE,MATUTINA,DIARIO(REGULAR),CHIQUIMULA
20-08-0349-43,20-08-1178,CHIQUIMULA,CONCEPCION LAS MINAS,EORM,ALDEA LIQUIDAMBAR,57727240,VICTORIA NOEMÍ RECINOS VIDAL DE HERNÁNDEZ,FRANCIS ADRIAN GONZALES POSADAS,PRIMARIA,OFICIAL,RURAL,ABIERTA,MONOLINGUE,MATUTINA,DIARIO(REGULAR),CHIQUIMULA
20-08-0350-43,20-08-1177,CHIQUIMULA,CONCEPCION LAS MINAS,EORM PILAR DEL ANGEL GUERRA,ALDEA LA ERMITA,79437432,RICARDO URIEL SAMAYOA TRIGUEROS,LIGIA MARÍA POSADAS MORALES,PRIMARIA,OFICIAL,RURAL,ABIERTA,MONOLINGUE,MATUTINA,DIARIO(REGULAR),CHIQUIMULA
20-08-0351-43,20-08-1177,CHIQUIMULA,CONCEPCION LAS MINAS,EORM,ALDEA LA CAÑADA,,RICARDO URIEL SAMAYOA TRIGUEROS,,PRIMARIA,OFICIAL,RURAL,ABIERTA,MONOLINGUE,MATUTINA,DIARIO(REGULAR),CHIQUIMULA
20-08-0352-43,20-08-1177,CHIQUIMULA,CONCEPCION LAS MINAS,EORM,ALDEA VALERIANO,56361533,RICARDO URIEL SAMAYOA TRIGUEROS,JEAKELINE MARILÍ POSADAS POSADAS,PRIMARIA,OFICIAL,RURAL,ABIERTA,MONOLINGUE,MATUTINA,DIARIO(REGULAR),CHIQUIMULA
20-08-0353-43,20-08-1177,CHIQUIMULA,CONCEPCION LAS MINAS,EORM,CASERIO TISIZON ALDEA MONTE BARROSO,58830916,RICARDO URIEL SAMAYOA TRIGUEROS,RONALD MAKELVI RAMÍREZ RAMOS,PRIMARIA,OFICIAL,RURAL,ABIERTA,MONOLINGUE,MATUTINA,DIARIO(REGULAR),CHIQUIMULA
20-08-0354-43,20-08-1177,CHIQUIMULA,CONCEPCION LAS MINAS,EORM,ALDEA LA QUESERA,51145221,RICARDO URIEL SAMAYOA TRIGUEROS,EVER AROLDO CORTEZ GUERRA,PRIMARIA,OFICIAL,RURAL,ABIERTA,MONOLINGUE,MATUTINA,DIARIO(REGULAR),CHIQUIMULA
20-08-0355-43,20-08-1177,CHIQUIMULA,CONCEPCION LAS MINAS,EORM,ALDEA SANTA ANITA,51507055,RICARDO URIEL SAMAYOA TRIGUEROS,ANA LUISA ROMERO LÓPEZ,PRIMARIA,OFICIAL,RURAL,ABIERTA,MONOLINGUE,MATUTINA,DIARIO(REGULAR),CHIQUIMULA
20-08-0356-43,20-08-1177,CHIQUIMULA,CONCEPCION LAS MINAS,EORM,CASERIO LOS CONACASTES ALDEA LA ERMITA,57232443,RICARDO URIEL SAMAYOA TRIGUEROS,EDUARDO JOSE GALDAMEZ VELASQUEZ,PRIMARIA,OFICIAL,RURAL,ABIERTA,MONOLINGUE,MATUTINA,DIARIO(REGULAR),CHIQUIMULA
20-08-0357-43,20-040,CHIQUIMULA,CONCEPCION LAS MINAS,EORM,CASERIO LAS BURRAS ALDEA ANGUIATU,,SONIA FAVIOLA FRANCO GARCÍA,,PRIMARIA,OFICIAL,RURAL,CERRADA DEFINITIVAMENTE,MONOLINGUE,MATUTINA,DIARIO(REGULAR),CHIQUIMULA
20-08-0358-43,20-08-1178,CHIQUIMULA,CONCEPCION LAS MINAS,EORM,CASERIO SAN VICENTE ALDEA GUACAMAYAS,32263050,VICTORIA NOEMÍ RECINOS VIDAL DE HERNÁNDEZ,ANA LUCIA MORALES,PRIMARIA,OFICIAL,RURAL,ABIERTA,MONOLINGUE,MATUTINA,DIARIO(REGULAR),CHIQUIMULA
20-08-0359-43,20-08-1178,CHIQUIMULA,CONCEPCION LAS MINAS,EORM,ALDEA AGUA CALIENTE,32673709,VICTORIA NOEMÍ RECINOS VIDAL DE HERNÁNDEZ,CESIA ROSMERY AVILA MARÍN DE TORRES,PRIMARIA,OFICIAL,RURAL,ABIERTA,MONOLINGUE,MATUTINA,DIARIO(REGULAR),CHIQUIMULA
20-08-0360-43,20-08-1177,CHIQUIMULA,CONCEPCION LAS MINAS,EORM,CASERIO LA LEONA ALDEA LA ERMITA,59680920,RICARDO URIEL SAMAYOA TRIGUEROS,DEIDY ANTONIETA SANDOVAL CONTRERAS,PRIMARIA,OFICIAL,RURAL,ABIERTA,MONOLINGUE,MATUTINA,DIARIO(REGULAR),CHIQUIMULA
20-08-0361-43,20-08-1177,CHIQUIMULA,CONCEPCION LAS MINAS,EORM,CASERIO LOS LIMONES ALDEA CRUZ CALLE,56974765,RICARDO URIEL SAMAYOA TRIGUEROS,DUNIA LISBETH HERNÁNDEZ SAMAYOA,PRIMARIA,OFICIAL,RURAL,ABIERTA,MONOLINGUE,MATUTINA,DIARIO(REGULAR),CHIQUIMULA
20-08-0482-43,20-08-1177,CHIQUIMULA,CONCEPCION LAS MINAS,EORM,CASERIO LOS PLANES ALDEA CAÑADA,33155543,RICARDO URIEL SAMAYOA TRIGUEROS,JOSÉ ARIEL GARCÍA PORTILLO,PRIMARIA,OFICIAL,RURAL,ABIERTA,MONOLINGUE,MATUTINA,DIARIO(REGULAR),CHIQUIMULA
20-08-0483-43,20-08-1177,CHIQUIMULA,CONCEPCION LAS MINAS,EORM,CASERIO EL OBRAJE ALDEA SAN ANTONIO,58806456,RICARDO URIEL SAMAYOA TRIGUEROS,DUNIA LISSETH MARTÍNEZ PÉREZ,PRIMARIA,OFICIAL,RURAL,ABIERTA,MONOLINGUE,MATUTINA,DIARIO(REGULAR),CHIQUIMULA
20-08-0517-43,20-08-1177,CHIQUIMULA,CONCEPCION LAS MINAS,EORM,CASERIO LOS ALAMBRADOS ALDEA ANGUIATU,47927564,RICARDO URIEL SAMAYOA TRIGUEROS,SUSY MARIBEL SOTO BOJÓRQUEZ,PRIMARIA,OFICIAL,RURAL,ABIERTA,MONOLINGUE,MATUTINA,DIARIO(REGULAR),CHIQUIMULA
20-08-1096-43,20-08-1178,CHIQUIMULA,CONCEPCION LAS MINAS,EORM,CASERIO PLAN DEL TIGRE ALDEA LIQUIDAMBAR,54159366,VICTORIA NOEMÍ RECINOS VIDAL DE HERNÁNDEZ,OSCAR ANDRÉS GARZA GUILLÉN,PRIMARIA,OFICIAL,RURAL,ABIERTA,MONOLINGUE,MATUTINA,DIARIO(REGULAR),CHIQUIMULA
20-08-1097-43,,CHIQUIMULA,CONCEPCION LAS MINAS,EORM,ALDEA EL OBRAJE,,,,PRIMARIA,OFICIAL,RURAL,CERRADA DEFINITIVAMENTE,MONOLINGUE,MATUTINA,DIARIO(REGULAR),CHIQUIMULA
20-08-1098-43,20-026,CHIQUIMULA,CONCEPCION LAS MINAS,EORM,CASERIO EL AGUAJAL ALDEA EL SOCORRO,,JORGE ALBERTO SAAVEDRA LOPEZ,,PRIMARIA,OFICIAL,RURAL,CERRADA TEMPORALMENTE,MONOLINGUE,MATUTINA,DIARIO(REGULAR),CHIQUIMULA
20-08-1099-43,20-08-1178,CHIQUIMULA,CONCEPCION LAS MINAS,EORM,CASERIO CASA QUEMADA ALDEA APANTES,58277448,VICTORIA NOEMÍ RECINOS VIDAL DE HERNÁNDEZ,MAIRA JUDITH DUARTE AGUIRRE,PRIMARIA,OFICIAL,RURAL,ABIERTA,MONOLINGUE,MATUTINA,DIARIO(REGULAR),CHIQUIMULA
20-08-1100-43,20-08-1178,CHIQUIMULA,CONCEPCION LAS MINAS,EORM,CASERIO LLANO EL PLATANAR ALDEA RODEO EL ESPINO,30258343,VICTORIA NOEMÍ RECINOS VIDAL DE HERNÁNDEZ,BRENDA ELIZABETH SANABRIA DUARTE,PRIMARIA,OFICIAL,RURAL,ABIERTA,MONOLINGUE,MATUTINA,DIARIO(REGULAR),CHIQUIMULA
20-08-1132-43,,CHIQUIMULA,CONCEPCION LAS MINAS,EORM,CASERIO LOS LIMONES ALDEA CRUZ CALLE,,,,PRIMARIA,OFICIAL,RURAL,CERRADA DEFINITIVAMENTE,MONOLINGUE,MATUTINA,DIARIO(REGULAR),CHIQUIMULA
20-08-1154-43,,CHIQUIMULA,CONCEPCION LAS MINAS,EORM,CASA QUEMADA ALDEA APANTES,,,,PRIMARIA,OFICIAL,RURAL,CERRADA DEFINITIVAMENTE,MONOLINGUE,MATUTINA,DIARIO(REGULAR),CHIQUIMULA
20-08-1220-43,20-08-1177,CHIQUIMULA,CONCEPCION LAS MINAS,EORM,ALDEA LA CAÑADA,40509339,RICARDO URIEL SAMAYOA TRIGUEROS,LUIS ANGEL RUBALLOS CASTRO,PRIMARIA,OFICIAL,RURAL,ABIERTA,MONOLINGUE,VESPERTINA,DIARIO(REGULAR),CHIQUIMULA
20-08-1221-43,20-08-1177,CHIQUIMULA,CONCEPCION LAS MINAS,EORM,CASERIO EL OBRAJE ALDEA SAN ANTONIO,,RICARDO URIEL SAMAYOA TRIGUEROS,,PRIMARIA,OFICIAL,RURAL,ABIERTA,MONOLINGUE,VESPERTINA,DIARIO(REGULAR),CHIQUIMULA
20-08-1222-43,,CHIQUIMULA,CONCEPCION LAS MINAS,EORM,ALDEA LOMAS ARRIBA,,,,PRIMARIA,OFICIAL,RURAL,CERRADA DEFINITIVAMENTE,MONOLINGUE,VESPERTINA,DIARIO(REGULAR),CHIQUIMULA
20-08-1413-43,20-08-1178,CHIQUIMULA,CONCEPCION LAS MINAS,EORM,"CASERIO VALLE ARRIBA, ALDEA SAN JOSE",,VICTORIA NOEMÍ RECINOS VIDAL DE HERNÁNDEZ,LANDELINO CRUZ GARCÍA,PRIMARIA,OFICIAL,RURAL,ABIERTA,MONOLINGUE,VESPERTINA,DIARIO(REGULAR),CHIQUIMULA
20-08-1414-43,20-08-1178,CHIQUIMULA,CONCEPCION LAS MINAS,EORM,ALDEA RODEO EL ESPINO,,VICTORIA NOEMÍ RECINOS VIDAL DE HERNÁNDEZ,,PRIMARIA,OFICIAL,RURAL,ABIERTA,MONOLINGUE,VESPERTINA,DIARIO(REGULAR),CHIQUIMULA
20-08-1460-43,26-020,CHIQUIMULA,CONCEPCION LAS MINAS,EDAC - PRONADE -,CASERIO YAJAL ALDEA APANTES,,PROYECTO SEPREDI,,PRIMARIA,OFICIAL,RURAL,CERRADA DEFINITIVAMENTE,BILINGUE,MATUTINA,DIARIO(REGULAR),CHIQUIMULA
20-08-1461-43,26-020,CHIQUIMULA,CONCEPCION LAS MINAS,EDAC - PRONADE -,CANTON LAS GUACAMAYAS,,PROYECTO SEPREDI,,PRIMARIA,OFICIAL,RURAL,CERRADA DEFINITIVAMENTE,BILINGUE,MATUTINA,DIARIO(REGULAR),CHIQUIMULA
20-08-1462-43,26-021,CHIQUIMULA,CONCEPCION LAS MINAS,EDAC - PRONADE -,CASERIO EL LLANO RODEO EL ESPINO,,PROYECTO SEPREDI,,PRIMARIA,OFICIAL,RURAL,CERRADA DEFINITIVAMENTE,BILINGUE,MATUTINA,DIARIO(REGULAR),CHIQUIMULA
20-08-1464-43,,CHIQUIMULA,CONCEPCION LAS MINAS,EORM,CASERIO LOS PINTOS ALDEA HIERBA BUENA,,,,PRIMARIA,OFICIAL,RURAL,CERRADA TEMPORALMENTE,BILINGUE,MATUTINA,DIARIO(REGULAR),CHIQUIMULA
20-08-1465-43,,CHIQUIMULA,CONCEPCION LAS MINAS,EORM,CASERIO EL CHILE,,,,PRIMARIA,OFICIAL,RURAL,CERRADA TEMPORALMENTE,BILINGUE,MATUTINA,DIARIO(REGULAR),CHIQUIMULA
20-08-1466-43,,CHIQUIMULA,CONCEPCION LAS MINAS,EORM,,,,,PRIMARIA,OFICIAL,RURAL,CERRADA TEMPORALMENTE,BILINGUE,MATUTINA,DIARIO(REGULAR),CHIQUIMULA
20-08-1467-43,,CHIQUIMULA,CONCEPCION LAS MINAS,EORM,CASERIO EL ARENAL Y EL VALLE ALDEA HIERBA BUENA,,,,PRIMARIA,OFICIAL,RURAL,CERRADA TEMPORALMENTE,BILINGUE,MATUTINA,DIARIO(REGULAR),CHIQUIMULA
20-08-1654-43,20-08-1178,CHIQUIMULA,CONCEPCION LAS MINAS,EORM,ALDEA DOLORES,,VICTORIA NOEMÍ RECINOS VIDAL DE HERNÁNDEZ,,PRIMARIA,OFICIAL,RURAL,ABIERTA,MONOLINGUE,VESPERTINA,DIARIO(REGULAR),CHIQUIMULA
20-08-1655-43,20-040,CHIQUIMULA,CONCEPCION LAS MINAS,EORM,ALDEA APANTES,,SONIA FAVIOLA FRANCO GARCÍA,,PRIMARIA,OFICIAL,RURAL,CERRADA TEMPORALMENTE,MONOLINGUE,VESPERTINA,DIARIO(REGULAR),CHIQUIMULA
20-08-1656-43,,CHIQUIMULA,CONCEPCION LAS MINAS,EORM,ALDEA RODEO EL ESPINO,,,,PRIMARIA,OFICIAL,RURAL,CERRADA TEMPORALMENTE,MONOLINGUE,VESPERTINA,DIARIO(REGULAR),CHIQUIMULA
20-08-1721-43,26-021,CHIQUIMULA,CONCEPCION LAS MINAS,EDAC - PRONADE -,CASERIO EL OBISPO ALDEA LA CAÑADA,,PROYECTO SEPREDI,,PRIMARIA,OFICIAL,RURAL,CERRADA DEFINITIVAMENTE,MONOLINGUE,MATUTINA,DIARIO(REGULAR),CHIQUIMULA
20-08-1722-43,26-020,CHIQUIMULA,CONCEPCION LAS MINAS,EDAC - PRONADE -,CASERIO LAS ANONAS ALDEA MONTE BARROSO,,PROYECTO SEPREDI,,PRIMARIA,OFICIAL,RURAL,CERRADA DEFINITIVAMENTE,MONOLINGUE,MATUTINA,DIARIO(REGULAR),CHIQUIMULA
20-08-1723-43,,CHIQUIMULA,CONCEPCION LAS MINAS,EDAC - PRONADE -,CASERIO HUERTAS Y EL PAPAYO ALDEA APANTES,,,,PRIMARIA,OFICIAL,RURAL,CERRADA DEFINITIVAMENTE,MONOLINGUE,MATUTINA,DIARIO(REGULAR),CHIQUIMULA
20-08-1759-43,,CHIQUIMULA,CONCEPCION LAS MINAS,EDAC PRONADE,CASERIO RODEITO,,,,PRIMARIA,OFICIAL,RURAL,CERRADA DEFINITIVAMENTE,BILINGUE,MATUTINA,DIARIO(REGULAR),CHIQUIMULA
20-08-1760-43,,CHIQUIMULA,CONCEPCION LAS MINAS,EDAC PRONADE,CASERIO RODEO LAS LAJAS ALDEA MONTE BARROSO,,,,PRIMARIA,OFICIAL,RURAL,CERRADA DEFINITIVAMENTE,BILINGUE,MATUTINA,DIARIO(REGULAR),CHIQUIMULA
20-08-1902-43,20-08-1178,CHIQUIMULA,CONCEPCION LAS MINAS,EMRM,CASERIO EL PAPAYO ALDEA APANTES,49934215,VICTORIA NOEMÍ RECINOS VIDAL DE HERNÁNDEZ,JUAN ROBERTO GARCÍA PORTILLO,PRIMARIA,MUNICIPAL,RURAL,ABIERTA,MONOLINGUE,MATUTINA,DIARIO(REGULAR),CHIQUIMULA
20-08-1903-43,20-08-1178,CHIQUIMULA,CONCEPCION LAS MINAS,EMRM,CASERIO LAS CRUCES ALDEA APANTES,,VICTORIA NOEMÍ RECINOS VIDAL DE HERNÁNDEZ,ANGEL ALFREDO BARRIENTOS DUARTE,PRIMARIA,MUNICIPAL,RURAL,ABIERTA,MONOLINGUE,MATUTINA,DIARIO(REGULAR),CHIQUIMULA
20-08-2055-43,20-040,CHIQUIMULA,CONCEPCION LAS MINAS,EMRM,CASERIO SAN ISIDRO ALDEA CRUZ CALLE,79435559,SONIA FAVIOLA FRANCO GARCÍA,,PRIMARIA,MUNICIPAL,RURAL,CERRADA TEMPORALMENTE,MONOLINGUE,MATUTINA,DIARIO(REGULAR),CHIQUIMULA
20-08-2284-43,20-08-1177,CHIQUIMULA,CONCEPCION LAS MINAS,COLEGIO CRISTIANO CRISTO VIENE YA,"COLONIA BETHEL, ALDEA LA ERMITA",79437534,RICARDO URIEL SAMAYOA TRIGUEROS,BERFALITA MARTÍNEZ Y MARTÍNEZ,PRIMARIA,PRIVADO,RURAL,ABIERTA,MONOLINGUE,MATUTINA,DIARIO(REGULAR),CHIQUIMULA
20-08-2290-43,20-08-1178,CHIQUIMULA,CONCEPCION LAS MINAS,EMRM,CASERIO EL LIMITE ALDEA EL CAPULIN,,VICTORIA NOEMÍ RECINOS VIDAL DE HERNÁNDEZ,,PRIMARIA,MUNICIPAL,RURAL,ABIERTA,MONOLINGUE,MATUTINA,DIARIO(REGULAR),CHIQUIMULA
20-08-2384-43,20-08-1177,CHIQUIMULA,CONCEPCION LAS MINAS,EMRM,CASERIO EL PINAL ALDEA LA CAÑADA,,RICARDO URIEL SAMAYOA TRIGUEROS,GERSON NOEL GUILLÉN MONTOYA,PRIMARIA,MUNICIPAL,RURAL,ABIERTA,MONOLINGUE,MATUTINA,DIARIO(REGULAR),CHIQUIMULA
20-08-2398-43,20-08-1178,CHIQUIMULA,CONCEPCION LAS MINAS,EMRM,CASERIO EL OBISPO ALDEA LA CAÑADA,46660290,VICTORIA NOEMÍ RECINOS VIDAL DE HERNÁNDEZ,BRENDA ESTELA RUBALLOS CASTRO,PRIMARIA,MUNICIPAL,RURAL,ABIERTA,MONOLINGUE,MATUTINA,DIARIO(REGULAR),CHIQUIMULA
20-09-0007-43,20-09-1181,CHIQUIMULA,QUEZALTEPEQUE,EORM,ALDEA POTRERILLOS,45909357,SONIA FAVIOLA FRANCO GARCÍA DE CALDERON,MELISSA GLORIBEL ROSAS LÓPEZ,PRIMARIA,OFICIAL,RURAL,ABIERTA,MONOLINGUE,MATUTINA,DIARIO(REGULAR),CHIQUIMULA
20-09-0008-43,20-09-1179,CHIQUIMULA,QUEZALTEPEQUE,EORM,CASERIO MORRO GRANDE ALDEA SAN NICOLAS,59091050,ARCENY JOSUÉ MORALES REYES,ODILIA CONSUELO AGOSTO VÁSQUEZ,PRIMARIA,OFICIAL,RURAL,ABIERTA,MONOLINGUE,MATUTINA,DIARIO(REGULAR),CHIQUIMULA
20-09-0009-43,20-09-1181,CHIQUIMULA,QUEZALTEPEQUE,EORM,CASERIO CIMARRON ALDEA PALMILLA,31447634,SONIA FAVIOLA FRANCO GARCÍA DE CALDERON,ABNER RENÉ LÁZARO MARTÍNEZ,PRIMARIA,OFICIAL,RURAL,ABIERTA,MONOLINGUE,MATUTINA,DIARIO(REGULAR),CHIQUIMULA
20-09-0010-43,20-09-1180,CHIQUIMULA,QUEZALTEPEQUE,EORM,CASERIO SAN JACINTILLO ALDEA RIO GRANDE,55671659,MARÍA ROSSALYN LANDAVERRY LÓPEZ DE URRUTIA,JORGE LUIS GONZÁLEZ MIGUEL,PRIMARIA,OFICIAL,RURAL,ABIERTA,MONOLINGUE,MATUTINA,DIARIO(REGULAR),CHIQUIMULA
20-09-0011-43,20-09-1179,CHIQUIMULA,QUEZALTEPEQUE,EORM,CASERIO TITOQUE ALDEA LLANO GALAN,59973283,ARCENY JOSUÉ MORALES REYES,MARIO RENÉ RAMOS CRUZ,PRIMARIA,OFICIAL,RURAL,ABIERTA,BILINGUE,MATUTINA,DIARIO(REGULAR),CHIQUIMULA
