0,1,2,3,4,5,6,7,8,9,10,11,12,13,14,15,16
CODIGO,DISTRITO,DEPARTAMENTO,MUNICIPIO,ESTABLECIMIENTO,DIRECCION,TELEFONO,SUPERVISOR,DIRECTOR,NIVEL,SECTOR,AREA,STATUS,MODALIDAD,JORNADA,PLAN,DEPARTAMENTAL
20-01-0008-43,20-01-1145,CHIQUIMULA,CHIQUIMULA,"EOUM ""MACARIO RIVAS""",4A CALLE 8-51 ZONA 1,42535907,LUIS GUSTAVO SAGASTUME CONTRERAS,ROXANA LISBETH URRUTIA PINTO,PRIMARIA,OFICIAL,URBANA,ABIERTA,MONOLINGUE,MATUTINA,DIARIO(REGULAR),CHIQUIMULA
20-01-0009-43,20-01-1143,CHIQUIMULA,CHIQUIMULA,EOUV NO. 1 ABRAHAM A CEREZO,10A AVE 3-10 ZONA 1,42212915,NINETH DEL ROSARIO MORALES SANCE DE REYES,RAÚL EDGARDO VILLEDA HERNÁNDEZ,PRIMARIA,OFICIAL,URBANA,ABIERTA,MONOLINGUE,MATUTINA,DIARIO(REGULAR),CHIQUIMULA
20-01-0010-43,20-01-1143,CHIQUIMULA,CHIQUIMULA,EOUM VICENTE CARRANZA LEMUS JM,9A. CALLE ZONA 4,37824729,NINETH DEL ROSARIO MORALES SANCE DE REYES,ZABDI ISMERAI SANCÉ GALDÁMEZ,PRIMARIA,OFICIAL,URBANA,ABIERTA,MONOLINGUE,MATUTINA,DIARIO(REGULAR),CHIQUIMULA
20-01-0011-43,20-01-1143,CHIQUIMULA,CHIQUIMULA,EOUN NO. 2 FLORENCIO MENDEZ,3A CALLE 4-51 ZONA 1,79421130,NINETH DEL ROSARIO MORALES SANCE DE REYES,BRENDA LISSETTE FLORES PALENCIA,PRIMARIA,OFICIAL,URBANA,ABIERTA,MONOLINGUE,MATUTINA,DIARIO(REGULAR),CHIQUIMULA
20-01-0012-43,20-01-1143,CHIQUIMULA,CHIQUIMULA,EOUN NO.1 'JUAN MANUEL AGUIRRE',3A CALLE 4-51 ZONA 1,51309572,NINETH DEL ROSARIO MORALES SANCE DE REYES,JOSÉ ALFREDO ESTRADA ALAS,PRIMARIA,OFICIAL,URBANA,ABIERTA,MONOLINGUE,VESPERTINA,DIARIO(REGULAR),CHIQUIMULA
20-01-0013-43,20-01-1148,CHIQUIMULA,CHIQUIMULA,EOUM DE APLICACION ANEXA A INSO,"1A CALLE ENTRE 2A. Y 3A. AVENIDA, ZONA 2, COLONIA LONE",38794036,SILVIA MARILENA BUEZO MARTÍNEZ,LICINIO FLORES SAGASTUME,PRIMARIA,OFICIAL,URBANA,ABIERTA,MONOLINGUE,VESPERTINA,DIARIO(REGULAR),CHIQUIMULA
20-01-0014-43,20-01-1143,CHIQUIMULA,CHIQUIMULA,EOUN NO. 3 TRANSITO FLORES MORALES,10A AVE 3-10 ZONA 1,32083119,NINETH DEL ROSARIO MORALES SANCE DE REYES,FLORA SAGASTUME SAGASTUME,PRIMARIA,OFICIAL,URBANA,ABIERTA,MONOLINGUE,VESPERTINA,DIARIO(REGULAR),CHIQUIMULA
20-01-0015-43,20-01-1142,CHIQUIMULA,CHIQUIMULA,EOUM MARIA ALBERTINA SALGUERO BRACAMONTE,4A CALLE 1-42 ZONA 1,79426481,CÉSAR ADALBERTO NOGUERA JÁCOME,RUDY ARNOLDO CHEGÜÉN GUZMÁN,PRIMARIA,OFICIAL,URBANA,ABIERTA,MONOLINGUE,MATUTINA,DIARIO(REGULAR),CHIQUIMULA
20-01-0016-43,20-01-1143,CHIQUIMULA,CHIQUIMULA,EOUM DE APLICACION ANEXA A INVO,"4A CALLE Y 6A AVENIDA, ZONA 1",58155574,NINETH DEL ROSARIO MORALES SANCE DE REYES,LISIDIA DEL PILAR ESPAÑA ARIAS,PRIMARIA,OFICIAL,URBANA,ABIERTA,MONOLINGUE,VESPERTINA,DIARIO(REGULAR),CHIQUIMULA
20-01-0017-43,20-01-1148,CHIQUIMULA,CHIQUIMULA,"COLEGIO EVANGÉLICO MIXTO ""AMIGOS""",10MA. AVENIDA 5-38 ZONA 1,79420116,SILVIA MARILENA BUEZO MARTÍNEZ,LILIAN ARACELY SALAZAR PÉREZ,PRIMARIA,PRIVADO,URBANA,ABIERTA,MONOLINGUE,MATUTINA,DIARIO(REGULAR),CHIQUIMULA
20-01-0018-43,20-01-1144,CHIQUIMULA,CHIQUIMULA,COLEGIO PRIVADO MIXTO 'SAGRADA FAMILIA',6A AVE 5-68 ZONA 1,79420232,CESAR HELAMAN GARCÍA LÓPEZ,IRMA CARLOTA MIRANDA CALDERON,PRIMARIA,PRIVADO,URBANA,ABIERTA,MONOLINGUE,MATUTINA,DIARIO(REGULAR),CHIQUIMULA
20-01-0019-43,,CHIQUIMULA,CHIQUIMULA,EPUM DE APLICACION INSTITUTO 'MODERNO CHIQUIMULTECO',4A CALLE 9-30 ZONA 1,,,,PRIMARIA,PRIVADO,URBANA,CERRADA TEMPORALMENTE,MONOLINGUE,MATUTINA,DIARIO(REGULAR),CHIQUIMULA
20-01-0020-43,20-024,CHIQUIMULA,CHIQUIMULA,ESCUELA SECUNDARIA PRIVADA MIXTA DE ORIENTE -ESDEO-,2A CALLE 4-40 ZONA 1,79420290,SILVIA MARILENA BUEZO MARTINEZ,ERWIN LEONEL COLINDRES MONROY,PRIMARIA,PRIVADO,URBANA,CERRADA DEFINITIVAMENTE,MONOLINGUE,MATUTINA,DIARIO(REGULAR),CHIQUIMULA
20-01-0021-43,20-01-1148,CHIQUIMULA,CHIQUIMULA,"COLEGIO PRIVADO MIXTO ""JUGANDO APRENDO""","4 CALLE A 13-25, ZONA 1",79420373,SILVIA MARILENA BUEZO MARTÍNEZ,BERTA GLADYS BRENES HERNÁNDEZ,PRIMARIA,PRIVADO,URBANA,ABIERTA,MONOLINGUE,MATUTINA,DIARIO(REGULAR),CHIQUIMULA
20-01-0049-43,20-01-1149,CHIQUIMULA,CHIQUIMULA,EORM,ALDEA EL GUAYABO,55719020,BYRON HORACIO SARCEÑO ZEPEDA,YOSMARA LISBETH RODRÍGUEZ DUARTE,PRIMARIA,OFICIAL,RURAL,ABIERTA,MONOLINGUE,MATUTINA,DIARIO(REGULAR),CHIQUIMULA
20-01-0050-43,20-01-1144,CHIQUIMULA,CHIQUIMULA,EORM,ALDEA HACIENDA EL SANTO,56231451,CESAR HELAMAN GARCÍA LÓPEZ,ANGEL ARMANDO GUANCÍN SANCÉ,PRIMARIA,OFICIAL,RURAL,ABIERTA,MONOLINGUE,MATUTINA,DIARIO(REGULAR),CHIQUIMULA
20-01-0051-43,20-01-1147,CHIQUIMULA,CHIQUIMULA,EORM,ALDEA LA CATOCHA,32436040,VALESKA LILIAM ESPERANZA ARGUETA REYES,IRVIN KELER NOVA POSADAS,PRIMARIA,OFICIAL,RURAL,ABIERTA,MONOLINGUE,MATUTINA,DIARIO(REGULAR),CHIQUIMULA
20-01-0052-43,20-01-1145,CHIQUIMULA,CHIQUIMULA,EORM,ALDEA EL INGENIERO,41607629,LUIS GUSTAVO SAGASTUME CONTRERAS,VILMA GISELA ESPANA ALARCON,PRIMARIA,OFICIAL,RURAL,ABIERTA,MONOLINGUE,MATUTINA,DIARIO(REGULAR),CHIQUIMULA
20-01-0053-43,,CHIQUIMULA,CHIQUIMULA,EORM,ALDEA LOS PINOS,,,,PRIMARIA,OFICIAL,RURAL,CERRADA TEMPORALMENTE,MONOLINGUE,MATUTINA,DIARIO(REGULAR),CHIQUIMULA
20-01-0054-43,20-01-1143,CHIQUIMULA,CHIQUIMULA,EORM,ALDEA SANTA ELENA,51297060,NINETH DEL ROSARIO MORALES SANCE DE REYES,ALEX JOEL CORONADO LOPEZ,PRIMARIA,OFICIAL,RURAL,ABIERTA,MONOLINGUE,MATUTINA,DIARIO(REGULAR),CHIQUIMULA
20-01-0055-43,20-01-1148,CHIQUIMULA,CHIQUIMULA,EORM LUCAS ANTONIO CUEVAS,ALDEA SHUSHO ARRIBA,30355935,SILVIA MARILENA BUEZO MARTÍNEZ,EDVIN ROSALES IGNACIO,PRIMARIA,OFICIAL,RURAL,ABIERTA,MONOLINGUE,MATUTINA,DIARIO(REGULAR),CHIQUIMULA
20-01-0056-43,20-01-1142,CHIQUIMULA,CHIQUIMULA,EORM PROFESORA MARIA OCTAVILA GUTIERREZ DE ESPAÑA,ALDEA SHORORAGUA,50373500,CÉSAR ADALBERTO NOGUERA JÁCOME,WILLIAM ALEXANDER SANCÉ ESQUIVEL,PRIMARIA,OFICIAL,RURAL,ABIERTA,MONOLINGUE,MATUTINA,DIARIO(REGULAR),CHIQUIMULA
20-01-0057-43,20-01-1144,CHIQUIMULA,CHIQUIMULA,EORM PROFESOR DE ENSEÑANZA MEDIA ERNESTO DE JESUS SAGASTUME GUERRA,ALDEA VADO HONDO,42772793,CESAR HELAMAN GARCÍA LÓPEZ,MARÍA ISABEL CALDERÓN MEDRANO,PRIMARIA,OFICIAL,RURAL,ABIERTA,MONOLINGUE,MATUTINA,DIARIO(REGULAR),CHIQUIMULA
20-01-0058-43,20-01-1144,CHIQUIMULA,CHIQUIMULA,EORM,ALDEA EL MORRAL,45853094,CESAR HELAMAN GARCÍA LÓPEZ,AMY ROSA ALICIA MORALES ESPAÑA,PRIMARIA,OFICIAL,RURAL,ABIERTA,MONOLINGUE,MATUTINA,DIARIO(REGULAR),CHIQUIMULA
20-01-0059-43,20-01-1145,CHIQUIMULA,CHIQUIMULA,EORM MARIA CHINCHILLA,ALDEA PETAPILLA,52463442,LUIS GUSTAVO SAGASTUME CONTRERAS,ALEXIS RIGOBERTO MÉNDEZ HERNÁNDEZ,PRIMARIA,OFICIAL,RURAL,ABIERTA,MONOLINGUE,MATUTINA,DIARIO(REGULAR),CHIQUIMULA
20-01-0060-43,20-01-1149,CHIQUIMULA,CHIQUIMULA,EORM HECTOR MANUEL VASQUEZ,ALDEA MARAXCO,51221404,BYRON HORACIO SARCEÑO ZEPEDA,MARINA ESPERANZA PAREDES CETINO,PRIMARIA,OFICIAL,RURAL,ABIERTA,MONOLINGUE,MATUTINA,DIARIO(REGULAR),CHIQUIMULA
20-01-0061-43,,CHIQUIMULA,CHIQUIMULA,EORM,ALDEA SAN JORGE,,,,PRIMARIA,OFICIAL,RURAL,CERRADA TEMPORALMENTE,MONOLINGUE,MATUTINA,DIARIO(REGULAR),CHIQUIMULA
20-01-0062-43,20-01-1144,CHIQUIMULA,CHIQUIMULA,EORM,ALDEA SILLON ARRIBA,58270115,CESAR HELAMAN GARCÍA LÓPEZ,SAYMA ODBELY GALLARDO FLORES,PRIMARIA,OFICIAL,RURAL,ABIERTA,MONOLINGUE,MATUTINA,DIARIO(REGULAR),CHIQUIMULA
20-01-0063-43,20-01-1148,CHIQUIMULA,CHIQUIMULA,EORM,ALDEA YOR,47742506,SILVIA MARILENA BUEZO MARTÍNEZ,GUSTAVO ADOLFO ROSALES IGNACIO,PRIMARIA,OFICIAL,RURAL,ABIERTA,MONOLINGUE,MATUTINA,DIARIO(REGULAR),CHIQUIMULA
20-01-0064-43,20-01-1187,CHIQUIMULA,CHIQUIMULA,EORM,ALDEA SANTA BARBARA,30685292,KAREN SUCETH GUERRA CALDERÓN,CESAR EVILIO FUENTES SINTUJ,PRIMARIA,OFICIAL,RURAL,ABIERTA,MONOLINGUE,MATUTINA,DIARIO(REGULAR),CHIQUIMULA
20-01-0065-43,20-01-1144,CHIQUIMULA,CHIQUIMULA,EORM ROBERTO ANTONIO VILLEDA SANTIS,ALDEA EL JICARAL,51507352,CESAR HELAMAN GARCÍA LÓPEZ,ROLANDO GUALBERTO SAAVEDRA INTERIANO,PRIMARIA,OFICIAL,RURAL,ABIERTA,MONOLINGUE,MATUTINA,DIARIO(REGULAR),CHIQUIMULA
20-01-0066-43,20-01-1142,CHIQUIMULA,CHIQUIMULA,EORM,ALDEA TACO ARRIBA,41000689,CÉSAR ADALBERTO NOGUERA JÁCOME,ALLAN ABRAHAM GÓMEZ MORALES,PRIMARIA,OFICIAL,RURAL,ABIERTA,MONOLINGUE,MATUTINA,DIARIO(REGULAR),CHIQUIMULA
20-01-0067-43,20-01-1143,CHIQUIMULA,CHIQUIMULA,EORM ERNESTO R. LARA,ALDEA SAN ESTEBAN,32203067,NINETH DEL ROSARIO MORALES SANCE DE REYES,AURA VIOLETA MONROY BERRÍOS,PRIMARIA,OFICIAL,RURAL,ABIERTA,MONOLINGUE,MATUTINA,DIARIO(REGULAR),CHIQUIMULA
20-01-0068-43,20-01-1147,CHIQUIMULA,CHIQUIMULA,EORM,ALDEA TIERRA BLANCA,53825777,VALESKA LILIAM ESPERANZA ARGUETA REYES,RAÚL ALBERTO ESPAÑA MOLINA,PRIMARIA,OFICIAL,RURAL,ABIERTA,MONOLINGUE,MATUTINA,DIARIO(REGULAR),CHIQUIMULA
20-01-0069-43,20-01-1149,CHIQUIMULA,CHIQUIMULA,EORM 'MANUEL VICENTE CASTANEDA',ALDEA EL PINALITO,58423242,BYRON HORACIO SARCEÑO ZEPEDA,HUGO FRANCISCO BORRAYO ROCA,PRIMARIA,OFICIAL,RURAL,ABIERTA,MONOLINGUE,MATUTINA,DIARIO(REGULAR),CHIQUIMULA
20-01-0070-43,20-01-1147,CHIQUIMULA,CHIQUIMULA,EORM,ALDEA EL BARREAL,48532002,VALESKA LILIAM ESPERANZA ARGUETA REYES,HENRY ANIBAL ZECEÑA CERÍN,PRIMARIA,OFICIAL,RURAL,ABIERTA,MONOLINGUE,MATUTINA,DIARIO(REGULAR),CHIQUIMULA
20-01-0071-43,20-01-1144,CHIQUIMULA,CHIQUIMULA,EORM 'GILBERTO ZEA AVELAR',ALDEA SILLON ABAJO,45826181,CESAR HELAMAN GARCÍA LÓPEZ,JULIO YOVANI SANCE CHEGUEN,PRIMARIA,OFICIAL,RURAL,ABIERTA,MONOLINGUE,MATUTINA,DIARIO(REGULAR),CHIQUIMULA
20-01-0072-43,20-01-1143,CHIQUIMULA,CHIQUIMULA,EORM RAUL MEJIA GONZALEZ,ALDEA SABANA GRANDE,59999599,NINETH DEL ROSARIO MORALES SANCE DE REYES,XIOMARA EUNICE MORALES SOSA,PRIMARIA,OFICIAL,RURAL,ABIERTA,MONOLINGUE,MATUTINA,DIARIO(REGULAR),CHIQUIMULA
20-01-0073-43,20-01-1146,CHIQUIMULA,CHIQUIMULA,EORM,ALDEA EL PALMAR,42014242,MERY ELISABET CALDERÓN CASTILLO,VÍCTOR MÉNDEZ PAREDES,PRIMARIA,OFICIAL,RURAL,ABIERTA,MONOLINGUE,MATUTINA,DIARIO(REGULAR),CHIQUIMULA
20-01-0074-43,20-01-1145,CHIQUIMULA,CHIQUIMULA,EORM ALICIA RAQUEL TOLEDO,ALDEA SAN ANTONIO,40651787,LUIS GUSTAVO SAGASTUME CONTRERAS,ISAIAS DE JESUS AVILA PEREZ,PRIMARIA,OFICIAL,RURAL,ABIERTA,MONOLINGUE,MATUTINA,DIARIO(REGULAR),CHIQUIMULA
20-01-0075-43,20-01-1142,CHIQUIMULA,CHIQUIMULA,EORM PEDRO MOLINA,ALDEA VEGA ARRIBA,41276110,CÉSAR ADALBERTO NOGUERA JÁCOME,MARIA ANTONIA VILLEDA PAIZ,PRIMARIA,OFICIAL,RURAL,ABIERTA,MONOLINGUE,MATUTINA,DIARIO(REGULAR),CHIQUIMULA
20-01-0076-43,20-01-1149,CHIQUIMULA,CHIQUIMULA,EORM,ALDEA EL CONACASTE,56943523,BYRON HORACIO SARCEÑO ZEPEDA,GABRIEL UBALDO GUANCÍN MORALES,PRIMARIA,OFICIAL,RURAL,ABIERTA,MONOLINGUE,MATUTINA,DIARIO(REGULAR),CHIQUIMULA
20-01-0077-43,20-01-1142,CHIQUIMULA,CHIQUIMULA,EORM,CASERIO EL MAGUEYAL ALDEA SHORORAGUA,37647379,CÉSAR ADALBERTO NOGUERA JÁCOME,EDY VINICIO MINER ALONZO,PRIMARIA,OFICIAL,RURAL,ABIERTA,MONOLINGUE,MATUTINA,DIARIO(REGULAR),CHIQUIMULA
20-01-0078-43,20-01-1147,CHIQUIMULA,CHIQUIMULA,EORM,ALDEA EL MATAZANO,42436889,VALESKA LILIAM ESPERANZA ARGUETA REYES,ODILIA ESPINO VILLELA,PRIMARIA,OFICIAL,RURAL,ABIERTA,MONOLINGUE,MATUTINA,DIARIO(REGULAR),CHIQUIMULA
20-01-0079-43,20-01-1149,CHIQUIMULA,CHIQUIMULA,EORM,ALDEA LAS TABLAS,30196834,BYRON HORACIO SARCEÑO ZEPEDA,DORIS LETICIA ROSALES FELIPE,PRIMARIA,OFICIAL,RURAL,ABIERTA,MONOLINGUE,MATUTINA,DIARIO(REGULAR),CHIQUIMULA
20-01-0080-43,20-01-1149,CHIQUIMULA,CHIQUIMULA,EORM,ALDEA EL DURAZNO,37939906,BYRON HORACIO SARCEÑO ZEPEDA,GERSON JOSUÉ SAZO CASTAÑEDA,PRIMARIA,OFICIAL,RURAL,ABIERTA,MONOLINGUE,MATUTINA,DIARIO(REGULAR),CHIQUIMULA
20-01-0081-43,20-01-1187,CHIQUIMULA,CHIQUIMULA,EORM,ALDEA LA PUERTA,33523325,KAREN SUCETH GUERRA CALDERÓN,KEILA MAOLI BRENES CALDERÓN,PRIMARIA,OFICIAL,RURAL,ABIERTA,MONOLINGUE,MATUTINA,DIARIO(REGULAR),CHIQUIMULA
20-01-0082-43,20-01-1145,CHIQUIMULA,CHIQUIMULA,EORM,ALDEA SAN MIGUEL,59416065,LUIS GUSTAVO SAGASTUME CONTRERAS,VICTOR HUGO FRANCO ESPINO,PRIMARIA,OFICIAL,RURAL,ABIERTA,MONOLINGUE,MATUTINA,DIARIO(REGULAR),CHIQUIMULA
20-01-0083-43,20-01-1145,CHIQUIMULA,CHIQUIMULA,EORM 'MARIO MORALES MONROY',ALDEA SHUSHO ABAJO,79421274,LUIS GUSTAVO SAGASTUME CONTRERAS,MILVI NINETH MÉNDEZ,PRIMARIA,OFICIAL,RURAL,ABIERTA,MONOLINGUE,MATUTINA,DIARIO(REGULAR),CHIQUIMULA
20-01-0084-43,20-01-1147,CHIQUIMULA,CHIQUIMULA,EORM,ALDEA LAGUNA EL JUTE,51437435,VALESKA LILIAM ESPERANZA ARGUETA REYES,ELISA JOHANA RAMÍREZ LOBOS,PRIMARIA,OFICIAL,RURAL,ABIERTA,MONOLINGUE,MATUTINA,DIARIO(REGULAR),CHIQUIMULA
20-01-0086-43,,CHIQUIMULA,CHIQUIMULA,EORM,CASERIO EL SAUCE ALDEA LA CATOCHA,,,,PRIMARIA,OFICIAL,RURAL,CERRADA TEMPORALMENTE,MONOLINGUE,MATUTINA,DIARIO(REGULAR),CHIQUIMULA
20-01-0087-43,20-01-1187,CHIQUIMULA,CHIQUIMULA,EORM,ALDEA TABLON DE LA NUEVA ESPERANZA,40272594,KAREN SUCETH GUERRA CALDERÓN,DENIS MANRIQUE DUARTE GARCÍA,PRIMARIA,OFICIAL,RURAL,ABIERTA,MONOLINGUE,MATUTINA,DIARIO(REGULAR),CHIQUIMULA
20-01-0088-43,20-01-1145,CHIQUIMULA,CHIQUIMULA,EORM,CASERIO PASO DEL CREDO ALDEA PETAPILLA,52799862,LUIS GUSTAVO SAGASTUME CONTRERAS,MARIELA ANAISABEL MONROY VILLELA,PRIMARIA,OFICIAL,RURAL,ABIERTA,MONOLINGUE,MATUTINA,DIARIO(REGULAR),CHIQUIMULA
20-01-0089-43,20-01-1142,CHIQUIMULA,CHIQUIMULA,EORM,CASERIO TERRERO BARROSO ALDEA TACO ARRIBA,49856902,CÉSAR ADALBERTO NOGUERA JÁCOME,HENSER GEOVANY AJURIN MONROY,PRIMARIA,OFICIAL,RURAL,ABIERTA,MONOLINGUE,MATUTINA,DIARIO(REGULAR),CHIQUIMULA
20-01-0090-43,20-01-1187,CHIQUIMULA,CHIQUIMULA,EORM,ALDEA TABLON DEL OCOTAL,54985854,KAREN SUCETH GUERRA CALDERÓN,LUIS ALFONSO CABRERA PESQUERA,PRIMARIA,OFICIAL,RURAL,ABIERTA,MONOLINGUE,MATUTINA,DIARIO(REGULAR),CHIQUIMULA
20-01-0091-43,20-01-1144,CHIQUIMULA,CHIQUIMULA,EORM,ALDEA TICANLU,56153204,CESAR HELAMAN GARCÍA LÓPEZ,MARÍA ELENA CRISÓSTOMO CRISÓSTOMO,PRIMARIA,OFICIAL,RURAL,ABIERTA,MONOLINGUE,MATUTINA,DIARIO(REGULAR),CHIQUIMULA
20-01-0092-43,20-01-1146,CHIQUIMULA,CHIQUIMULA,EORM,ALDEA PLAN DEL GUINEO,,MERY ELISABET CALDERÓN CASTILLO,DINA JUDITH MEDINA PALMA,PRIMARIA,OFICIAL,RURAL,ABIERTA,MONOLINGUE,MATUTINA,DIARIO(REGULAR),CHIQUIMULA
20-01-0093-43,20-01-1187,CHIQUIMULA,CHIQUIMULA,EORM,ALDEA TAPAZAN,48157489,KAREN SUCETH GUERRA CALDERÓN,EDWARD ALBERTO MARTINEZ FLORES,PRIMARIA,OFICIAL,RURAL,ABIERTA,MONOLINGUE,MATUTINA,DIARIO(REGULAR),CHIQUIMULA
20-01-0094-43,20-01-1147,CHIQUIMULA,CHIQUIMULA,EORM,CASERIO EL SAUCE ALDEA LA CATOCHA,30301166,VALESKA LILIAM ESPERANZA ARGUETA REYES,EILEEN LIZBETH LINARES VILLAFUERTE,PRIMARIA,OFICIAL,RURAL,ABIERTA,MONOLINGUE,MATUTINA,DIARIO(REGULAR),CHIQUIMULA
20-01-0095-43,20-01-1187,CHIQUIMULA,CHIQUIMULA,EORM,ALDEA PUERTA DE LA MONTAÑA,47190783,KAREN SUCETH GUERRA CALDERÓN,MILTON ISAAC RODAS RECINOS,PRIMARIA,OFICIAL,RURAL,ABIERTA,MONOLINGUE,MATUTINA,DIARIO(REGULAR),CHIQUIMULA
20-01-0096-43,20-01-1147,CHIQUIMULA,CHIQUIMULA,EORM,ALDEA LA LAGUNA,57805114,VALESKA LILIAM ESPERANZA ARGUETA REYES,NERY ABIGAIL MINER CERVANTES,PRIMARIA,OFICIAL,RURAL,ABIERTA,MONOLINGUE,MATUTINA,DIARIO(REGULAR),CHIQUIMULA
20-01-0097-43,20-01-1147,CHIQUIMULA,CHIQUIMULA,EORM,CASERIO EL PATO ALDEA LA CATOCHA,42044088,VALESKA LILIAM ESPERANZA ARGUETA REYES,MAYTÉ PAOLA CHINCHILLA CALDERÓN,PRIMARIA,OFICIAL,RURAL,ABIERTA,MONOLINGUE,MATUTINA,DIARIO(REGULAR),CHIQUIMULA
20-01-0098-43,20-01-1187,CHIQUIMULA,CHIQUIMULA,EORM,CASERIO LA LAGUNETA ALDEA SAN MIGUEL,33971475,KAREN SUCETH GUERRA CALDERÓN,SONIA MAGALY CASTELLÓN DÍAZ,PRIMARIA,OFICIAL,RURAL,ABIERTA,MONOLINGUE,MATUTINA,DIARIO(REGULAR),CHIQUIMULA
20-01-0099-43,20-01-1148,CHIQUIMULA,CHIQUIMULA,EORM,CASERIO EL CERRON ALDEA GUIOR,,SILVIA MARILENA BUEZO MARTÍNEZ,GLENDY KARINA HERNÁNDEZ MORALES,PRIMARIA,OFICIAL,RURAL,ABIERTA,MONOLINGUE,MATUTINA,DIARIO(REGULAR),CHIQUIMULA
20-01-0100-43,20-01-1144,CHIQUIMULA,CHIQUIMULA,EORM,CASERIO POTRERILLOS ALDEA HACIENDA EL SANTO,44901383,CESAR HELAMAN GARCÍA LÓPEZ,AZUCENA MARGARETH LEMUS SINTUJ,PRIMARIA,OFICIAL,RURAL,ABIERTA,MONOLINGUE,MATUTINA,DIARIO(REGULAR),CHIQUIMULA
20-01-0101-43,20-01-1149,CHIQUIMULA,CHIQUIMULA,EORM,CASERIO EL LIMAR ALDEA EL DURAZNO,41818263,BYRON HORACIO SARCEÑO ZEPEDA,GLORIA SUSANA MORALES MORALES,PRIMARIA,OFICIAL,RURAL,ABIERTA,MONOLINGUE,MATUTINA,DIARIO(REGULAR),CHIQUIMULA
20-01-0105-43,20-01-1149,CHIQUIMULA,CHIQUIMULA,EORM,CASERÍO GUAYABILLAS ALDEA EL PALMAR,40290942,BYRON HORACIO SARCEÑO ZEPEDA,VILMA ELIZABETH PÉREZ CABREJO,PRIMARIA,OFICIAL,RURAL,ABIERTA,MONOLINGUE,MATUTINA,DIARIO(REGULAR),CHIQUIMULA
20-01-0106-43,20-01-1144,CHIQUIMULA,CHIQUIMULA,EORM,ALDEA EL SAUCE,59461296,CESAR HELAMAN GARCÍA LÓPEZ,JOSÉ HUMBERTO SAGASTUME MORALES,PRIMARIA,OFICIAL,RURAL,ABIERTA,MONOLINGUE,MATUTINA,DIARIO(REGULAR),CHIQUIMULA
20-01-0107-43,20-01-1148,CHIQUIMULA,CHIQUIMULA,EORM,CASERIO LOS FELIPE ALDEA SHUSHO ARRIBA,30910864,SILVIA MARILENA BUEZO MARTÍNEZ,AURA MARIBEL VELASQUEZ SOTO,PRIMARIA,OFICIAL,RURAL,ABIERTA,MONOLINGUE,MATUTINA,DIARIO(REGULAR),CHIQUIMULA
20-01-0108-43,20-01-1147,CHIQUIMULA,CHIQUIMULA,EORM,CASERIO LA OSCURANA ALDEA LA CATOCHA,45901950,VALESKA LILIAM ESPERANZA ARGUETA REYES,CLAUDIA AZUCENA PÉREZ,PRIMARIA,OFICIAL,RURAL,ABIERTA,MONOLINGUE,MATUTINA,DIARIO(REGULAR),CHIQUIMULA
20-01-0109-43,20-01-1149,CHIQUIMULA,CHIQUIMULA,EORM,CASERIO PLAN DE LA BREA ALDEA EL CONACASTE,57178303,BYRON HORACIO SARCEÑO ZEPEDA,ROSA ELVIRA DÍAZ MÉNDEZ,PRIMARIA,OFICIAL,RURAL,ABIERTA,MONOLINGUE,MATUTINA,DIARIO(REGULAR),CHIQUIMULA
20-01-0110-43,20-01-1146,CHIQUIMULA,CHIQUIMULA,EORM,CASERIO EL LIMON II ALDEA EL PALMAR,53297956,MERY ELISABET CALDERÓN CASTILLO,NANCY MARÍA TELÓN CASTRO,PRIMARIA,OFICIAL,RURAL,ABIERTA,MONOLINGUE,MATUTINA,DIARIO(REGULAR),CHIQUIMULA
20-01-0111-43,20-01-1148,CHIQUIMULA,CHIQUIMULA,EORM,CASERIO EL CHUCTE ALDEA GUIOR,42882390,SILVIA MARILENA BUEZO MARTÍNEZ,JULIO GEOVANY RODRÍGUEZ SOLÓRZANO,PRIMARIA,OFICIAL,RURAL,ABIERTA,MONOLINGUE,MATUTINA,DIARIO(REGULAR),CHIQUIMULA
20-01-0112-43,20-01-1149,CHIQUIMULA,CHIQUIMULA,EORM,CASERIO PINALON ALDEA EL DURAZNO,59465266,BYRON HORACIO SARCEÑO ZEPEDA,ODILIA LEMUS MARTÍNEZ,PRIMARIA,OFICIAL,RURAL,ABIERTA,MONOLINGUE,MATUTINA,DIARIO(REGULAR),CHIQUIMULA
20-01-0113-43,20-01-1146,CHIQUIMULA,CHIQUIMULA,EORM,CASERIO EL MORRAL ALDEA EL PALMAR,53582992,MERY ELISABET CALDERÓN CASTILLO,MIRNA LORENA OSORIO VÁSQUEZ,PRIMARIA,OFICIAL,RURAL,ABIERTA,MONOLINGUE,MATUTINA,DIARIO(REGULAR),CHIQUIMULA
20-01-0114-43,20-01-1143,CHIQUIMULA,CHIQUIMULA,EORM,CASERIO EL CHILAR ALDEA SANTA ELENA,40269000,NINETH DEL ROSARIO MORALES SANCE DE REYES,MARCELA ZULEMA BERRIOS ESPAÑA,PRIMARIA,OFICIAL,RURAL,ABIERTA,MONOLINGUE,MATUTINA,DIARIO(REGULAR),CHIQUIMULA
20-01-0115-43,20-01-1149,CHIQUIMULA,CHIQUIMULA,EORM,"CASERIO EL ROBLE, ALDEA EL CONACASTE",58836835,BYRON HORACIO SARCEÑO ZEPEDA,ODALIS IVONE CASTRO MEJÍA,PRIMARIA,OFICIAL,RURAL,ABIERTA,MONOLINGUE,MATUTINA,DIARIO(REGULAR),CHIQUIMULA
20-01-0116-43,20-01-1146,CHIQUIMULA,CHIQUIMULA,EORM,CASERIO EL NANZAL ALDEA EL PALMAR,41263103,MERY ELISABET CALDERÓN CASTILLO,GRICELDA ESPERANZA OSORIO FUENTES,PRIMARIA,OFICIAL,RURAL,ABIERTA,MONOLINGUE,MATUTINA,DIARIO(REGULAR),CHIQUIMULA
20-01-0117-43,20-01-1148,CHIQUIMULA,CHIQUIMULA,EORM,COLONIA LAS BRISAS BARRIO EL MOLINO,40165654,SILVIA MARILENA BUEZO MARTÍNEZ,SONIA ELIZABETH MORATAYA CHACHAGUÁ,PRIMARIA,OFICIAL,RURAL,ABIERTA,MONOLINGUE,MATUTINA,DIARIO(REGULAR),CHIQUIMULA
20-01-0118-43,20-01-1144,CHIQUIMULA,CHIQUIMULA,EORM,CASERIO QUEBRADA SECA ALDEA JICARAL,45563085,CESAR HELAMAN GARCÍA LÓPEZ,ANA DEL ROSARIO ARAGÓN HERNÁNDEZ,PRIMARIA,OFICIAL,RURAL,ABIERTA,MONOLINGUE,MATUTINA,DIARIO(REGULAR),CHIQUIMULA
20-01-0121-43,20-01-1147,CHIQUIMULA,CHIQUIMULA,EORM,"CASERIO TRAPICHITOS, ALDEA EL JUTE",38881866,VALESKA LILIAM ESPERANZA ARGUETA REYES,BLANCA AZUCENA SÚCHITE MÉNDEZ,PRIMARIA,OFICIAL,RURAL,ABIERTA,MONOLINGUE,MATUTINA,DIARIO(REGULAR),CHIQUIMULA
20-01-0122-43,20-004,CHIQUIMULA,CHIQUIMULA,EORM,"CASERIO LA CUESTONA, ALDEA OQUEN",,SERGIO ESTUARDO MEDINA GUDIEL,---,PRIMARIA,OFICIAL,RURAL,CERRADA DEFINITIVAMENTE,MONOLINGUE,MATUTINA,DIARIO(REGULAR),CHIQUIMULA
20-01-0125-43,20-01-1143,CHIQUIMULA,CHIQUIMULA,CENTRO EDUCATIVO INTEGRAL CASA DEL ALFARERO,14 AVENIDA 5-23 ZONA 7 COLONIA SHOROPIN,37590030,NINETH DEL ROSARIO MORALES SANCE DE REYES,WENDY IVETH CARRANZA CERVANTES,PRIMARIA,PRIVADO,URBANA,ABIERTA,MONOLINGUE,MATUTINA,DIARIO(REGULAR),CHIQUIMULA
20-01-0126-43,20-027,CHIQUIMULA,CHIQUIMULA,CENTRO EDUCATIVO INTEGRAL CASA DEL ALFARERO,CALLE PRINCIPAL DE LA COLONIA LA COLINA ZONA 7,79422285,SILVIA MARILENA BUEZO MARTINEZ,LICDA. AMANDA PADILLA CHACON DE ARGUETA,PRIMARIA,PRIVADO,URBANA,CERRADA TEMPORALMENTE,MONOLINGUE,VESPERTINA,DIARIO(REGULAR),CHIQUIMULA
20-01-0134-43,20-01-1148,CHIQUIMULA,CHIQUIMULA,EORM,"CASERIO EL FILO, ALDEA CARRIZAL",48613121,SILVIA MARILENA BUEZO MARTÍNEZ,ILSSE KAROLA MORALES RAMÍREZ,PRIMARIA,OFICIAL,RURAL,ABIERTA,MONOLINGUE,MATUTINA,DIARIO(REGULAR),CHIQUIMULA
20-01-0154-43,20-01-1144,CHIQUIMULA,CHIQUIMULA,EORM,"CASERIO EL NANZAL, ALDEA HACIENDA EL SANTO",55392470,CESAR HELAMAN GARCÍA LÓPEZ,ANA LUISA MORATAYA MARTÍNEZ,PRIMARIA,OFICIAL,RURAL,ABIERTA,MONOLINGUE,MATUTINA,DIARIO(REGULAR),CHIQUIMULA
20-01-0157-43,20-01-1145,CHIQUIMULA,CHIQUIMULA,EOUM,"COLONIA LAS BRISAS DE SAN JOSE, ZONA 4",32850431,LUIS GUSTAVO SAGASTUME CONTRERAS,MILDRED JANINA SANCÉ CHEGÜÉN,PRIMARIA,OFICIAL,URBANA,ABIERTA,MONOLINGUE,MATUTINA,DIARIO(REGULAR),CHIQUIMULA
20-01-0160-43,20-01-1143,CHIQUIMULA,CHIQUIMULA,EOUM,"15 AVENIDA SUR FINAL, SECTOR LA LINEA, ZONA 6",58450920,NINETH DEL ROSARIO MORALES SANCE DE REYES,SUCELY CAROLINA DÍAZ SALGUERO,PRIMARIA,OFICIAL,URBANA,ABIERTA,MONOLINGUE,MATUTINA,DIARIO(REGULAR),CHIQUIMULA
20-01-0163-43,20-01-1146,CHIQUIMULA,CHIQUIMULA,INSTITUTO TECNOLOGICO PRIVADO DE ORIENTE,4TA. AVENIDA 4-20 ZONA 1,79425959,MERY ELISABET CALDERÓN CASTILLO,LUIS ALBERTO CACERES ALONZO,PRIMARIA,PRIVADO,URBANA,ABIERTA,MONOLINGUE,MATUTINA,DIARIO(REGULAR),CHIQUIMULA
20-01-0166-43,20-01-1145,CHIQUIMULA,CHIQUIMULA,EORM AMISRAEL,"COLONIA ALTA MIRA, ALDEA PETAPILLA",30741143,LUIS GUSTAVO SAGASTUME CONTRERAS,DAVID RIGOBERTO ALFARO LEMUS,PRIMARIA,OFICIAL,RURAL,ABIERTA,MONOLINGUE,MATUTINA,DIARIO(REGULAR),CHIQUIMULA
20-01-0167-43,20-01-1143,CHIQUIMULA,CHIQUIMULA,EOUM,"BARRIO EL JURGALLON, ZONA 5",50818208,NINETH DEL ROSARIO MORALES SANCE DE REYES,GUSTAVO ADOLFO ESPAÑA GONZÁLEZ,PRIMARIA,OFICIAL,URBANA,ABIERTA,MONOLINGUE,MATUTINA,DIARIO(REGULAR),CHIQUIMULA
20-01-0175-43,20-014,CHIQUIMULA,CHIQUIMULA,EORM,"CASERIO LA CUMBRE, ALDEA JAGUA",,ERICK ESTUARDO ALVARADO GALVÁN,---,PRIMARIA,OFICIAL,RURAL,CERRADA DEFINITIVAMENTE,MONOLINGUE,MATUTINA,DIARIO(REGULAR),CHIQUIMULA
20-01-0190-43,20-01-1146,CHIQUIMULA,CHIQUIMULA,COLEGIO PRIVADO MIXTO CON ORIENTACION EN PSICOLOGIA JEAN PIAGET,2DA. AVENIDA 2-18 ZONA 1,55158803,MERY ELISABET CALDERÓN CASTILLO,JENNIFER GUADALUPE ARRIAZA MORALES,PRIMARIA,PRIVADO,URBANA,ABIERTA,MONOLINGUE,VESPERTINA,DIARIO(REGULAR),CHIQUIMULA
20-01-0191-43,20-01-1145,CHIQUIMULA,CHIQUIMULA,EORM,"COLONIA PLANES DE SAN JOSE, ALDEA PETAPILLA",41888919,LUIS GUSTAVO SAGASTUME CONTRERAS,ALBA NOELIA SANCÉ JUÁREZ,PRIMARIA,OFICIAL,RURAL,ABIERTA,MONOLINGUE,MATUTINA,DIARIO(REGULAR),CHIQUIMULA
20-01-0201-43,20-01-1146,CHIQUIMULA,CHIQUIMULA,COLEGIO MIXTO EN TECNOLOGIA LATINOAMERICANO,4A. CALLE 3-50 ZONA 1,42103750,MERY ELISABET CALDERÓN CASTILLO,JUANA JUDIHT CETINO CURCIN,PRIMARIA,PRIVADO,URBANA,ABIERTA,MONOLINGUE,MATUTINA,DIARIO(REGULAR),CHIQUIMULA
20-01-0211-43,20-024,CHIQUIMULA,CHIQUIMULA,LICEO ISRAELÍ,5TA. CALLE 4-11 ZONA 1,79422500,SILVIA MARILENA BUEZO MARTINEZ,GLADYS EUGENIA RODRÍGUEZ RAMÍREZ,PRIMARIA,PRIVADO,URBANA,CERRADA DEFINITIVAMENTE,MONOLINGUE,VESPERTINA,DIARIO(REGULAR),CHIQUIMULA
20-01-0222-43,20-01-1147,CHIQUIMULA,CHIQUIMULA,EORM,CASERÍO EL ZARZAL ALDEA EL MATAZANO,54843990,VALESKA LILIAM ESPERANZA ARGUETA REYES,BYRON RENÉ LOBOS SANCÉ,PRIMARIA,OFICIAL,RURAL,ABIERTA,MONOLINGUE,MATUTINA,DIARIO(REGULAR),CHIQUIMULA
20-01-0230-43,20-01-1145,CHIQUIMULA,CHIQUIMULA,COLEGIO PRIVADO MIXTO DIVINA MISERICORDIA,"6TA. CALLE PONIENTE ZONA 4, BARRIO EL MOLINO",55974817,LUIS GUSTAVO SAGASTUME CONTRERAS,FRANCISCA LINARES RIVERA,PRIMARIA,PRIVADO,URBANA,ABIERTA,MONOLINGUE,MATUTINA,DIARIO(REGULAR),CHIQUIMULA
20-01-0237-43,20-027,CHIQUIMULA,CHIQUIMULA,"JARDÍN INFANTIL ""MIS PRIMEROS PASITOS""",LOTE 195 5A. CALLE FINAL RESIDENCIALES CHIQUIMULA ZONA 3,40351144,SILVIA MARILENA BUEZO MARTINEZ,OLGA LETICIA OSORIO GUERRA,PRIMARIA,PRIVADO,URBANA,CERRADA TEMPORALMENTE,MONOLINGUE,MATUTINA,DIARIO(REGULAR),CHIQUIMULA
20-01-0240-43,20-01-1142,CHIQUIMULA,CHIQUIMULA,LICEO ISRAELÍ,5A. CALLE 4-11 ZONA 1,79422500,CÉSAR ADALBERTO NOGUERA JÁCOME,GLADYS EUGENIA RODRÍGUEZ RAMÍREZ,PRIMARIA,PRIVADO,URBANA,ABIERTA,MONOLINGUE,MATUTINA,DIARIO(REGULAR),CHIQUIMULA
20-01-0243-43,20-01-1187,CHIQUIMULA,CHIQUIMULA,"LICEO TEC, TECNOLÓGICO, EXPERIMENTAL Y CIENTÍFICO","CALZADA HÉCTOR AUGUSTO ESPAÑA BRACAMONTE, LOTE # 25 ZONA 2",58123452,KAREN SUCETH GUERRA CALDERÓN,ROSA YESSENIA PACHECO DE FRANCO,PRIMARIA,PRIVADO,URBANA,ABIERTA,MONOLINGUE,MATUTINA,DIARIO(REGULAR),CHIQUIMULA
20-01-0345-43,20-01-1145,CHIQUIMULA,CHIQUIMULA,ESCUELA SECUNDARIA PRIVADA MIXTA DE ORIENTE -ESDEO-,2DA. CALLE 4-40 ZONA 1,57768644,LUIS GUSTAVO SAGASTUME CONTRERAS,ERWIN LEONEL COLINDRES MONROY,PRIMARIA,PRIVADO,URBANA,ABIERTA,MONOLINGUE,VESPERTINA,DIARIO(REGULAR),CHIQUIMULA
20-01-0376-43,20-01-1148,CHIQUIMULA,CHIQUIMULA,LICEO BILINGÜE CHIQUIMULTECO,6A. CALLE 5-20 ZONA 1,31206335,SILVIA MARILENA BUEZO MARTÍNEZ,EDNA GRACIELA PINTO SAGASTUME,PRIMARIA,PRIVADO,URBANA,ABIERTA,MONOLINGUE,MATUTINA,DIARIO(REGULAR),CHIQUIMULA
20-01-0473-43,20-024,CHIQUIMULA,CHIQUIMULA,'COLEGIO DE EDUCACION PERSONALIZADA PIERRE FAURE',COLONIA LA COLINA ZONA 7,79425648,SILVIA MARILENA BUEZO MARTINEZ,,PRIMARIA,PRIVADO,URBANA,CERRADA DEFINITIVAMENTE,MONOLINGUE,MATUTINA,DIARIO(REGULAR),CHIQUIMULA
20-01-0474-43,20-01-1146,CHIQUIMULA,CHIQUIMULA,EORM,CASERIO EL MOJON ALDEA EL PALMAR,47500819,MERY ELISABET CALDERÓN CASTILLO,LÁZARO MORATAYA ESPINO,PRIMARIA,OFICIAL,RURAL,ABIERTA,MONOLINGUE,MATUTINA,DIARIO(REGULAR),CHIQUIMULA
20-01-0475-43,20-01-1144,CHIQUIMULA,CHIQUIMULA,EORM,ALDEA LA PUENTE,30606699,CESAR HELAMAN GARCÍA LÓPEZ,EVELYN YANETH ESPINO MONROY,PRIMARIA,OFICIAL,RURAL,ABIERTA,MONOLINGUE,MATUTINA,DIARIO(REGULAR),CHIQUIMULA
20-01-0476-43,20-01-1146,CHIQUIMULA,CHIQUIMULA,EOUM 'COPROMECHI',2A. CALLE A 17-33 ZONA 5,30831414,MERY ELISABET CALDERÓN CASTILLO,DEIDY FLORES JIMÉNEZ,PRIMARIA,OFICIAL,URBANA,ABIERTA,MONOLINGUE,MATUTINA,DIARIO(REGULAR),CHIQUIMULA
20-01-0492-43,20-01-1147,CHIQUIMULA,CHIQUIMULA,EORM,CASERIO LAS CRUCES ALDEA EL MATAZANO,57752249,VALESKA LILIAM ESPERANZA ARGUETA REYES,GERMAN MALDONADO CHEGÜÉN,PRIMARIA,OFICIAL,RURAL,ABIERTA,MONOLINGUE,MATUTINA,DIARIO(REGULAR),CHIQUIMULA
