20-03-0025-43,20-03-1188,CHIQUIMULA,SAN JUAN ERMITA,EORM,"CASERIO LOS COYOTES, ALDEA CHISPAN JARAL",55961832,KARLA AZUCENA MÉNDEZ LÓPEZ DE RAMÍREZ,LOURDES ELVIRA ALDANA JORDÁN,PRIMARIA,OFICIAL,RURAL,ABIERTA,MONOLINGUE,MATUTINA,DIARIO(REGULAR),CHIQUIMULA
20-03-0029-43,20-03-1188,CHIQUIMULA,SAN JUAN ERMITA,EORM,"CASERIO EL ZARZAL, SECTOR II, ALDEA CAULOTES",30209983,KARLA AZUCENA MÉNDEZ LÓPEZ DE RAMÍREZ,HUGO NOÉ GUERRA GUERRA,PRIMARIA,OFICIAL,RURAL,ABIERTA,MONOLINGUE,MATUTINA,DIARIO(REGULAR),CHIQUIMULA
20-03-0123-43,20-03-1152,CHIQUIMULA,SAN JUAN ERMITA,EOUM,SAN JUAN ERMITA,58348038,BLANCA ROSA MORALES MARTÍNEZ DE GUTIÉRREZ,ONELIA LIZZETH MARTÍNEZ LEMUS,PRIMARIA,OFICIAL,URBANA,ABIERTA,MONOLINGUE,MATUTINA,DIARIO(REGULAR),CHIQUIMULA
20-03-0124-43,20-03-1151,CHIQUIMULA,SAN JUAN ERMITA,EORM,ALDEA VEGUITAS,48311774,GUSTAVO BORJA OSORIO,CARLOS RAFAEL AMADOR GUTIERREZ,PRIMARIA,OFICIAL,RURAL,ABIERTA,MONOLINGUE,MATUTINA,DIARIO(REGULAR),CHIQUIMULA
20-03-0125-43,20-03-1151,CHIQUIMULA,SAN JUAN ERMITA,EORM,ALDEA SALITRON,46734617,GUSTAVO BORJA OSORIO,ERIK MAURICIO AVALOS MIGUEL,PRIMARIA,OFICIAL,RURAL,ABIERTA,MONOLINGUE,MATUTINA,DIARIO(REGULAR),CHIQUIMULA
20-03-0126-43,20-03-1188,CHIQUIMULA,SAN JUAN ERMITA,EORM,ALDEA CHURISCHAN,47804329,KARLA AZUCENA MÉNDEZ LÓPEZ DE RAMÍREZ,AURA ANGÉLICA LEMUS RIVERA,PRIMARIA,OFICIAL,RURAL,ABIERTA,MONOLINGUE,MATUTINA,DIARIO(REGULAR),CHIQUIMULA
20-03-0127-43,20-03-1151,CHIQUIMULA,SAN JUAN ERMITA,EORM,ALDEA MINAS ARRIBA,32563469,GUSTAVO BORJA OSORIO,ERICA ELUVIA AGUIRRE FLORES,PRIMARIA,OFICIAL,RURAL,ABIERTA,BILINGUE,MATUTINA,DIARIO(REGULAR),CHIQUIMULA
20-03-0128-43,20-03-1152,CHIQUIMULA,SAN JUAN ERMITA,EORM,ALDEA TICANLU,48533341,BLANCA ROSA MORALES MARTÍNEZ DE GUTIÉRREZ,BAIRON NOÉ SÚCHITE GARCÍA,PRIMARIA,OFICIAL,RURAL,ABIERTA,MONOLINGUE,MATUTINA,DIARIO(REGULAR),CHIQUIMULA
20-03-0129-43,20-03-1151,CHIQUIMULA,SAN JUAN ERMITA,EORM,ALDEA SAN ANTONIO LAJAS,40846998,GUSTAVO BORJA OSORIO,ZOILA CONCEPCIÓN LÓPEZ MARTÍNEZ,PRIMARIA,OFICIAL,RURAL,ABIERTA,MONOLINGUE,MATUTINA,DIARIO(REGULAR),CHIQUIMULA
20-03-0130-43,20-03-1152,CHIQUIMULA,SAN JUAN ERMITA,EORM,ALDEA RIO ARRIBA,58970051,BLANCA ROSA MORALES MARTÍNEZ DE GUTIÉRREZ,LUIS ALFREDO GUERRA GUTIÉRREZ,PRIMARIA,OFICIAL,RURAL,ABIERTA,MONOLINGUE,MATUTINA,DIARIO(REGULAR),CHIQUIMULA
20-03-0131-43,20-03-1152,CHIQUIMULA,SAN JUAN ERMITA,EORM PROFESORA IDALIA ESPERANZA VIDAL CERÓN DE MARROQUÍN,ALDEA LOS PLANES,55100258,BLANCA ROSA MORALES MARTÍNEZ DE GUTIÉRREZ,BAUDILIO FRANCISCO JORDÁN ALDANA,PRIMARIA,OFICIAL,RURAL,ABIERTA,MONOLINGUE,MATUTINA,DIARIO(REGULAR),CHIQUIMULA
20-03-0133-43,20-03-1152,CHIQUIMULA,SAN JUAN ERMITA,EORM,ALDEA EL CARRIZAL,31868642,BLANCA ROSA MORALES MARTÍNEZ DE GUTIÉRREZ,SAÚL OTTONIEL MARTÍNEZ LEMUS,PRIMARIA,OFICIAL,RURAL,ABIERTA,MONOLINGUE,MATUTINA,DIARIO(REGULAR),CHIQUIMULA
20-03-0134-43,20-03-1152,CHIQUIMULA,SAN JUAN ERMITA,EORM,ALDEA LAGUNETAS,40619785,BLANCA ROSA MORALES MARTÍNEZ DE GUTIÉRREZ,RAFAEL GARCÍA RAMOS,PRIMARIA,OFICIAL,RURAL,ABIERTA,MONOLINGUE,MATUTINA,DIARIO(REGULAR),CHIQUIMULA
20-03-0135-43,20-03-1188,CHIQUIMULA,SAN JUAN ERMITA,EORM,ALDEA CHISPAN JARAL,53672720,KARLA AZUCENA MÉNDEZ LÓPEZ DE RAMÍREZ,INGRID MARIBEL RAMOS TÓBAL,PRIMARIA,OFICIAL,RURAL,ABIERTA,MONOLINGUE,MATUTINA,DIARIO(REGULAR),CHIQUIMULA
20-03-0136-43,20-03-1188,CHIQUIMULA,SAN JUAN ERMITA,EORM,"ALDEA CHANCO, CASERIO LA CEIBA",49096759,KARLA AZUCENA MÉNDEZ LÓPEZ DE RAMÍREZ,YESSICA VICTORIA LEMUS PÉREZ,PRIMARIA,OFICIAL,RURAL,ABIERTA,MONOLINGUE,MATUTINA,DIARIO(REGULAR),CHIQUIMULA
20-03-0137-43,20-03-1152,CHIQUIMULA,SAN JUAN ERMITA,EORM PROFESOR ROBERTO OBDULIO MARTINEZ GUERRA,ALDEA CHANCO,53635341,BLANCA ROSA MORALES MARTÍNEZ DE GUTIÉRREZ,PETRONILA MÉNDEZ LEMUS,PRIMARIA,OFICIAL,RURAL,ABIERTA,MONOLINGUE,MATUTINA,DIARIO(REGULAR),CHIQUIMULA
20-03-0138-43,20-03-1188,CHIQUIMULA,SAN JUAN ERMITA,EORM,ALDEA LOS ENCUENTROS,49427115,KARLA AZUCENA MÉNDEZ LÓPEZ DE RAMÍREZ,SOBEYDA MAYARÍ GUTIÉRREZ MARTÍNEZ,PRIMARIA,OFICIAL,RURAL,ABIERTA,MONOLINGUE,MATUTINA,DIARIO(REGULAR),CHIQUIMULA
20-03-0139-43,20-03-1188,CHIQUIMULA,SAN JUAN ERMITA,EORM,ALDEA CAULOTES,40833710,KARLA AZUCENA MÉNDEZ LÓPEZ DE RAMÍREZ,OTTO RENÉ NUFIO GONZÁLEZ,PRIMARIA,OFICIAL,RURAL,ABIERTA,MONOLINGUE,MATUTINA,DIARIO(REGULAR),CHIQUIMULA
20-03-0140-43,20-03-1151,CHIQUIMULA,SAN JUAN ERMITA,EORM,ALDEA TASHARJA,40275667,GUSTAVO BORJA OSORIO,WILSON GAMALIEL ZACARÍAS DÍAZ,PRIMARIA,OFICIAL,RURAL,ABIERTA,MONOLINGUE,MATUTINA,DIARIO(REGULAR),CHIQUIMULA
20-03-0141-43,20-03-1188,CHIQUIMULA,SAN JUAN ERMITA,EORM,ALDEA MINAS ABAJO,57239533,KARLA AZUCENA MÉNDEZ LÓPEZ DE RAMÍREZ,MIRIAM ARACELY GARCÍA PORTILLO DE LÓPEZ,PRIMARIA,OFICIAL,RURAL,ABIERTA,BILINGUE,MATUTINA,DIARIO(REGULAR),CHIQUIMULA
20-03-0142-43,20-03-1152,CHIQUIMULA,SAN JUAN ERMITA,EORM,ALDEA CORRAL DE PIEDRA,48891632,BLANCA ROSA MORALES MARTÍNEZ DE GUTIÉRREZ,EMMANUEL ESAÚ GUERRA MARTÍNEZ,PRIMARIA,OFICIAL,RURAL,ABIERTA,MONOLINGUE,MATUTINA,DIARIO(REGULAR),CHIQUIMULA
20-03-0143-43,20-03-1151,CHIQUIMULA,SAN JUAN ERMITA,EORM,ALDEA CEIBITA,40367634,GUSTAVO BORJA OSORIO,MIRNA LETICIA ROQUE ROQUE,PRIMARIA,OFICIAL,RURAL,ABIERTA,MONOLINGUE,MATUTINA,DIARIO(REGULAR),CHIQUIMULA
20-03-0495-43,20-03-1151,CHIQUIMULA,SAN JUAN ERMITA,EORM,ALDEA BUENA VISTA,50000693,GUSTAVO BORJA OSORIO,WILDER ALEXIS GALICIA PORTILLO,PRIMARIA,OFICIAL,RURAL,ABIERTA,MONOLINGUE,MATUTINA,DIARIO(REGULAR),CHIQUIMULA
20-03-0510-43,20-03-1188,CHIQUIMULA,SAN JUAN ERMITA,EORM,CASERIO EL MOJON ALDEA CHISPAN JARAL,54824746,KARLA AZUCENA MÉNDEZ LÓPEZ DE RAMÍREZ,MANUEL RENATO MATEO LIMA,PRIMARIA,OFICIAL,RURAL,ABIERTA,MONOLINGUE,MATUTINA,DIARIO(REGULAR),CHIQUIMULA
20-03-0511-43,20-03-1151,CHIQUIMULA,SAN JUAN ERMITA,EORM,ALDEA QUEQUEZQUE,32916322,GUSTAVO BORJA OSORIO,ISRAEL DE JESÚS MARTÍNEZ RAMOS,PRIMARIA,OFICIAL,RURAL,ABIERTA,MONOLINGUE,MATUTINA,DIARIO(REGULAR),CHIQUIMULA
20-03-0512-43,20-03-1188,CHIQUIMULA,SAN JUAN ERMITA,EORM,CASERIO EL ZARZAL ALDEA CAULOTES,46826940,KARLA AZUCENA MÉNDEZ LÓPEZ DE RAMÍREZ,DELMY ROXANA VÁSQUEZ ALONZO,PRIMARIA,OFICIAL,RURAL,ABIERTA,BILINGUE,MATUTINA,DIARIO(REGULAR),CHIQUIMULA
20-03-0529-43,,CHIQUIMULA,SAN JUAN ERMITA,EMRM,CASERIO LOS ACHIOTES ALDEA CHANCO,,,,PRIMARIA,MUNICIPAL,RURAL,CERRADA DEFINITIVAMENTE,MONOLINGUE,MATUTINA,DIARIO(REGULAR),CHIQUIMULA
20-03-0560-43,,CHIQUIMULA,SAN JUAN ERMITA,EMRM,CASERIO MATAZANO ALDEA CHISPAN JARAL,,,,PRIMARIA,MUNICIPAL,RURAL,CERRADA DEFINITIVAMENTE,MONOLINGUE,MATUTINA,DIARIO(REGULAR),CHIQUIMULA
20-03-1042-43,20-03-1151,CHIQUIMULA,SAN JUAN ERMITA,ESCUELA UNITARIA 'FE Y ALEGRIA NO. 32',CASERIO MIRAMUNDO ALDEA CHURISCHAN,79465653,GUSTAVO BORJA OSORIO,ERICK NOEL RAMÍREZ HERNÁNDEZ,PRIMARIA,PRIVADO,RURAL,ABIERTA,MONOLINGUE,MATUTINA,DIARIO(REGULAR),CHIQUIMULA
20-03-1043-43,20-03-1152,CHIQUIMULA,SAN JUAN ERMITA,EORM,CASERIO LOS PEÑASCOS ALDEA BUENA VISTA,,BLANCA ROSA MORALES MARTÍNEZ DE GUTIÉRREZ,MOISÉS UBÉNER JORDÁN CABRERA,PRIMARIA,OFICIAL,RURAL,ABIERTA,BILINGUE,MATUTINA,DIARIO(REGULAR),CHIQUIMULA
20-03-1126-43,20-03-1188,CHIQUIMULA,SAN JUAN ERMITA,EORM,CASERIO LOS ACHIOTES ALDEA CHANCO,,KARLA AZUCENA MÉNDEZ LÓPEZ DE RAMÍREZ,HILDA ESTHER RAMOS GONZÁLEZ,PRIMARIA,OFICIAL,RURAL,ABIERTA,MONOLINGUE,MATUTINA,DIARIO(REGULAR),CHIQUIMULA
20-03-1127-43,,CHIQUIMULA,SAN JUAN ERMITA,EORM,CASERIO LOS PEÑASCOS ALDEA BUENA VISTA,,,,PRIMARIA,OFICIAL,RURAL,CERRADA DEFINITIVAMENTE,MONOLINGUE,MATUTINA,DIARIO(REGULAR),CHIQUIMULA
20-03-1128-43,20-03-1151,CHIQUIMULA,SAN JUAN ERMITA,EORM,CASERIO MATAZANO ALDEA CHISPAN,45199968,GUSTAVO BORJA OSORIO,MARIO ANDRÉS SOLÍS HERNÁNDEZ,PRIMARIA,OFICIAL,RURAL,ABIERTA,MONOLINGUE,MATUTINA,DIARIO(REGULAR),CHIQUIMULA
20-03-1172-43,,CHIQUIMULA,SAN JUAN ERMITA,EORM,ALDEA BUENA VISTA,,,,PRIMARIA,OFICIAL,RURAL,CERRADA DEFINITIVAMENTE,MONOLINGUE,MATUTINA,DIARIO(REGULAR),CHIQUIMULA
20-03-1176-43,,CHIQUIMULA,SAN JUAN ERMITA,EMRM,CASERIO VIVIENDA NUEVA ALDEA LOS PLANES,,,,PRIMARIA,MUNICIPAL,RURAL,CERRADA TEMPORALMENTE,MONOLINGUE,MATUTINA,DIARIO(REGULAR),CHIQUIMULA
20-03-1177-43,,CHIQUIMULA,SAN JUAN ERMITA,EMRM,CASERIO EL COCO ALDEA LA CEIBITA,,,,PRIMARIA,MUNICIPAL,RURAL,CERRADA TEMPORALMENTE,MONOLINGUE,MATUTINA,DIARIO(REGULAR),CHIQUIMULA
20-03-1178-43,,CHIQUIMULA,SAN JUAN ERMITA,EMRM,CASERIO EL MAGUEYAL ALDEA TASHARJA,,,,PRIMARIA,MUNICIPAL,RURAL,CERRADA TEMPORALMENTE,MONOLINGUE,MATUTINA,DIARIO(REGULAR),CHIQUIMULA
20-03-1179-43,20-03-1151,CHIQUIMULA,SAN JUAN ERMITA,EORM,CASERIO LAS MUÑECAS ALDEA CORRAL DE PIEDRA,40763823,GUSTAVO BORJA OSORIO,OSCAR GEOVANY MÉNDEZ GUTIÉRREZ,PRIMARIA,OFICIAL,RURAL,ABIERTA,MONOLINGUE,MATUTINA,DIARIO(REGULAR),CHIQUIMULA
20-03-1180-43,,CHIQUIMULA,SAN JUAN ERMITA,EMRM,CASERIO TASHARJA ARRIBA ALDEA TASHARJA,,,,PRIMARIA,MUNICIPAL,RURAL,CERRADA TEMPORALMENTE,MONOLINGUE,MATUTINA,DIARIO(REGULAR),CHIQUIMULA
20-03-1370-43,26-039,CHIQUIMULA,SAN JUAN ERMITA,EDAC - PRONADE -,CASERIO LAS MUÑECAS ALDEA CORRAL DE PIEDRA,,PROYECTO SEPREDI,,PRIMARIA,OFICIAL,RURAL,CERRADA DEFINITIVAMENTE,MONOLINGUE,MATUTINA,DIARIO(REGULAR),CHIQUIMULA
20-03-1371-43,26-019,CHIQUIMULA,SAN JUAN ERMITA,EDAC - PRONADE -,CASERIO EL MAGUEYAL ALDEA TASHARJA,,PROYECTO PREDIN,,PRIMARIA,OFICIAL,RURAL,CERRADA DEFINITIVAMENTE,MONOLINGUE,MATUTINA,DIARIO(REGULAR),CHIQUIMULA
20-03-1372-43,26-019,CHIQUIMULA,SAN JUAN ERMITA,EDAC - PRONADE -,CASERIO TASHARJA ARRIBA ALDEA TASHARJA,,PROYECTO PREDIN,,PRIMARIA,OFICIAL,RURAL,CERRADA DEFINITIVAMENTE,MONOLINGUE,MATUTINA,DIARIO(REGULAR),CHIQUIMULA
20-03-1373-43,26-019,CHIQUIMULA,SAN JUAN ERMITA,EDAC - PRONADE -,CASERIO VIVIENDA NUEVA ALDEA LOS PLANES,,PROYECTO PREDIN,,PRIMARIA,OFICIAL,RURAL,CERRADA DEFINITIVAMENTE,MONOLINGUE,MATUTINA,DIARIO(REGULAR),CHIQUIMULA
20-03-1374-43,26-019,CHIQUIMULA,SAN JUAN ERMITA,EDAC - PRONADE -,CASERIO LOS LOPEZ ALDEA CHURISCHAN,,PROYECTO PREDIN,,PRIMARIA,OFICIAL,RURAL,CERRADA DEFINITIVAMENTE,MONOLINGUE,MATUTINA,DIARIO(REGULAR),CHIQUIMULA
20-03-1375-43,26-019,CHIQUIMULA,SAN JUAN ERMITA,EDAC - PRONADE -,CASERIO LOS CORONADOS ALDEA SAN ANTONIO LAJAS,,PROYECTO PREDIN,,PRIMARIA,OFICIAL,RURAL,CERRADA DEFINITIVAMENTE,MONOLINGUE,MATUTINA,DIARIO(REGULAR),CHIQUIMULA
20-03-1424-43,,CHIQUIMULA,SAN JUAN ERMITA,EDAC - PRONADE -,BARRIO EL CENTRO,59020913,,,PRIMARIA,OFICIAL,RURAL,CERRADA DEFINITIVAMENTE,BILINGUE,MATUTINA,DIARIO(REGULAR),CHIQUIMULA
20-03-1477-43,,CHIQUIMULA,SAN JUAN ERMITA,EDAC - PRONADE -,CASERIO EL COCO ALDEA CEIBITA,,,,PRIMARIA,OFICIAL,RURAL,CERRADA DEFINITIVAMENTE,BILINGUE,MATUTINA,DIARIO(REGULAR),CHIQUIMULA
20-03-1514-43,,CHIQUIMULA,SAN JUAN ERMITA,EMRM,CASERIO EL ROBLARCITO,,,,PRIMARIA,MUNICIPAL,RURAL,CERRADA TEMPORALMENTE,MONOLINGUE,MATUTINA,DIARIO(REGULAR),CHIQUIMULA
20-03-1590-43,26-019,CHIQUIMULA,SAN JUAN ERMITA,EDAC - PRONADE -,CASERIO EL CERRON ALDEA CHURISCHAN,,PROYECTO PREDIN,,PRIMARIA,OFICIAL,RURAL,CERRADA DEFINITIVAMENTE,MONOLINGUE,MATUTINA,DIARIO(REGULAR),CHIQUIMULA
20-03-1591-43,26-019,CHIQUIMULA,SAN JUAN ERMITA,EDAC -PRONADE-,CASERIO EL MIRADOR ALDEA BUENA VISTA,,PROYECTO PREDIN,,PRIMARIA,OFICIAL,RURAL,CERRADA DEFINITIVAMENTE,MONOLINGUE,MATUTINA,DIARIO(REGULAR),CHIQUIMULA
20-03-1592-43,26-019,CHIQUIMULA,SAN JUAN ERMITA,EDAC - PRONADE -,BARRIO EL PINALITO,,PROYECTO PREDIN,,PRIMARIA,OFICIAL,RURAL,CERRADA DEFINITIVAMENTE,MONOLINGUE,MATUTINA,DIARIO(REGULAR),CHIQUIMULA
20-03-1603-43,26-019,CHIQUIMULA,SAN JUAN ERMITA,EDAC - PRONADE -,BARRIO EL CAMPO,,PROYECTO PREDIN,,PRIMARIA,OFICIAL,RURAL,CERRADA DEFINITIVAMENTE,MONOLINGUE,MATUTINA,DIARIO(REGULAR),CHIQUIMULA
20-03-1707-43,26-019,CHIQUIMULA,SAN JUAN ERMITA,EDAC - PRONADE -,CASERIO EL ROBLARCITO ALDEA QUEQUEZQUE,,PROYECTO PREDIN,,PRIMARIA,OFICIAL,RURAL,CERRADA DEFINITIVAMENTE,MONOLINGUE,MATUTINA,DIARIO(REGULAR),CHIQUIMULA
20-03-1708-43,26-019,CHIQUIMULA,SAN JUAN ERMITA,EDAC - PRONADE -,ALDEA RIO ARRIBA,,PROYECTO PREDIN,,PRIMARIA,OFICIAL,RURAL,CERRADA DEFINITIVAMENTE,MONOLINGUE,MATUTINA,DIARIO(REGULAR),CHIQUIMULA
20-03-1798-43,20-003,CHIQUIMULA,SAN JUAN ERMITA,EMRM,BARRIO LINDA VISTA,,BLANCA ROSA MORALES DE GUTIERREZ,,PRIMARIA,MUNICIPAL,RURAL,CERRADA DEFINITIVAMENTE,MONOLINGUE,MATUTINA,DIARIO(REGULAR),CHIQUIMULA
20-03-2082-43,26-019,CHIQUIMULA,SAN JUAN ERMITA,EDAC -PRONADE-,CASERIO TASHARJA ABAJO ALDEA TASHARJA,,PROYECTO PREDIN,,PRIMARIA,OFICIAL,RURAL,CERRADA DEFINITIVAMENTE,MONOLINGUE,MATUTINA,DIARIO(REGULAR),CHIQUIMULA
20-03-2115-43,20-03-1152,CHIQUIMULA,SAN JUAN ERMITA,EORM,BARRIO LINDA VISTA,40666322,BLANCA ROSA MORALES MARTÍNEZ DE GUTIÉRREZ,IRMA YOLANDA BERREONDO GARCÍA,PRIMARIA,OFICIAL,RURAL,ABIERTA,BILINGUE,MATUTINA,DIARIO(REGULAR),CHIQUIMULA
20-04-0005-43,20-04-1159,CHIQUIMULA,JOCOTAN,EORM,CASERIO LOS TORRES ALDEA TUNUCO,53335732,JOSÉ FRANCISCO MORÁN NAVAS,ELSA VERÓNICA BERREONDO GARCÍA,PRIMARIA,OFICIAL,RURAL,ABIERTA,BILINGUE,MATUTINA,DIARIO(REGULAR),CHIQUIMULA
20-04-0013-43,20-04-1159,CHIQUIMULA,JOCOTAN,EORM,CASERIO EL GUAPINOL ALDEA SUCHIQUER,00000000,JOSÉ FRANCISCO MORÁN NAVAS,GLENDA CAROLINA REYES BARILLAS,PRIMARIA,OFICIAL,RURAL,ABIERTA,BILINGUE,MATUTINA,DIARIO(REGULAR),CHIQUIMULA
20-04-0014-43,20-04-1158,CHIQUIMULA,JOCOTAN,EORM,CASERIO EL LIMAR ALDEA EL NARANJO,49141183,ORLANDO ANSELMO CAGUAY DÍAZ,ARMENIA LORENA GARCÍA JORDÁN,PRIMARIA,OFICIAL,RURAL,ABIERTA,BILINGUE,MATUTINA,DIARIO(REGULAR),CHIQUIMULA
20-04-0015-43,20-04-1156,CHIQUIMULA,JOCOTAN,EORM,CASERIO EL TULAR ALDEA GUARERUCHE,31795295,TEODORO RAMÍREZ DE ROSA,MANUEL OMAR REYES GARCIA,PRIMARIA,OFICIAL,RURAL,ABIERTA,BILINGUE,MATUTINA,DIARIO(REGULAR),CHIQUIMULA
20-04-0016-43,20-04-1156,CHIQUIMULA,JOCOTAN,EORM,CASERIO GUIOR ALDEA GUARERUCHE,30739740,TEODORO RAMÍREZ DE ROSA,EDGAR ADOLFO GUTIÉRREZ MARROQUÍN,PRIMARIA,OFICIAL,RURAL,ABIERTA,BILINGUE,MATUTINA,DIARIO(REGULAR),CHIQUIMULA
20-04-0017-43,20-04-1154,CHIQUIMULA,JOCOTAN,EORM,CASERIO LA CALERA LOS VADOS,30976748,MARÍA MAGDALENA PÉREZ MARTÍNEZ,YADIRA MAYBELY GONZÁLEZ MONZÓN,PRIMARIA,OFICIAL,RURAL,ABIERTA,MONOLINGUE,MATUTINA,DIARIO(REGULAR),CHIQUIMULA
20-04-0018-43,20-04-1154,CHIQUIMULA,JOCOTAN,EORM,CASERIO LA CEIBA ALDEA ENCUENTRO GUARAQUICHE,53353569,MARÍA MAGDALENA PÉREZ MARTÍNEZ,KRISTEL MAGALY MARTÍNEZ GARCÍA,PRIMARIA,OFICIAL,RURAL,ABIERTA,MONOLINGUE,MATUTINA,DIARIO(REGULAR),CHIQUIMULA
20-04-0019-43,20-04-1160,CHIQUIMULA,JOCOTAN,EORM,CASERIO SAN FRANCISCO ALDEA EL AMATILLO,57780209,ISIS MODESTA URRUTIA SANDOVAL,MARIELA CESIBEL AMADOR GONZÁLEZ,PRIMARIA,OFICIAL,RURAL,ABIERTA,BILINGUE,MATUTINA,DIARIO(REGULAR),CHIQUIMULA
20-04-0020-43,20-04-1157,CHIQUIMULA,JOCOTAN,EORM,CASERIO DESPOBLADO ALDEA OQUEN,46698495,FRANCISCO JAVIER GUERRA PAZOS,NANCY FABIOLA DEL VALLE PAZ,PRIMARIA,OFICIAL,RURAL,ABIERTA,MONOLINGUE,MATUTINA,DIARIO(REGULAR),CHIQUIMULA
20-04-0021-43,20-04-1156,CHIQUIMULA,JOCOTAN,EORM,CASERIO EL CERRON PELILLO NEGRO,57676802,TEODORO RAMÍREZ DE ROSA,DONIS EDUARDO RAMÍREZ SÚCHITE,PRIMARIA,OFICIAL,RURAL,ABIERTA,BILINGUE,MATUTINA,DIARIO(REGULAR),CHIQUIMULA
20-04-0022-43,20-04-1160,CHIQUIMULA,JOCOTAN,EORM,CASERIO EL FILO TALQUEZAL,55289765,ISIS MODESTA URRUTIA SANDOVAL,HÉCTOR ANÍBAL ALVAREZ GARCÍA,PRIMARIA,OFICIAL,RURAL,ABIERTA,BILINGUE,MATUTINA,DIARIO(REGULAR),CHIQUIMULA
20-04-0023-43,20-04-1158,CHIQUIMULA,JOCOTAN,EORM,CASERIO EL GUAYABO ALDEA EL NARANJO,33591316,ORLANDO ANSELMO CAGUAY DÍAZ,AUDIAS GARCIA Y GARCIA,PRIMARIA,OFICIAL,RURAL,ABIERTA,MONOLINGUE,MATUTINA,DIARIO(REGULAR),CHIQUIMULA
20-04-0024-43,20-04-1156,CHIQUIMULA,JOCOTAN,EORM,BARRIO SAN PEDRITO Y BARRIO EL ZAPOTILLO ALDEA LAS FLORES,54842081,TEODORO RAMÍREZ DE ROSA,KARINA WALESKA ARAGÓN MARROQUÍN,PRIMARIA,OFICIAL,RURAL,ABIERTA,BILINGUE,MATUTINA,DIARIO(REGULAR),CHIQUIMULA
20-04-0025-43,20-04-1155,CHIQUIMULA,JOCOTAN,EORM,CASERIO LAS CASCADAS ALDEA ENCUENTRO GUARAQUICHE,31944020,MARIO ROBERTO SALAZAR DÁVILA,MARÍA ANTONIA RAMÍREZ,PRIMARIA,OFICIAL,RURAL,ABIERTA,MONOLINGUE,MATUTINA,DIARIO(REGULAR),CHIQUIMULA
20-04-0026-43,20-04-1156,CHIQUIMULA,JOCOTAN,EORM,CASERIO EL JOBO ALDEA PACREN,51890744,TEODORO RAMÍREZ DE ROSA,VILMA XIOMARA PÉREZ AMADOR,PRIMARIA,OFICIAL,RURAL,ABIERTA,BILINGUE,MATUTINA,DIARIO(REGULAR),CHIQUIMULA
20-04-0027-43,20-04-1160,CHIQUIMULA,JOCOTAN,EORM,CUMBRE AGUA FRIA ALDEA TALQUEZAL,59020913,ISIS MODESTA URRUTIA SANDOVAL,LESTER ARIEL LEMUS,PRIMARIA,OFICIAL,RURAL,ABIERTA,BILINGUE,MATUTINA,DIARIO(REGULAR),CHIQUIMULA
20-04-0028-43,20-04-1157,CHIQUIMULA,JOCOTAN,EORM,BARRIO EL CEDRO ALDEA TESORO ARRIBA,51841012,FRANCISCO JAVIER GUERRA PAZOS,AMILCAR PEREZ HERNÁNDEZ,PRIMARIA,OFICIAL,RURAL,ABIERTA,MONOLINGUE,MATUTINA,DIARIO(REGULAR),CHIQUIMULA
20-04-0029-43,20-04-1160,CHIQUIMULA,JOCOTAN,EORM,BARRIO LA CRUZ ALDEA LA MINA,31447241,ISIS MODESTA URRUTIA SANDOVAL,SANDRA ILIANA PÉREZ MARTÍNEZ,PRIMARIA,OFICIAL,RURAL,ABIERTA,BILINGUE,MATUTINA,DIARIO(REGULAR),CHIQUIMULA
20-04-0030-43,20-04-1156,CHIQUIMULA,JOCOTAN,EORM,CASERIO LA PUERTA ALDEA PELILLO NEGRO,47908510,TEODORO RAMÍREZ DE ROSA,FROILAN ROMEO PEREZ GARCIA,PRIMARIA,OFICIAL,RURAL,ABIERTA,BILINGUE,MATUTINA,DIARIO(REGULAR),CHIQUIMULA
20-04-0031-43,20-04-1154,CHIQUIMULA,JOCOTAN,EORM,CASERIO EL PERICON ALDEA OCUMBLA,46790690,MARÍA MAGDALENA PÉREZ MARTÍNEZ,JOSÉ ARIEL MONZÓN PÉREZ,PRIMARIA,OFICIAL,RURAL,ABIERTA,MONOLINGUE,MATUTINA,DIARIO(REGULAR),CHIQUIMULA
20-04-0032-43,20-04-1159,CHIQUIMULA,JOCOTAN,EORM,BARRIO LA CEIBA ALDEA TUNUCO ARRIBA,59993799,JOSÉ FRANCISCO MORÁN NAVAS,MARÍA MERCEDES ORTÍZ CARRILLO,PRIMARIA,OFICIAL,RURAL,ABIERTA,BILINGUE,MATUTINA,DIARIO(REGULAR),CHIQUIMULA
20-04-0033-43,20-04-1156,CHIQUIMULA,JOCOTAN,EORM,CASERIO CEMENTERIO ALDEA GUARERUCHE,51789053,TEODORO RAMÍREZ DE ROSA,MILVIA ARACELY RAMÍREZ ALVARES,PRIMARIA,OFICIAL,RURAL,ABIERTA,BILINGUE,MATUTINA,DIARIO(REGULAR),CHIQUIMULA
20-04-0034-43,20-04-1160,CHIQUIMULA,JOCOTAN,EORM,CASERIO HIERBA BUENA ALDEA LA MINA,37656183,ISIS MODESTA URRUTIA SANDOVAL,ISRAEL ARMANDO LOBOS SANCÉ,PRIMARIA,OFICIAL,RURAL,ABIERTA,BILINGUE,MATUTINA,DIARIO(REGULAR),CHIQUIMULA
20-04-0035-43,20-04-1155,CHIQUIMULA,JOCOTAN,EORM,CASERIO EL NANZAL ALDEA EL OREGANO,45863328,MARIO ROBERTO SALAZAR DÁVILA,NELSON ESTUARDO FELIPE MÉNDEZ,PRIMARIA,OFICIAL,RURAL,ABIERTA,BILINGUE,MATUTINA,DIARIO(REGULAR),CHIQUIMULA
20-04-0036-43,20-04-1159,CHIQUIMULA,JOCOTAN,EORM,"BARRIO LA CEIBA, Y PLAN DEL ZAPOTE ALDEA RODEITO",31307504,JOSÉ FRANCISCO MORÁN NAVAS,EDGAR GEOVANNY BERREONDO GARCÍA,PRIMARIA,OFICIAL,RURAL,ABIERTA,BILINGUE,MATUTINA,DIARIO(REGULAR),CHIQUIMULA
20-04-0037-43,20-04-1155,CHIQUIMULA,JOCOTAN,EORM,CASERÍO EL PLAN DE CANDELERO ALDEA ENCUENTRO GUARAQUICHE,50492794,MARIO ROBERTO SALAZAR DÁVILA,JUAN SÚCHITE RAMÍREZ,PRIMARIA,OFICIAL,RURAL,ABIERTA,MONOLINGUE,MATUTINA,DIARIO(REGULAR),CHIQUIMULA
20-04-0038-43,20-04-1156,CHIQUIMULA,JOCOTAN,EORM,BARRIO LA LOMA ALDEA PACREN,46683169,TEODORO RAMÍREZ DE ROSA,LUIS ANTONIO GARCÍA RAMÍREZ,PRIMARIA,OFICIAL,RURAL,ABIERTA,BILINGUE,MATUTINA,DIARIO(REGULAR),CHIQUIMULA
20-04-0039-43,20-04-1155,CHIQUIMULA,JOCOTAN,EORM,CASERIO EL TABLON,30015815,MARIO ROBERTO SALAZAR DÁVILA,NELSI NAYZETH MURCIA LÓPEZ,PRIMARIA,OFICIAL,RURAL,ABIERTA,MONOLINGUE,MATUTINA,DIARIO(REGULAR),CHIQUIMULA
20-04-0040-43,20-04-1159,CHIQUIMULA,JOCOTAN,EORM,CASERÍO EL TIANTE ALDEA PIEDRA PARADA,49352222,JOSÉ FRANCISCO MORÁN NAVAS,HUGO LEONEL RAMÍREZ DÍAZ,PRIMARIA,OFICIAL,RURAL,ABIERTA,MONOLINGUE,MATUTINA,DIARIO(REGULAR),CHIQUIMULA
20-04-0041-43,20-04-1160,CHIQUIMULA,JOCOTAN,EORM,BARRIO EL ARENAL,32150127,ISIS MODESTA URRUTIA SANDOVAL,FIDENCIO PÉREZ DE ROSA,PRIMARIA,OFICIAL,RURAL,ABIERTA,BILINGUE,MATUTINA,DIARIO(REGULAR),CHIQUIMULA
20-04-0042-43,20-04-1154,CHIQUIMULA,JOCOTAN,EORM,BARRIO LOS CLIMACOS ALDEA CANAPARA ABAJO,38455784,MARÍA MAGDALENA PÉREZ MARTÍNEZ,MODESTO DE JESÚS LÓPEZ LORENZO,PRIMARIA,OFICIAL,RURAL,ABIERTA,MONOLINGUE,MATUTINA,DIARIO(REGULAR),CHIQUIMULA
20-04-0043-43,20-04-1154,CHIQUIMULA,JOCOTAN,EORM,CASERIO LA CEIBA ALDEA TALQUEZAL,50600522,MARÍA MAGDALENA PÉREZ MARTÍNEZ,VERÓNICA CORALIA MARTÍNEZ PÉREZ,PRIMARIA,OFICIAL,RURAL,ABIERTA,MONOLINGUE,MATUTINA,DIARIO(REGULAR),CHIQUIMULA
20-04-0044-43,20-04-1155,CHIQUIMULA,JOCOTAN,EORM,CASERIO TALQUEZALITO ALDEA GUAYABILLAS,32931698,MARIO ROBERTO SALAZAR DÁVILA,MARÍA ELIZABETH SÚCHITE GARCÍA,PRIMARIA,OFICIAL,RURAL,ABIERTA,BILINGUE,MATUTINA,DIARIO(REGULAR),CHIQUIMULA
20-04-0045-43,20-04-1154,CHIQUIMULA,JOCOTAN,EORM,CASERIO EL PALMAR ALDEA MATAZANO,46036459,MARÍA MAGDALENA PÉREZ MARTÍNEZ,ROSIDALIA GARCÍA JERÓNIMO,PRIMARIA,OFICIAL,RURAL,ABIERTA,BILINGUE,MATUTINA,DIARIO(REGULAR),CHIQUIMULA
20-04-0046-43,20-04-1154,CHIQUIMULA,JOCOTAN,EORM,CASERIO EL PINALITO ALDEA TIERRA BLANCA,51657384,MARÍA MAGDALENA PÉREZ MARTÍNEZ,ARMANDO MENDEZ SUCHITE,PRIMARIA,OFICIAL,RURAL,ABIERTA,BILINGUE,MATUTINA,DIARIO(REGULAR),CHIQUIMULA
20-04-0047-43,20-04-1160,CHIQUIMULA,JOCOTAN,EORM,BARRIO EL PINALITO ALDEA RODEITO,,ISIS MODESTA URRUTIA SANDOVAL,JOSÉ ESTUARDO GARCÍA GARCÍA,PRIMARIA,OFICIAL,RURAL,ABIERTA,MONOLINGUE,MATUTINA,DIARIO(REGULAR),CHIQUIMULA
20-04-0048-43,20-04-1159,CHIQUIMULA,JOCOTAN,EORM,CASERIO LOS GARCIA ALDEA TUNUCO ABAJO,30287876,JOSÉ FRANCISCO MORÁN NAVAS,LUZ AMANDA GONZÁLEZ JORDÁN,PRIMARIA,OFICIAL,RURAL,ABIERTA,BILINGUE,MATUTINA,DIARIO(REGULAR),CHIQUIMULA
20-04-0049-43,20-04-1160,CHIQUIMULA,JOCOTAN,EORM,CASERIO TIERRA COLORADA ALDEA MATAZANO,40829193,ISIS MODESTA URRUTIA SANDOVAL,NEYDA LETICIA PÉREZ PÉREZ,PRIMARIA,OFICIAL,RURAL,ABIERTA,MONOLINGUE,MATUTINA,DIARIO(REGULAR),CHIQUIMULA
20-04-0050-43,20-04-1158,CHIQUIMULA,JOCOTAN,EORM,BARRIO EL ZAPOTE ALDEA EL NARANJO,,ORLANDO ANSELMO CAGUAY DÍAZ,HERBER MANFREDO DE LA CRUZ INTERIANO,PRIMARIA,OFICIAL,RURAL,ABIERTA,MONOLINGUE,MATUTINA,DIARIO(REGULAR),CHIQUIMULA
20-04-0051-43,20-04-1159,CHIQUIMULA,JOCOTAN,EORM,BARRIO LIQUIDAMBO ALDEA TATUTU,48779490,JOSÉ FRANCISCO MORÁN NAVAS,JOSÉ MANUEL ORELLANA GARCÍA,PRIMARIA,OFICIAL,RURAL,ABIERTA,MONOLINGUE,MATUTINA,DIARIO(REGULAR),CHIQUIMULA
20-04-0052-43,20-04-1155,CHIQUIMULA,JOCOTAN,EORM,CASERIO EL POTRERITO ALDEA CONACASTE,44887690,MARIO ROBERTO SALAZAR DÁVILA,ORALIA SÚCHITE PÉREZ,PRIMARIA,OFICIAL,RURAL,ABIERTA,BILINGUE,MATUTINA,DIARIO(REGULAR),CHIQUIMULA
20-04-0053-43,20-04-1160,CHIQUIMULA,JOCOTAN,EORM,"CASERIO EL MANGO, ALDEA INGENIO GUARAQUICHE",53153618,ISIS MODESTA URRUTIA SANDOVAL,ILSIN MARABET GARCÍA HERNÁNDEZ,PRIMARIA,OFICIAL,RURAL,ABIERTA,MONOLINGUE,MATUTINA,DIARIO(REGULAR),CHIQUIMULA
20-04-0054-43,20-04-1159,CHIQUIMULA,JOCOTAN,EORM,"COMUNIDAD EL ZARZALITO, ALDEA TATUTU",44786295,JOSÉ FRANCISCO MORÁN NAVAS,JORGE ALBERTO LÓPEZ,PRIMARIA,OFICIAL,RURAL,ABIERTA,MONOLINGUE,MATUTINA,DIARIO(REGULAR),CHIQUIMULA
20-04-0055-43,20-04-1159,CHIQUIMULA,JOCOTAN,EORM,BARRIO NUEVO ALDEA TATUTU,44917076,JOSÉ FRANCISCO MORÁN NAVAS,MILTON GEOVANNY LARA,PRIMARIA,OFICIAL,RURAL,ABIERTA,BILINGUE,MATUTINA,DIARIO(REGULAR),CHIQUIMULA
20-04-0056-43,20-04-1158,CHIQUIMULA,JOCOTAN,EORM,CASERIO LOS HERNANDEZ ALDEA TONTOLES,59590646,ORLANDO ANSELMO CAGUAY DÍAZ,GUADALUPE DEL ROSARIO ORTÍZ CARRILLO,PRIMARIA,OFICIAL,RURAL,ABIERTA,BILINGUE,MATUTINA,DIARIO(REGULAR),CHIQUIMULA
20-04-0057-43,20-04-1159,CHIQUIMULA,JOCOTAN,EORM,CASERIO LA CEIBA ALDEA SUCHIQUER,39167295,JOSÉ FRANCISCO MORÁN NAVAS,GLORIA ARGENTINA GARCÍA HERNÁNDEZ,PRIMARIA,OFICIAL,RURAL,ABIERTA,BILINGUE,MATUTINA,DIARIO(REGULAR),CHIQUIMULA
20-04-0058-43,20-04-1159,CHIQUIMULA,JOCOTAN,EORM,CASERIO LA CEIBA ALDEA TUNOCO ABAJO,32994198,JOSÉ FRANCISCO MORÁN NAVAS,EDGAR VÁSQUEZ HERNÁNDEZ,PRIMARIA,OFICIAL,RURAL,ABIERTA,BILINGUE,MATUTINA,DIARIO(REGULAR),CHIQUIMULA
20-04-0059-43,20-04-1157,CHIQUIMULA,JOCOTAN,EORM,"COMUNIDAD LAS LAJAS, ALDEA OQUEN",55501371,FRANCISCO JAVIER GUERRA PAZOS,GERSON GEOVANNY MÉNDEZ GARCÍA,PRIMARIA,OFICIAL,RURAL,ABIERTA,BILINGUE,MATUTINA,DIARIO(REGULAR),CHIQUIMULA
20-04-0060-43,20-04-1158,CHIQUIMULA,JOCOTAN,EORM,CASERIO MAL PASO ALDEA TANSHA,46860558,ORLANDO ANSELMO CAGUAY DÍAZ,WILSON ARIEL ALMAZÁN GARCÍA,PRIMARIA,OFICIAL,RURAL,ABIERTA,BILINGUE,MATUTINA,DIARIO(REGULAR),CHIQUIMULA
20-04-0061-43,20-04-1160,CHIQUIMULA,JOCOTAN,EORM,CASERIO PLAN DEL MANGO ALDEA SUCHIQUER,48583017,ISIS MODESTA URRUTIA SANDOVAL,HUGO LEONEL DÍAZ DÍAZ,PRIMARIA,OFICIAL,RURAL,ABIERTA,BILINGUE,MATUTINA,DIARIO(REGULAR),CHIQUIMULA
20-04-0062-43,20-04-1154,CHIQUIMULA,JOCOTAN,EORM,CASERIO EL CEDRAL ALDEA TALQUEZAL,,MARÍA MAGDALENA PÉREZ MARTÍNEZ,HÉCTOR ESTUARDO GARCÍA ESQUIVEL,PRIMARIA,OFICIAL,RURAL,ABIERTA,BILINGUE,MATUTINA,DIARIO(REGULAR),CHIQUIMULA
20-04-0063-43,20-04-1153,CHIQUIMULA,JOCOTAN,COLEGIO CENTRO CULTURAL CAMPO REAL,BARRIO SAN LORENZO,79465751,SERGIO ESTUARDO MEDINA GUDIEL,GLORIA ESTELA GUERRA GUTIÉRREZ,PRIMARIA,PRIVADO,URBANA,ABIERTA,MONOLINGUE,MATUTINA,DIARIO(REGULAR),CHIQUIMULA
20-04-0079-43,20-04-1157,CHIQUIMULA,JOCOTAN,EORM,ALDEA OQUEN CASERIO LA CUESTONA,31072243,FRANCISCO JAVIER GUERRA PAZOS,ANA ISABEL GUTIERREZ PORTILLO,PRIMARIA,OFICIAL,RURAL,ABIERTA,BILINGUE,MATUTINA,DIARIO(REGULAR),CHIQUIMULA
20-04-0087-43,20-04-1155,CHIQUIMULA,JOCOTAN,EORM,"CASERIO BARRIO NUEVO, ALDEA GUAYABILLAS",30075588,MARIO ROBERTO SALAZAR DÁVILA,JOSÉ ISMAEL GARCÍA HERNÁNDEZ,PRIMARIA,OFICIAL,RURAL,ABIERTA,BILINGUE,MATUTINA,DIARIO(REGULAR),CHIQUIMULA
20-04-0094-43,20-04-1153,CHIQUIMULA,JOCOTAN,COLEGIO PRIVADO EL OLAM,BARRIO EL CEMENTERIO,45488849,SERGIO ESTUARDO MEDINA GUDIEL,OSEAS GAMALIEL CORDERO VELÁSQUEZ,PRIMARIA,PRIVADO,URBANA,ABIERTA,MONOLINGUE,MATUTINA,DIARIO(REGULAR),CHIQUIMULA
20-04-0099-43,20-04-1154,CHIQUIMULA,JOCOTAN,ESCUELA MUNICIPAL RURAL MIXTA,"CASERIO LA CEIBA, ALDEA CUMBRE DE LA ARADA",40719759,MARÍA MAGDALENA PÉREZ MARTÍNEZ,MAURA LETICIA VÁSQUEZ GARCÍA,PRIMARIA,MUNICIPAL,RURAL,ABIERTA,MONOLINGUE,MATUTINA,DIARIO(REGULAR),CHIQUIMULA
20-04-0103-43,20-04-1157,CHIQUIMULA,JOCOTAN,EMRM,"CASERIO LOS GONZALEZ, ALDEA EL POTRERO",,FRANCISCO JAVIER GUERRA PAZOS,LESVIA XIOMARA GUTIÉRREZ GARCÍA,PRIMARIA,MUNICIPAL,RURAL,ABIERTA,MONOLINGUE,MATUTINA,DIARIO(REGULAR),CHIQUIMULA
20-04-0108-43,20-004,CHIQUIMULA,JOCOTAN,CENTRO EDUCATIVO JOCOTECO BILINGÜE,BARRIO EL CEMENTERIO,79465036,SERGIO ESTUARDO MEDINA GUDIEL,MARTA VERÓNICA MORALES MARTÍNEZ DE GÁLVEZ,PRIMARIA,PRIVADO,URBANA,CERRADA DEFINITIVAMENTE,MONOLINGUE,MATUTINA,DIARIO(REGULAR),CHIQUIMULA
