0,1,2,3,4,5,6,7,8,9,10,11,12,13,14,15,16
CODIGO,DISTRITO,DEPARTAMENTO,MUNICIPIO,ESTABLECIMIENTO,DIRECCION,TELEFONO,SUPERVISOR,DIRECTOR,NIVEL,SECTOR,AREA,STATUS,MODALIDAD,JORNADA,PLAN,DEPARTAMENTAL
05-01-0103-45,05-033,ESCUINTLA,ESCUINTLA,LICEO TECNOLOGICO AMERICANO,4A. AVENIDA 2-56 ZONA 1,78880703,REMY ARTURO SINAY GUDIEL,VIRGINIA RODRIGUEZ JIMENEZ DE CORCUERA,BASICO,PRIVADO,URBANA,CERRADA TEMPORALMENTE,MONOLINGUE,MATUTINA,DIARIO(REGULAR),ESCUINTLA
05-01-0108-45,05-01-0258,ESCUINTLA,ESCUINTLA,IEBC DE ENSEÑANZA,"LOTE 2-A, COLONIA SANTA ROSA ALDEA EL RODEO",50567276,ALMA LIBERTAD PÉREZ MARTÍNEZ,MILTON LAUREANO GONZÁLEZ LARIOS,BASICO,COOPERATIVA,RURAL,ABIERTA,MONOLINGUE,VESPERTINA,DIARIO(REGULAR),ESCUINTLA
05-01-0109-45,,ESCUINTLA,ESCUINTLA,IEBC DE ENSEÑANZA,3A CALLE COLONIA MONTERREY,,,,BASICO,COOPERATIVA,URBANA,CERRADA DEFINITIVAMENTE,MONOLINGUE,VESPERTINA,DIARIO(REGULAR),ESCUINTLA
05-01-0110-45,05-01-0260,ESCUINTLA,ESCUINTLA,INEB SIMON BERGAÑO Y VILLEGAS,1A AVENIDA. 10-30 ZONA 1,78880048,REMY ARTURO SINAY GUDIEL,MARÍA SOLEDAD GUZMÁN BARRIENTOS,BASICO,OFICIAL,URBANA,ABIERTA,MONOLINGUE,MATUTINA,DIARIO(REGULAR),ESCUINTLA
05-01-0112-45,,ESCUINTLA,ESCUINTLA,IPMB 'CENTRO EDUCATIVO ESPAÑOL',5A AVE. 2-51 ZONA 1,,,,BASICO,PRIVADO,URBANA,CERRADA DEFINITIVAMENTE,MONOLINGUE,VESPERTINA,DIARIO(REGULAR),ESCUINTLA
05-01-0113-45,05-033,ESCUINTLA,ESCUINTLA,COLEGIO CRISTIANO JEHOVA NISSI,5TA. CALLE Y 5TA AVENIDA LOTE NO. 42 COLONIA EL ESFUERZO,,REMY ARTURO SINAY GUDIEL,DORA EGLANTINA VALDEZ MELGAR,BASICO,PRIVADO,URBANA,CERRADA DEFINITIVAMENTE,MONOLINGUE,VESPERTINA,FIN DE SEMANA,ESCUINTLA
05-01-0114-45,,ESCUINTLA,ESCUINTLA,CENTRO EDUCATIVO 'MIGUEL ANGEL ASTURIAS',5A AVE. 6-61 ZONA 1,,,,BASICO,PRIVADO,URBANA,CERRADA DEFINITIVAMENTE,MONOLINGUE,VESPERTINA,DIARIO(REGULAR),ESCUINTLA
05-01-0116-45,05-033,ESCUINTLA,ESCUINTLA,IPMB 'PEDAGOGICO ESCUINTLECO CIENCIA Y ARTE',5A AVE. 10-87 ZONA 1,78892455,REMY ARTURO SINAY GUDIEL,,BASICO,PRIVADO,URBANA,CERRADA TEMPORALMENTE,MONOLINGUE,VESPERTINA,DIARIO(REGULAR),ESCUINTLA
05-01-0117-45,05-033,ESCUINTLA,ESCUINTLA,LICEO MIXTO NOCTURNO 'IZCUINTLAN',5A.AVENIDA 6-61 ZONA 1,,REMY ARTURO SINAY GUDIEL,,BASICO,PRIVADO,URBANA,CERRADA TEMPORALMENTE,MONOLINGUE,NOCTURNA,DIARIO(REGULAR),ESCUINTLA
05-01-0120-45,05-01-0254,ESCUINTLA,ESCUINTLA,CENTRO ESCOLAR NUESTRA SEÑORA DE CONCEPCION,KM. 59 CARRETERA A SANTA LUCIA COTZUMALGUAPA,78881194,AUGUSTO WALDEMAR DEL CID DEL CID,TOMASA ZACARÍAS DOMINGO,BASICO,PRIVADO,URBANA,ABIERTA,MONOLINGUE,MATUTINA,DIARIO(REGULAR),ESCUINTLA
05-01-0121-45,05-01-0259,ESCUINTLA,ESCUINTLA,IPMB 'TECNICO EXPERIMENTAL DEL SUR',1A. CALLE 2-38 ZONA 3,31651314,EDDY GABRIEL RAMÍREZ CHACÓN,JUAN ROMEO SUÁREZ CHACÓN,BASICO,PRIVADO,URBANA,ABIERTA,MONOLINGUE,VESPERTINA,DIARIO(REGULAR),ESCUINTLA
05-01-0123-45,,ESCUINTLA,ESCUINTLA,IPMB 'MINERVA',8A CALLE 2-54 ZONA 1,,,,BASICO,PRIVADO,URBANA,CERRADA TEMPORALMENTE,MONOLINGUE,NOCTURNA,DIARIO(REGULAR),ESCUINTLA
05-01-0125-45,05-01-0254,ESCUINTLA,ESCUINTLA,COLEGIO PARTICULAR MIXTO ESCUINTLECO BILINGÜE,1A.AVENIDA 6-60 ZONA 4,78890988,AUGUSTO WALDEMAR DEL CID DEL CID,GIEZI HAZAEL LÓPEZ BLANCO,BASICO,PRIVADO,URBANA,ABIERTA,MONOLINGUE,MATUTINA,DIARIO(REGULAR),ESCUINTLA
05-01-0127-45,05-01-0254,ESCUINTLA,ESCUINTLA,CORPORACIÓN DE LICEO EDUCATIVO TECNICO EVANGELICO SOCIEDAD ANÓNIMA,1AV AVENIDA 5-80 ZONA 4,78899679,AUGUSTO WALDEMAR DEL CID DEL CID,IRMA MARÍA BARRIOS Y BARRIOS,BASICO,PRIVADO,URBANA,CERRADA TEMPORALMENTE,MONOLINGUE,VESPERTINA,DIARIO(REGULAR),ESCUINTLA
05-01-0129-45,05-033,ESCUINTLA,ESCUINTLA,LICEO 'JUVENIL CENTROAMERICANO',7A CALLE 3-02 ZONA 1,78880365,REMY ARTURO SINAY GUDIEL,,BASICO,PRIVADO,URBANA,CERRADA TEMPORALMENTE,MONOLINGUE,VESPERTINA,DIARIO(REGULAR),ESCUINTLA
05-01-0131-45,,ESCUINTLA,ESCUINTLA,CENTRO EDUCTIVO 'MIGUEL ANGEL ASTURIAS',5A AVE 6-61 ZONA 1,,,,BASICO,PRIVADO,URBANA,CERRADA DEFINITIVAMENTE,MONOLINGUE,NOCTURNA,DIARIO(REGULAR),ESCUINTLA
05-01-0133-45,05-01-0255,ESCUINTLA,ESCUINTLA,INEBE 'DR.CARLOS SAMAYOA CHINCHILLA',4A AVE. 15-20 ZONA 4,78890946,ANA MERCEDES CABRERA ESTÉVEZ DE PALOMO,FULBIA YISEL CASTELLANOS CONTRERAS,BASICO,OFICIAL,URBANA,ABIERTA,MONOLINGUE,MATUTINA,DIARIO(REGULAR),ESCUINTLA
05-01-0134-45,05-01-0257,ESCUINTLA,ESCUINTLA,INEB,7A CALLE 3-02 ZONA 1,57171570,LUZ DEL ROSARIO RODRÍGUEZ DE LEÓN,LEONEL ARNULFO ORTEGA MORATAYA,BASICO,OFICIAL,URBANA,ABIERTA,MONOLINGUE,NOCTURNA,DIARIO(REGULAR),ESCUINTLA
05-01-0136-45,,ESCUINTLA,ESCUINTLA,IPMB COLEGIO MIXTO 'LA NIÑEZ',5A CALLE 3-33 ZONA 1,,,,BASICO,PRIVADO,URBANA,CERRADA DEFINITIVAMENTE,MONOLINGUE,MATUTINA,DIARIO(REGULAR),ESCUINTLA
05-01-0137-45,,ESCUINTLA,ESCUINTLA,IPMB 'LICEO OPUS NOVI',3A AVE. 4-50 ZONA 1,,,,BASICO,PRIVADO,URBANA,CERRADA DEFINITIVAMENTE,MONOLINGUE,NOCTURNA,DIARIO(REGULAR),ESCUINTLA
05-01-0138-45,05-033,ESCUINTLA,ESCUINTLA,IPMB COLEGIO 'INTERAMERICANO DEL SUR',5A CALLE 3-34 ZONA 1,57143862,REMY ARTURO SINAY GUDIEL,,BASICO,PRIVADO,URBANA,CERRADA DEFINITIVAMENTE,MONOLINGUE,VESPERTINA,DIARIO(REGULAR),ESCUINTLA
05-01-0139-45,,ESCUINTLA,ESCUINTLA,IPMB 'CENTRO COEDUCACIONAL AMERICANO',16 AVE. LOTE 16 SECCION 'C' COLONIA HUNAPU,,,,BASICO,PRIVADO,URBANA,CERRADA DEFINITIVAMENTE,MONOLINGUE,VESPERTINA,DIARIO(REGULAR),ESCUINTLA
05-01-0140-45,05-033,ESCUINTLA,ESCUINTLA,IEBC DE ENSEÑANZA PROF. MAX PAREDES LIMA,COLONIA ROSALINDA,78841299,REMY ARTURO SINAY GUDIEL,CÉSAR BENJAMÍN LARIOS CASTILLO,BASICO,COOPERATIVA,URBANA,CERRADA TEMPORALMENTE,MONOLINGUE,VESPERTINA,DIARIO(REGULAR),ESCUINTLA
05-01-0141-45,05-01-0252,ESCUINTLA,ESCUINTLA,INSTITUTO DE EDUCACION BASICA POR COOPERATIVA DE ENSEÑANZA,1 AVENIDA 3-29 ZONA 3 COLONIA LAS GOLONDRINAS,78899582,MARIA DEL CARMEN SANDOVAL LOPEZ,MANUELA DE JESÚS GONZÁLEZ CANO,BASICO,COOPERATIVA,URBANA,ABIERTA,MONOLINGUE,VESPERTINA,DIARIO(REGULAR),ESCUINTLA
05-01-0142-45,05-01-0259,ESCUINTLA,ESCUINTLA,IEBC DE ENSEÑANZA SAN FELIPE,COLONIA SAN FELIPE (EL CEMENTERIO),47720318,EDDY GABRIEL RAMÍREZ CHACÓN,VIVIAN WALENDA RAMOS CARBALLO,BASICO,COOPERATIVA,URBANA,ABIERTA,MONOLINGUE,VESPERTINA,DIARIO(REGULAR),ESCUINTLA
05-01-0143-45,05-033,ESCUINTLA,ESCUINTLA,IEBC DE ENSEÑANZA,COLONIA DEL FERROCARRILERO,78895114,REMY ARTURO SINAY GUDIEL,MARÍA NIEVES CORADO SAGASTUME,BASICO,COOPERATIVA,URBANA,CERRADA TEMPORALMENTE,MONOLINGUE,VESPERTINA,DIARIO(REGULAR),ESCUINTLA
05-01-0152-45,05-033,ESCUINTLA,ESCUINTLA,CENTRO EDUCATIVO MAYA,4A. AVENIDA 6-76 ZONA 1,41349750-54182377,REMY ARTURO SINAY GUDIEL,BYRON ESTUARDO GONZALEZ ENRIQUEZ,BASICO,PRIVADO,URBANA,CERRADA TEMPORALMENTE,MONOLINGUE,MATUTINA,DIARIO(REGULAR),ESCUINTLA
05-01-0157-45,05-01-0256,ESCUINTLA,ESCUINTLA,INEB DE TELESECUNDARIA,COLONIA MONTERREY,41126296,SUCELY MAGDALENA DEL ÁGUILA ARANA DE ROBLES,MERLIN LUCILA PEREIRA SOTO,BASICO,OFICIAL,RURAL,ABIERTA,MONOLINGUE,VESPERTINA,DIARIO(REGULAR),ESCUINTLA
05-01-0158-45,05-01-0257,ESCUINTLA,ESCUINTLA,INEB DE TELESECUNDARIA,CASERIO SAN ANTONIO CALVILLO,54089454,LUZ DEL ROSARIO RODRÍGUEZ DE LEÓN,CARLOS ENRIQUE MENÉNDEZ JIMÉNEZ,BASICO,OFICIAL,RURAL,ABIERTA,MONOLINGUE,VESPERTINA,DIARIO(REGULAR),ESCUINTLA
05-01-0159-45,05-01-0258,ESCUINTLA,ESCUINTLA,INEB DE TELESECUNDARIA,COLONIA HUNAPU,47686274,ALMA LIBERTAD PÉREZ MARTÍNEZ,NOELIA CONSUELO PINEDA CASTELLANOS,BASICO,OFICIAL,RURAL,ABIERTA,MONOLINGUE,VESPERTINA,DIARIO(REGULAR),ESCUINTLA
05-01-0160-45,05-01-0257,ESCUINTLA,ESCUINTLA,INEB,"1A. AVENIDA Y 2A CALLE ZONA 2, COLONIA EL PITO",53639101,LUZ DEL ROSARIO RODRÍGUEZ DE LEÓN,ELMA BRISBEÍNA AGUILAR COLLADO,BASICO,OFICIAL,URBANA,ABIERTA,MONOLINGUE,VESPERTINA,DIARIO(REGULAR),ESCUINTLA
05-01-0171-45,05-033,ESCUINTLA,ESCUINTLA,COLEGIO CRISTIANO JEHOVA NISSI,5TA. CALLEL Y 5TA. AVENIDA LOTE NO. 42,,REMY ARTURO SINAY GUDIEL,DORA EGLANTINA VALDEZ MELGAR,BASICO,PRIVADO,URBANA,CERRADA TEMPORALMENTE,MONOLINGUE,VESPERTINA,DIARIO(REGULAR),ESCUINTLA
05-01-0195-45,05-01-0256,ESCUINTLA,ESCUINTLA,INEB DE TELESECUNDARIA,COLONIA SAN GABRIEL,40503495,SUCELY MAGDALENA DEL ÁGUILA ARANA DE ROBLES,CARLOS EMILIO BATRES SECAIDA,BASICO,OFICIAL,RURAL,ABIERTA,MONOLINGUE,VESPERTINA,DIARIO(REGULAR),ESCUINTLA
05-01-0196-45,05-033,ESCUINTLA,ESCUINTLA,INEB DE TELESECUNDARIA,COLONIA LOS PORTALES 79625252,79625252,REMY ARTURO SINAY GUDIEL,CARLOS RONAL DAVID FOLGAR ZUÑIGA,BASICO,OFICIAL,RURAL,CERRADA TEMPORALMENTE,MONOLINGUE,VESPERTINA,DIARIO(REGULAR),ESCUINTLA
05-01-0197-45,05-01-0254,ESCUINTLA,ESCUINTLA,INEB DE TELESECUNDARIA,ALDEA EL FLORIDO ACEITUNO,50007075,AUGUSTO WALDEMAR DEL CID DEL CID,ROSA ISABEL FIGUEROA VASQUEZ,BASICO,OFICIAL,RURAL,ABIERTA,MONOLINGUE,VESPERTINA,DIARIO(REGULAR),ESCUINTLA
05-01-0198-45,05-033,ESCUINTLA,ESCUINTLA,COLEGIO BILINGUE SANTO DOMINGO,11 CALLE 5-20 DE LA ZONA 1,78893504,REMY ARTURO SINAY GUDIEL,MAGDALENA FAJARDO PINEDA,BASICO,PRIVADO,URBANA,CERRADA TEMPORALMENTE,MONOLINGUE,MATUTINA,DIARIO(REGULAR),ESCUINTLA
05-01-0204-45,05-033,ESCUINTLA,ESCUINTLA,"LICEO MIXTO EDUCATIVO DE FORMACIÓN INTEGRAL ""LIMEFI""","3A. AVENIDA ""A"" 1-92 ZONA 1",59226839,REMY ARTURO SINAY GUDIEL,RUTH LORENA AREVALO OSORIO,BASICO,PRIVADO,URBANA,CERRADA TEMPORALMENTE,MONOLINGUE,DOBLE,FIN DE SEMANA,ESCUINTLA
05-01-0206-45,05-01-0259,ESCUINTLA,ESCUINTLA,LICEO EVANGÉLICO EL EDÉN,6 AVENIDA 13-86 ZONA 1,41261831,EDDY GABRIEL RAMÍREZ CHACÓN,SANDRA JUDITH COLLADO SOLARES,BASICO,PRIVADO,URBANA,ABIERTA,MONOLINGUE,VESPERTINA,DIARIO(REGULAR),ESCUINTLA
05-01-0210-45,05-033,ESCUINTLA,ESCUINTLA,CENTRO PRE-UNIVERSITARIO DEL SUR,"7A. AVENIDA 23-45 ZONA 5, COLONIA CAÑAVERAL I",78866221,REMY ARTURO SINAY GUDIEL,JOSE ALBERTO ORELLANA GONZALEZ,BASICO,PRIVADO,URBANA,CERRADA TEMPORALMENTE,MONOLINGUE,VESPERTINA,DIARIO(REGULAR),ESCUINTLA
05-01-0217-45,05-01-0260,ESCUINTLA,ESCUINTLA,COLEGIO MIXTO EVANGÉLICO CON COMPUTACIÓN NAZARETH,12 CALLE 2-86 ZONA 1,78890060,REMY ARTURO SINAY GUDIEL,MARYLEEN EMILIA CARRERA VELIZ,BASICO,PRIVADO,URBANA,ABIERTA,MONOLINGUE,MATUTINA,DIARIO(REGULAR),ESCUINTLA
05-01-0218-45,05-033,ESCUINTLA,ESCUINTLA,LICEO INGLES SANTA ANA CON COMPUTACION,4TA. AVENIDA 3-57 ZONA 1,78894056,REMY ARTURO SINAY GUDIEL,MARÍA ELENA PINTO TINOCO,BASICO,PRIVADO,URBANA,CERRADA TEMPORALMENTE,MONOLINGUE,MATUTINA,DIARIO(REGULAR),ESCUINTLA
05-01-0219-45,05-01-0252,ESCUINTLA,ESCUINTLA,COLEGIO TECNICO ADVENTISTA DEL SUR,PRIMER CALLEJON 0-04 ZONA 3 CANTON LOS VOLADORES,51436800,MARIA DEL CARMEN SANDOVAL LOPEZ,LUZ ELENA MURALLES SALGUERO,BASICO,PRIVADO,RURAL,ABIERTA,MONOLINGUE,MATUTINA,DIARIO(REGULAR),ESCUINTLA
05-01-0234-45,05-033,ESCUINTLA,ESCUINTLA,INEB TELESECUNDARIA,MICRO-PARCELAMIENTO CHUCHU,79625252,REMY ARTURO SINAY GUDIEL,REMY ARTURO SINAY GUDIEL,BASICO,OFICIAL,RURAL,CERRADA TEMPORALMENTE,MONOLINGUE,VESPERTINA,DIARIO(REGULAR),ESCUINTLA
05-01-0235-45,05-021,ESCUINTLA,ESCUINTLA,INEB TELESECUNDARIA,COMUNIDAD AGRARIA SAN ANDRES OSUNA,50315962,LUZ DEL ROSARIO RODRIGUEZ DE LEON,JOSE ANIBAL CHUC COT,BASICO,OFICIAL,RURAL,CERRADA TEMPORALMENTE,MONOLINGUE,MATUTINA,DIARIO(REGULAR),ESCUINTLA
05-01-0236-45,05-01-0253,ESCUINTLA,ESCUINTLA,NUCLEO FAMILIAR PARA EL DESARROLLO NUFED NO. 328,COMUNIDAD AGRARIA CEYLAN,55738888,EMILSA NOEMI GARCÍA FUENTES,JOSE FRANCISCO DE LOS SANTOS CASTRO,BASICO,OFICIAL,RURAL,ABIERTA,MONOLINGUE,VESPERTINA,DIARIO(REGULAR),ESCUINTLA
05-01-0255-45,05-01-0257,ESCUINTLA,ESCUINTLA,INSTITUTO TÉCNICO CIENCIAS INDUSTRIALES,2A. CALLE 3-28 ZONA 1,78898879,LUZ DEL ROSARIO RODRÍGUEZ DE LEÓN,MAYRON USIEL LOAIZA GARCIA,BASICO,PRIVADO,URBANA,ABIERTA,MONOLINGUE,MATUTINA,DIARIO(REGULAR),ESCUINTLA
05-01-0257-45,05-033,ESCUINTLA,ESCUINTLA,COLEGIO SANTIAGO DE LOS CABALLEROS DE GUATEMALA,2DA AVENIDA 10-98 ZONA 1,78898751,REMY ARTURO SINAY GUDIEL,SILVIA ELENA RUIZ THEISSEN,BASICO,PRIVADO,URBANA,CERRADA TEMPORALMENTE,MONOLINGUE,DOBLE,FIN DE SEMANA,ESCUINTLA
05-01-0258-45,05-033,ESCUINTLA,ESCUINTLA,COLEGIO SANTIAGO DE LOS CABALLEROS DE GUATEMALA,2DA AVENIDA 10-98 ZONA 1,78898751,REMY ARTURO SINAY GUDIEL,SILVIA ELENA RUIZ THEISSEN DE CARDONA,BASICO,PRIVADO,URBANA,CERRADA TEMPORALMENTE,MONOLINGUE,DOBLE,FIN DE SEMANA,ESCUINTLA
05-01-0260-45,05-033,ESCUINTLA,ESCUINTLA,COLEGIO INTERNACIONAL FLC,5TA CALLE 3-33 ZONA 1 ESCUINTLA,42161227,REMY ARTURO SINAY GUDIEL,JESSICA JEANNETTE SAGASTUME HICKS TZORIN,BASICO,PRIVADO,URBANA,CERRADA TEMPORALMENTE,MONOLINGUE,DOBLE,FIN DE SEMANA,ESCUINTLA
05-01-0261-45,05-033,ESCUINTLA,ESCUINTLA,COLEGIO INTERNACIONAL FLC,5TA CALLE 3-33 ZONA 1 ESCUINTLA,78841293,REMY ARTURO SINAY GUDIEL,JESSICA JEANNETTE SAGASTUME HICKS,BASICO,PRIVADO,URBANA,CERRADA TEMPORALMENTE,MONOLINGUE,DOBLE,FIN DE SEMANA,ESCUINTLA
05-01-0262-45,05-01-0253,ESCUINTLA,ESCUINTLA,IEBC DE ENSEÑANZA,COMUNIDAD AGRARIA SAN ANDRES OSUNA,59987153,EMILSA NOEMI GARCÍA FUENTES,DILMAN FIDEL GODINEZ LOPEZ,BASICO,COOPERATIVA,RURAL,ABIERTA,MONOLINGUE,VESPERTINA,DIARIO(REGULAR),ESCUINTLA
05-01-0264-45,05-01-0261,ESCUINTLA,ESCUINTLA,INSTITUTO DE EDUCACIÓN BÁSICA POR COOPERATIVA,6A. CALLE Y 1A. AVENIDA 1-21 ZONA 2 COLONIA PALMERAS DEL NORTE,32213372,EMILSA NOEMI GARCÍA FUENTES,ALBA ARGENTINA FRANCO CASTELLANOS,BASICO,COOPERATIVA,RURAL,ABIERTA,MONOLINGUE,VESPERTINA,DIARIO(REGULAR),ESCUINTLA
05-01-0266-45,05-033,ESCUINTLA,ESCUINTLA,IEBP SANTA MARÍA DE GUADALUPE,FINCA CONCEPCION FINCA CONCEPCION,79689030,REMY ARTURO SINAY GUDIEL,SUZETH JOAJANA JEREZ HERNANDEZ,BASICO,PRIVADO,RURAL,CERRADA DEFINITIVAMENTE,MONOLINGUE,MATUTINA,DIARIO(REGULAR),ESCUINTLA
05-01-0276-45,05-01-0259,ESCUINTLA,ESCUINTLA,COLEGIO BILINGÜE JARDÍN AMERICANO,"3A CALLE SECTOR B LOTE 21, COLONIA JACARANDAS 1, ZONA 3",37826662,EDDY GABRIEL RAMÍREZ CHACÓN,CLAUDIA ARGENTINA JIMÉNEZ PRADO,BASICO,PRIVADO,URBANA,ABIERTA,MONOLINGUE,MATUTINA,DIARIO(REGULAR),ESCUINTLA
05-01-0277-45,05-01-0255,ESCUINTLA,ESCUINTLA,CENTRO EDUCATIVO ASCENSIS,5TA AV. 1-94 ZONA 1,41525917,ANA MERCEDES CABRERA ESTÉVEZ DE PALOMO,EVELYN GABRIELA SEGURA ASCENCIO,BASICO,PRIVADO,URBANA,ABIERTA,MONOLINGUE,MATUTINA,DIARIO(REGULAR),ESCUINTLA
05-01-0279-45,05-01-0257,ESCUINTLA,ESCUINTLA,CENTRO EDUCATIVO DR. JOSÉ SEVERO MARTÍNEZ,5A. AVENIDA 6-61 ZONA 1,55466255,LUZ DEL ROSARIO RODRÍGUEZ DE LEÓN,EDGAR RAFAEL HURTARTE GONZÁLEZ,BASICO,PRIVADO,URBANA,ABIERTA,MONOLINGUE,MATUTINA,DIARIO(REGULAR),ESCUINTLA
05-01-0281-45,05-033,ESCUINTLA,ESCUINTLA,CENTRO EDUCATIVO EL BOSQUE,"1ERA. AV. Y 2DA. CALLE ZONA 2, COLONIA SAN PEDRO",78893403,REMY ARTURO SINAY GUDIEL,ANA MERCEDES CABRERA ESTÉVEZ,BASICO,PRIVADO,URBANA,CERRADA TEMPORALMENTE,MONOLINGUE,VESPERTINA,DIARIO(REGULAR),ESCUINTLA
05-01-0282-45,05-01-0261,ESCUINTLA,ESCUINTLA,CENTRO EDUCATIVO EL BOSQUE,1A. CALLE A 4-52 ZONA 2 COLONIA EL QUETZAL,56932945,EMILSA NOEMI GARCÍA FUENTES,EMILSA NOEMÍ GARCÍA FUENTES,BASICO,PRIVADO,URBANA,ABIERTA,MONOLINGUE,DOBLE,FIN DE SEMANA,ESCUINTLA
05-01-0283-45,05-033,ESCUINTLA,ESCUINTLA,CENTRO EDUCATIVO EL BOSQUE,"1ERA. AV. Y 2DA. CALLE ZONA 2, COLONIA SAN PEDRO",78893403,REMY ARTURO SINAY GUDIEL,ANA MERCEDES CABRERA ESTÉVEZ,BASICO,PRIVADO,URBANA,CERRADA DEFINITIVAMENTE,MONOLINGUE,DOBLE,FIN DE SEMANA,ESCUINTLA
05-01-0285-45,05-01-0253,ESCUINTLA,ESCUINTLA,CENTRO DE DESARROLLO INTEGRAL FUENTE DE ESPERANZA,LOTE 9 CALLE PRINCIPAL ALDEA GUADALUPE,47635471,EMILSA NOEMI GARCÍA FUENTES,DENIFFE RAQUEL CIFUENTES LÓPEZ,BASICO,PRIVADO,RURAL,ABIERTA,MONOLINGUE,MATUTINA,DIARIO(REGULAR),ESCUINTLA
05-01-0291-45,05-033,ESCUINTLA,ESCUINTLA,LICEO JUVENIL LA PATRIA,2A. AVENIDA A 2-15 ZONA 2 COLONIA EL FERRROCARRILERO,78897674,REMY ARTURO SINAY GUDIEL,CLAUDIA SUSETH YANES SOLARES,BASICO,PRIVADO,URBANA,CERRADA TEMPORALMENTE,MONOLINGUE,MATUTINA,DIARIO(REGULAR),ESCUINTLA
05-01-0298-45,05-033,ESCUINTLA,ESCUINTLA,"CENTRO EDUCATIVO Y FORMACION HUMANA ""DE MARÍA""","3A AVENIDA ""A"" 4-48 ZONA 1",42065584,REMY ARTURO SINAY GUDIEL,ERICK IVAN RIVERA MARTINEZ,BASICO,PRIVADO,URBANA,ABIERTA,MONOLINGUE,MATUTINA,DIARIO(REGULAR),ESCUINTLA
05-01-0300-45,05-01-0261,ESCUINTLA,ESCUINTLA,COLEGIO BILINGÜE CON COMPUTACIÓN DEL PRADO,"2DA. AVENIDA 1-99 ZONA 2, COLONIA DEL FERROCARRILERO",78892172,EMILSA NOEMI GARCÍA FUENTES,ALICIA ODETH DÍAZ TEJADA,BASICO,PRIVADO,URBANA,ABIERTA,MONOLINGUE,MATUTINA,DIARIO(REGULAR),ESCUINTLA
05-01-0301-45,05-01-0260,ESCUINTLA,ESCUINTLA,CENTRO EDUCATIVO CAMPUS SUR,KILOMETRO 1.50 0-14 ZONA 3,77254989,REMY ARTURO SINAY GUDIEL,EVELYN SAMANTHA PÉREZ ROSAL,BASICO,PRIVADO,RURAL,ABIERTA,MONOLINGUE,MATUTINA,DIARIO(REGULAR),ESCUINTLA
05-01-0306-45,05-01-0258,ESCUINTLA,ESCUINTLA,COLEGIO NUEVA ESPERANZA,"17 AV. LOTES 15 Y 16 SECCIÓN D, ZONA 5 COLONIA HUANPÚ",78866580,ALMA LIBERTAD PÉREZ MARTÍNEZ,AIDA JUDITH ESTEVEZ MASELLA,BASICO,PRIVADO,URBANA,ABIERTA,MONOLINGUE,MATUTINA,DIARIO(REGULAR),ESCUINTLA
05-01-0313-45,05-01-0257,ESCUINTLA,ESCUINTLA,"LICEO PREUNIVERSITARIO ""CIENCIA Y TECNOLOGÍA""",6TA. AVE. 2-52 ZONA 1,51230832,LUZ DEL ROSARIO RODRÍGUEZ DE LEÓN,SILVIA YANIRA MELENDEZ AGUILAR,BASICO,PRIVADO,URBANA,ABIERTA,MONOLINGUE,DOBLE,FIN DE SEMANA,ESCUINTLA
05-01-0316-45,05-033,ESCUINTLA,ESCUINTLA,COLEGIO INTERNACIONAL FUTURE LEARNING CENTER FLC,"KM. 60 LA FELICIDAD, SALIDA A PUERTO SAN JOSÉ",42161227,REMY ARTURO SINAY GUDIEL,JESSICA JEANNETTE DAMARIS SAGASTUME HICKS DE TZORIN,BASICO,PRIVADO,URBANA,ABIERTA,MONOLINGUE,DOBLE,FIN DE SEMANA,ESCUINTLA
05-01-0318-45,05-033,ESCUINTLA,ESCUINTLA,"LICEO MIXTO EDUCATIVO DE FORMACIÓN INTEGRAL ""LIMEFI""","3A. AVENIDA ""A"" 1-92 ZONA 1",35368700,REMY ARTURO SINAY GUDIEL,RUTH LORENA AREVALO OSORIO,BASICO,PRIVADO,URBANA,ABIERTA,MONOLINGUE,DOBLE,FIN DE SEMANA,ESCUINTLA
05-01-0319-45,05-033,ESCUINTLA,ESCUINTLA,INSTITUTO PARTICULAR MIXTO DE EDUCACIÓN BÁSICA Y BACHILLERATO POR MADUREZ,4TA. AV.SUR 15-20 ZONA 4,78895255,REMY ARTURO SINAY GUDIEL,SALOMON ALVAREZ ANDRADE,BASICO,PRIVADO,URBANA,ABIERTA,MONOLINGUE,DOBLE,FIN DE SEMANA,ESCUINTLA
05-01-0322-45,05-033,ESCUINTLA,ESCUINTLA,LICEO ESPAÑOL AMERICANO,1RA. AVENIDA 0-06 ZONA 4,78897037,REMY ARTURO SINAY GUDIEL,YARISA RUBY SAMAYOA BARRIOS,BASICO,PRIVADO,URBANA,CERRADA TEMPORALMENTE,MONOLINGUE,DOBLE,FIN DE SEMANA,ESCUINTLA
05-01-0324-45,05-033,ESCUINTLA,ESCUINTLA,"INEB POR MADUREZ ADSCRITO AL INSTITUTO NACIONAL DE BACHILLERATO EN CIENCIAS Y LETRAS POR MADUREZ "" SALOMÓN ALVAREZ ANDRADE""",4TA. AV. 15-20 ZONA 4,58747825,REMY ARTURO SINAY GUDIEL,THELMA COLOMBINA TRUJILLO SUAZO,BASICO,OFICIAL,URBANA,CERRADA TEMPORALMENTE,MONOLINGUE,NOCTURNA,DIARIO(REGULAR),ESCUINTLA
05-01-0326-45,05-033,ESCUINTLA,ESCUINTLA,CENTRO EDUCACIONAL GUATEMALTECO DEL SUR,3A AVENIDA 5-52 ZONA 1,78894544,REMY ARTURO SINAY GUDIEL,NIDIA AMARILIS GALVEZ CHAVEZ,BASICO,PRIVADO,URBANA,ABIERTA,MONOLINGUE,DOBLE,FIN DE SEMANA,ESCUINTLA
05-01-0329-45,05-033,ESCUINTLA,ESCUINTLA,"INSTITUTO DE ESTUDIOS AVANZADOS ""EL SABER "" I.D.E.A.S.","8A. CALLE 5-42, ZONA 1",78893628,REMY ARTURO SINAY GUDIEL,VIVIAN JANETH ESTÉVEZ RÉGIL,BASICO,PRIVADO,URBANA,CERRADA DEFINITIVAMENTE,MONOLINGUE,DOBLE,FIN DE SEMANA,ESCUINTLA
05-01-0331-45,05-033,ESCUINTLA,ESCUINTLA,"INSTITUTO NACIONAL DE EDUCACIÓN BÁSICA Y BACHILLER EN CIENCIAS Y LETRAS POR MADUREZ ""SALOMÓN ALVAREZ ANDRADE""",4A. AV. 15-20 ZONA 4,58747825,REMY ARTURO SINAY GUDIEL,THELMA COLOMBINA TRUJILLO SUAZO,BASICO,OFICIAL,URBANA,CERRADA DEFINITIVAMENTE,MONOLINGUE,DOBLE,FIN DE SEMANA,ESCUINTLA
05-01-0333-45,05-033,ESCUINTLA,ESCUINTLA,COLEGIO TECNOLÓGICO MODERNO,MANZANA 34 LOTE 412 ZONA 03 COLONIA EL MANGO,54547864,REMY ARTURO SINAY GUDIEL,NARDA ALEIDA RODRIGUEZ LEMUS,BASICO,PRIVADO,RURAL,CERRADA DEFINITIVAMENTE,MONOLINGUE,DOBLE,FIN DE SEMANA,ESCUINTLA
05-01-0334-45,05-033,ESCUINTLA,ESCUINTLA,COLEGIO SANTIAGO DE LOS CABALLEROS DE GUATEMALA,2DA AVENIDA 10-98 ZONA 1,78898751,REMY ARTURO SINAY GUDIEL,SILVIA ELENA RUIZ THEISSEN,BASICO,PRIVADO,URBANA,CERRADA TEMPORALMENTE,MONOLINGUE,DOBLE,FIN DE SEMANA,ESCUINTLA
05-01-0335-45,05-033,ESCUINTLA,ESCUINTLA,COLEGIO INTERNACIONAL FUTURE LEARNING CENTER FLC,KM. 60 LA FELICIDAD SALIDA A PUERTO SAN JOSÉ,47691929,REMY ARTURO SINAY GUDIEL,JESSICA JEANNETTE SAGASTUME HICKS,BASICO,PRIVADO,URBANA,CERRADA DEFINITIVAMENTE,MONOLINGUE,DOBLE,FIN DE SEMANA,ESCUINTLA
05-01-0337-45,05-033,ESCUINTLA,ESCUINTLA,"LICEO MIXTO EDUCATIVO DE FORMACIÓN INTEGRAL ""LIMEFI""","3A. AVENIDA ""A"" 1-92 ZONA 1",59226836,REMY ARTURO SINAY GUDIEL,RUTH LORENA AREVALO OSORIO,BASICO,PRIVADO,URBANA,CERRADA TEMPORALMENTE,MONOLINGUE,DOBLE,FIN DE SEMANA,ESCUINTLA
05-01-0341-45,05-01-0252,ESCUINTLA,ESCUINTLA,COLEGIO HISPANO-AMERICANO HACIENDA VERDE,"2DO. CALLEJÓN, Y 2DA CALLE, GRANJA NO. 2 CANTÓN LOS VOLADORES ZONA 3",40133449,MARIA DEL CARMEN SANDOVAL LOPEZ,VICTOR ADOLFO ARANA DE PAZ,BASICO,PRIVADO,RURAL,ABIERTA,MONOLINGUE,MATUTINA,DIARIO(REGULAR),ESCUINTLA
05-01-0345-45,05-033,ESCUINTLA,ESCUINTLA,INSTITUTO PRIVADO CULTURAL INFORMÁTICO Y CIENTÍFICO IPCIC,3A CALLE 2-23 ZONA 2 COLONIA EL FERROCARRILERO,41862567,REMY ARTURO SINAY GUDIEL,EDNA TOMASITA HERINCX RUIZ,BASICO,PRIVADO,URBANA,ABIERTA,MONOLINGUE,MATUTINA,DIARIO(REGULAR),ESCUINTLA
05-01-0346-45,05-01-0255,ESCUINTLA,ESCUINTLA,CENTRO EDUCATIVO GRATIA,"CALLEJÓN PUENTE DE PALO, GRANJA SAN JOSÉ, CANTÓN PUENTE DE PALO",33674187,ANA MERCEDES CABRERA ESTÉVEZ DE PALOMO,MARÍA DEL ROSARIO REYES OLIVA,BASICO,PRIVADO,RURAL,ABIERTA,MONOLINGUE,MATUTINA,DIARIO(REGULAR),ESCUINTLA
05-01-0349-45,05-033,ESCUINTLA,ESCUINTLA,LICEO EVANGÉLICO EL EDÉN,6 AVENIDA 13-86 ZONA 1,41261831,REMY ARTURO SINAY GUDIEL,SANDRA JUDITH COLLADO SOLARES,BASICO,PRIVADO,URBANA,ABIERTA,MONOLINGUE,DOBLE,FIN DE SEMANA,ESCUINTLA
05-01-0358-45,05-01-0254,ESCUINTLA,ESCUINTLA,LICEO FUENTE DE VIDA,LOTE 156 FLORIDO ACEITUNO,36635930,AUGUSTO WALDEMAR DEL CID DEL CID,DIOGENES BAUDILIO FIGUEROA CRUZ,BASICO,PRIVADO,RURAL,ABIERTA,MONOLINGUE,DOBLE,FIN DE SEMANA,ESCUINTLA
05-01-0362-45,05-033,ESCUINTLA,ESCUINTLA,"INSTITUO OFICIAL MIXTO DE EDUCACIÓN BÁSICA Y BACHILLERATO POR MADUREZ ""PALMERAS""",KM. 68.5 CARRETERA A TAXISCO,54953504,REMY ARTURO SINAY GUDIEL,LUDDIN FEDERICO ALVAREZ DUARTE,BASICO,OFICIAL,URBANA,CERRADA DEFINITIVAMENTE,MONOLINGUE,MATUTINA,DIARIO(REGULAR),ESCUINTLA
05-01-0365-45,05-030,ESCUINTLA,ESCUINTLA,COORDINACION DEPARTAMENTAL DE TELESECUNDARIA DE ESCUINTLA,"C.C. PLAZA PALMERAS LOCALES 37 Y 37 ""A""",79625252,CELESTE MARY BELLA SILVA DUARTE,AURA ELISA CRUZ CARRERA DE CHINCHILLA,BASICO,OFICIAL,RURAL,TEMPORAL NOMBRAMIENTO,MONOLINGUE,VESPERTINA,DIARIO(REGULAR),ESCUINTLA
05-01-0366-45,05-033,ESCUINTLA,ESCUINTLA,LICEO CRISTIANO SEBASTOPOL,5TA AVENIDA 5-62 ZONA 3 COLONIA SEBASTOPOL,56478447,REMY ARTURO SINAY GUDIEL,CLAUDIA MARÍA SANTOS CONDE,BASICO,PRIVADO,URBANA,CERRADA TEMPORALMENTE,MONOLINGUE,VESPERTINA,DIARIO(REGULAR),ESCUINTLA
05-01-0367-45,05-01-0255,ESCUINTLA,ESCUINTLA,INSTITUTO COMERCIAL DE CÓMPUTOS AVANZADOS,4A. AVENIDA 15-94 SUR FINAL ZONA 3 ESCUINTLA,78898958,ANA MERCEDES CABRERA ESTÉVEZ DE PALOMO,NILDA JANETHE IBARRA BARRERA,BASICO,PRIVADO,URBANA,ABIERTA,MONOLINGUE,DOBLE,FIN DE SEMANA,ESCUINTLA
05-01-0372-45,05-01-0252,ESCUINTLA,ESCUINTLA,COLEGIO CRISTIANO MONTE MORIAH,2DA. AVENIDA 3-80 ZONA 3 COLONIA AGUAS VIVAS,77254128,MARIA DEL CARMEN SANDOVAL LOPEZ,MELY NOHEMÍ MEJÍA CASTILLO,BASICO,PRIVADO,RURAL,ABIERTA,MONOLINGUE,MATUTINA,DIARIO(REGULAR),ESCUINTLA
05-01-0373-45,05-033,ESCUINTLA,ESCUINTLA,"INSTITUTO MIXTO PARTICULAR DE EDUCACIÓN BÁSICA Y DIVERSIFICADA ""ALMA LIBERTAD PÉREZ MARTÍNEZ""",4TA. AVENIDA 22-04 ZONA 5 COLONIA CAÑAVERAL ESCUELA OFICIAL RURAL MIXTA DE GONZALO ADOLFO SANTIZO,58342002,REMY ARTURO SINAY GUDIEL,SANDRA YANETH DÁVILA MENDOZA,BASICO,PRIVADO,RURAL,CERRADA DEFINITIVAMENTE,MONOLINGUE,DOBLE,FIN DE SEMANA,ESCUINTLA
05-01-0376-45,05-01-0261,ESCUINTLA,ESCUINTLA,INSTITUTO DE EDUCACIÓN BÁSICA POR COOPERATIVA DE ENSEÑANZA,CALLE PRINCIPAL 1-07 ZONA 1 COLONIA EL FERROCARRILERO,78880421,EMILSA NOEMI GARCÍA FUENTES,MANUEL LEOPOLDO SINAY GUDIEL,BASICO,COOPERATIVA,URBANA,ABIERTA,MONOLINGUE,MATUTINA,DIARIO(REGULAR),ESCUINTLA
05-01-0379-45,05-01-0259,ESCUINTLA,ESCUINTLA,LICEO CRISTIANO SEBASTOPOL,5A AVENIDA 5-62 ZONA 3 COLONIA SEBASTOPOL,54550455,EDDY GABRIEL RAMÍREZ CHACÓN,CLAUDIA MARÍA SANTOS CONDE,BASICO,PRIVADO,URBANA,ABIERTA,MONOLINGUE,MATUTINA,DIARIO(REGULAR),ESCUINTLA
05-01-0380-45,05-01-0259,ESCUINTLA,ESCUINTLA,COLEGIO INTEGRAL HISPANOAMERICANO JUNIOR,9A. AVENIDA 6A. CALLE LOTE NO. 9 ZONA 3 LOTIFICACIÓN PREMIER,58559720,EDDY GABRIEL RAMÍREZ CHACÓN,MARITZA COLLADO SOLARES,BASICO,PRIVADO,URBANA,ABIERTA,MONOLINGUE,VESPERTINA,DIARIO(REGULAR),ESCUINTLA
05-01-0383-45,05-033,ESCUINTLA,ESCUINTLA,"CENTRO EDUCATIVO ""JAVIER CAST""",6TA. AVENIDA 0-82 ZONA 4 COLONIA LOS NARANJALES,56304877,REMY ARTURO SINAY GUDIEL,INGRID EMILIA MORALES GONZÁLEZ,BASICO,PRIVADO,URBANA,CERRADA DEFINITIVAMENTE,MONOLINGUE,DOBLE,FIN DE SEMANA,ESCUINTLA
05-01-0393-45,05-033,ESCUINTLA,ESCUINTLA,CENTRO EDUCATIVO APRENDER PARA CRECER,"1A AVENIDA Y 5A CALLE, ZONA 3 COLONIA ROSALINDA INSTALACIONES QUE OCUPA LA EORM JM COLONIA ROSALINDA.",49373081,REMY ARTURO SINAY GUDIEL,MILDRED AZUCENA PACHECO,BASICO,PRIVADO,RURAL,CERRADA TEMPORALMENTE,MONOLINGUE,DOBLE,FIN DE SEMANA,ESCUINTLA
05-01-0394-45,05-01-0252,ESCUINTLA,ESCUINTLA,LICEO MIXTO JERUSALÉN,"3A AVENIDA 7-08 ZONA 3, COLONIA GOLONDRINAS",55828919,MARIA DEL CARMEN SANDOVAL LOPEZ,GABRIELA ELENA LÓPEZ SILVEIRA DE AVILA,BASICO,PRIVADO,URBANA,ABIERTA,MONOLINGUE,VESPERTINA,DIARIO(REGULAR),ESCUINTLA
05-01-0396-45,05-033,ESCUINTLA,ESCUINTLA,COLEGIO HISPANO-AMERICANO HACIENDA VERDE,2O CALLEJÓN Y 2A CALLE GRANJA NO. 2 CANTÓN LOS VOLADORES ZONA 3,40133449,REMY ARTURO SINAY GUDIEL,SILVIA LORENA CONCOGUÁ MARROQUÍN,BASICO,PRIVADO,RURAL,CERRADA TEMPORALMENTE,MONOLINGUE,DOBLE,FIN DE SEMANA,ESCUINTLA
05-01-0398-45,05-033,ESCUINTLA,ESCUINTLA,COLEGIO BILINGÜE JARDÍN AMERICANO,"3A CALLE SECTOR B LOTE 21, COLONIA JACARANDAS 1, ZONA 3",37826662,REMY ARTURO SINAY GUDIEL,CLAUDIA ARGENTINA JIMÉNEZ PRADO,BASICO,PRIVADO,URBANA,ABIERTA,MONOLINGUE,DOBLE,FIN DE SEMANA,ESCUINTLA
05-01-0404-45,05-01-0254,ESCUINTLA,ESCUINTLA,LICEO FUENTE DE VIDA,LOTE 156 FLORIDO ACEITUNO,36635930,AUGUSTO WALDEMAR DEL CID DEL CID,DIOGENES BAUDILIO FIGUEROA CRUZ,BASICO,PRIVADO,RURAL,ABIERTA,MONOLINGUE,MATUTINA,DIARIO(REGULAR),ESCUINTLA
