0,1,2,3,4,5,6,7,8,9,10,11,12,13,14,15,16
CODIGO,DISTRITO,DEPARTAMENTO,MUNICIPIO,ESTABLECIMIENTO,DIRECCION,TELEFONO,SUPERVISOR,DIRECTOR,NIVEL,SECTOR,AREA,STATUS,MODALIDAD,JORNADA,PLAN,DEPARTAMENTAL
22-01-0012-43,22-01-1221,JUTIAPA,JUTIAPA,EOUV TIPO FEDERACION SALOMON CARRILLO RAMIREZ,BARRIO LA FEDERAL,30043013,SHAROL VANESA PÉREZ VEGA DE SOTO,RODOLFO EDUARDO ALAY,PRIMARIA,OFICIAL,URBANA,ABIERTA,BILINGUE,VESPERTINA,DIARIO(REGULAR),JUTIAPA
22-01-0023-43,22-01-1224,JUTIAPA,JUTIAPA,EOUV LORENZO MONTUFAR,"5A. CALLE 4-61, ZONA 1",56978714,ENMA ONDINA RIOS GONZALEZ DE CONTRERAS,ADELINA PAIZ ALAY,PRIMARIA,OFICIAL,URBANA,ABIERTA,MONOLINGUE,VESPERTINA,DIARIO(REGULAR),JUTIAPA
22-01-0024-43,22-01-1224,JUTIAPA,JUTIAPA,'LICEO JUTIAPA',4A. CALLE 1-53 ZONA 1,78441008,ENMA ONDINA RIOS GONZALEZ DE CONTRERAS,YURI GILDARDO HERNÁNDEZ ESTRADA,PRIMARIA,PRIVADO,URBANA,ABIERTA,MONOLINGUE,MATUTINA,DIARIO(REGULAR),JUTIAPA
22-01-0025-43,22-01-1221,JUTIAPA,JUTIAPA,EOUM,BARRIO EL CONDOR,78443473,SHAROL VANESA PÉREZ VEGA DE SOTO,SANDRA DINORA POLANCO SALGUERO,PRIMARIA,OFICIAL,URBANA,ABIERTA,MONOLINGUE,MATUTINA,DIARIO(REGULAR),JUTIAPA
22-01-0026-43,22-01-1221,JUTIAPA,JUTIAPA,EOUM TIPO FEDERACION SALOMON CARRILLO RAMIREZ,BARRIO LA FEDERAL,49131877,SHAROL VANESA PÉREZ VEGA DE SOTO,YENI OLANDA ORDOÑEZ GUDIEL,PRIMARIA,OFICIAL,URBANA,ABIERTA,MONOLINGUE,MATUTINA,DIARIO(REGULAR),JUTIAPA
22-01-0027-43,22-01-1224,JUTIAPA,JUTIAPA,EOUN LORENZO MONTUFAR,"5A. CALLE 4-61, ZONA 1",78441846,ENMA ONDINA RIOS GONZALEZ DE CONTRERAS,JULIO ANTONIO SALGUERO SANDOVAL,PRIMARIA,OFICIAL,URBANA,ABIERTA,MONOLINGUE,MATUTINA,DIARIO(REGULAR),JUTIAPA
22-01-0028-43,22-001,JUTIAPA,JUTIAPA,COLEGIO 'TECNICO PROFESIONAL SAN CRISTOBAL',7A. CALLE 5-30 ZONA 1 BARRIO LATINO,78591186,CECILIA ISABEL ALDECOA CASASOLA DE CASTRO,,PRIMARIA,PRIVADO,URBANA,CERRADA TEMPORALMENTE,MONOLINGUE,MATUTINA,DIARIO(REGULAR),JUTIAPA
22-01-0029-43,22-01-1221,JUTIAPA,JUTIAPA,COLEGIO EVANGELICO VIDA NUEVA,"ENTRADA AL COMPLEJO EDUCATIVO 0-16, ZONA 3",78441907,SHAROL VANESA PÉREZ VEGA DE SOTO,OLIMPIA BEATRIZ SALGUERO TREJO,PRIMARIA,PRIVADO,URBANA,ABIERTA,MONOLINGUE,MATUTINA,DIARIO(REGULAR),JUTIAPA
22-01-0030-43,22-01-1221,JUTIAPA,JUTIAPA,COLEGIO PARTICULAR MIXTO SAN MIGUEL,2A. CALLE 5-98 ZONA 3,77270508,SHAROL VANESA PÉREZ VEGA DE SOTO,LINDA MARILYN ZECEÑA GARCÍA,PRIMARIA,PRIVADO,URBANA,ABIERTA,MONOLINGUE,MATUTINA,DIARIO(REGULAR),JUTIAPA
22-01-0033-43,22-01-1220,JUTIAPA,JUTIAPA,EORM,ALDEA LOS APANTES,55335778,RONY ESTUARDO SANDOVAL MEDINA,KAREN ELENA RAMOS RAMÍREZ,PRIMARIA,OFICIAL,RURAL,ABIERTA,MONOLINGUE,MATUTINA,DIARIO(REGULAR),JUTIAPA
22-01-0034-43,22-01-1226,JUTIAPA,JUTIAPA,EORM,"CASERIO MAL PASO, CANTON SAN MARCOS",,REMBERTO RECINOS SARCEÑO,EDRAS JACOB HERNÁNDEZ SALGUERO,PRIMARIA,OFICIAL,RURAL,ABIERTA,MONOLINGUE,MATUTINA,DIARIO(REGULAR),JUTIAPA
22-01-0035-43,22-01-1219,JUTIAPA,JUTIAPA,EORM,"CASERIO ANIMAS, ALDEA SAN ANTONIO",58624138,MARCO TULIO CASTILLO MELGAR,MAEGLYN MERARY MONZÓN LÓPEZ,PRIMARIA,OFICIAL,RURAL,ABIERTA,MONOLINGUE,MATUTINA,DIARIO(REGULAR),JUTIAPA
22-01-0036-43,22-01-1218,JUTIAPA,JUTIAPA,EORM,ALDEA JICARO GRANDE,54672131,EMMANUEL MONZÓN HERRERA,JUAN MANUEL CÁMBARA Y CÁMBARA,PRIMARIA,OFICIAL,RURAL,ABIERTA,BILINGUE,MATUTINA,DIARIO(REGULAR),JUTIAPA
22-01-0037-43,22-006,JUTIAPA,JUTIAPA,EORM,"CASERIO SAN FRANCISCO, CANTON LA MAJADA",,RONY ESTUARDO SANDOVAL MEDINA,,PRIMARIA,OFICIAL,RURAL,CERRADA TEMPORALMENTE,MONOLINGUE,MATUTINA,DIARIO(REGULAR),JUTIAPA
22-01-0038-43,22-01-1226,JUTIAPA,JUTIAPA,EORM,ALDEA ESTORAQUE CANTON SAN MARCOS,48525538,REMBERTO RECINOS SARCEÑO,ANTONIA ISABEL HURTADO CORADO,PRIMARIA,OFICIAL,RURAL,ABIERTA,MONOLINGUE,MATUTINA,DIARIO(REGULAR),JUTIAPA
22-01-0039-43,22-01-1223,JUTIAPA,JUTIAPA,EORM,"CASERIO LOS COMUNES, CANTON EL PEÑON",31712433,EDGAR ARNULFO GONZÁLEZ GUDIEL,ARACELY ADALY BARRERA OCHOA,PRIMARIA,OFICIAL,RURAL,ABIERTA,MONOLINGUE,MATUTINA,DIARIO(REGULAR),JUTIAPA
22-01-0040-43,22-01-1225,JUTIAPA,JUTIAPA,EORM,"ALDEA EL TABLON, CANTON SAN ANTONIO",50086404,CECILIA ISABEL ALDECOA CASASOLA,SHARON ROSINES MOREIRA MELLADO,PRIMARIA,OFICIAL,RURAL,ABIERTA,MONOLINGUE,MATUTINA,DIARIO(REGULAR),JUTIAPA
22-01-0041-43,22-01-1219,JUTIAPA,JUTIAPA,EORM SARA DE LA HOZ DE MENDEZ MONTENEGRO,ALDEA CERRO GORDO,,MARCO TULIO CASTILLO MELGAR,GLORIA YANIRA VALLADARES BARRERA,PRIMARIA,OFICIAL,RURAL,ABIERTA,MONOLINGUE,MATUTINA,DIARIO(REGULAR),JUTIAPA
22-01-0042-43,22-01-1220,JUTIAPA,JUTIAPA,EORM,"CASERIO LA VEGA, CANTON SAN PABLO",58227269,RONY ESTUARDO SANDOVAL MEDINA,JORGE JUAN CASTILLO SARAVIA,PRIMARIA,OFICIAL,RURAL,ABIERTA,MONOLINGUE,MATUTINA,DIARIO(REGULAR),JUTIAPA
22-01-0043-43,22-01-1219,JUTIAPA,JUTIAPA,EORM,ALDEA EL CHILTEPE,42985740,MARCO TULIO CASTILLO MELGAR,MIRNA NOEMI QUIÑONEZ NAJARRO,PRIMARIA,OFICIAL,RURAL,ABIERTA,MONOLINGUE,MATUTINA,DIARIO(REGULAR),JUTIAPA
22-01-0044-43,22-01-1225,JUTIAPA,JUTIAPA,EORM,ALDEA LAS TUNAS,31296927,CECILIA ISABEL ALDECOA CASASOLA,LUIS ESTUARDO PÉREZ MENÉNDEZ,PRIMARIA,OFICIAL,RURAL,ABIERTA,MONOLINGUE,MATUTINA,DIARIO(REGULAR),JUTIAPA
22-01-0045-43,22-01-1225,JUTIAPA,JUTIAPA,EORM,CANTON SAN ANTONIO,46566072,CECILIA ISABEL ALDECOA CASASOLA,EDGAR VILLAGRÁN RUANO,PRIMARIA,OFICIAL,RURAL,ABIERTA,BILINGUE,MATUTINA,DIARIO(REGULAR),JUTIAPA
22-01-0046-43,22-01-1218,JUTIAPA,JUTIAPA,EORM,ALDEA TRANCAS II,47686290,EMMANUEL MONZÓN HERRERA,AMANDA LAUREANA RUANO VIRULA,PRIMARIA,OFICIAL,RURAL,ABIERTA,MONOLINGUE,MATUTINA,DIARIO(REGULAR),JUTIAPA
22-01-0047-43,22-01-1219,JUTIAPA,JUTIAPA,EORM,ALDEA TRANCAS I,55728650,MARCO TULIO CASTILLO MELGAR,DORIS ELIZABETH MARTÍNEZ RAMIREZ,PRIMARIA,OFICIAL,RURAL,ABIERTA,BILINGUE,MATUTINA,DIARIO(REGULAR),JUTIAPA
22-01-0048-43,22-01-1220,JUTIAPA,JUTIAPA,EORM,ALDEA CANOAS,30828425,RONY ESTUARDO SANDOVAL MEDINA,MARLEN JUDITH PÉREZ GUDIEL,PRIMARIA,OFICIAL,RURAL,ABIERTA,MONOLINGUE,MATUTINA,DIARIO(REGULAR),JUTIAPA
22-01-0049-43,22-01-1219,JUTIAPA,JUTIAPA,EORM,CANTON NUEVA ESPERANZA,,MARCO TULIO CASTILLO MELGAR,WENDY MARLENY SALGUERO ORELLANA,PRIMARIA,OFICIAL,RURAL,ABIERTA,BILINGUE,MATUTINA,DIARIO(REGULAR),JUTIAPA
22-01-0050-43,22-01-1220,JUTIAPA,JUTIAPA,EORM,ALDEA SAN PABLO,58766871,RONY ESTUARDO SANDOVAL MEDINA,HENRY ESTUARDO MÉNDEZ OLIVARES,PRIMARIA,OFICIAL,RURAL,ABIERTA,MONOLINGUE,MATUTINA,DIARIO(REGULAR),JUTIAPA
22-01-0051-43,22-01-1227,JUTIAPA,JUTIAPA,EORM,ALDEA EL BARREAL,30492740,CARLOS HUMBERTO CRUZ ALAY,ANGELA YORLENY JUAN MARTÍNEZ,PRIMARIA,OFICIAL,RURAL,ABIERTA,BILINGUE,MATUTINA,DIARIO(REGULAR),JUTIAPA
22-01-0052-43,22-01-1227,JUTIAPA,JUTIAPA,EORM,ALDEA LOMITAS,,CARLOS HUMBERTO CRUZ ALAY,LESBIA LUCRECIA MONTEROS SANDOVAL,PRIMARIA,OFICIAL,RURAL,ABIERTA,MONOLINGUE,MATUTINA,DIARIO(REGULAR),JUTIAPA
22-01-0053-43,22-01-1225,JUTIAPA,JUTIAPA,EORM,"CASERIO LA CUESTA, CANTON TUNAS",56304055,CECILIA ISABEL ALDECOA CASASOLA,NOE ERUBEY MÉNDEZ NAVARRO,PRIMARIA,OFICIAL,RURAL,ABIERTA,MONOLINGUE,MATUTINA,DIARIO(REGULAR),JUTIAPA
22-01-0054-43,22-01-1227,JUTIAPA,JUTIAPA,EORM,CANTON POTRERO GRANDE,,CARLOS HUMBERTO CRUZ ALAY,LUISA MAHELI HERNANDEZ ORTEGA,PRIMARIA,OFICIAL,RURAL,ABIERTA,MONOLINGUE,MATUTINA,DIARIO(REGULAR),JUTIAPA
22-01-0055-43,22-01-1219,JUTIAPA,JUTIAPA,EORM,"CASERIO EL COHETERO, CANTON SAN JOSE BUENA VISTA",42188268,MARCO TULIO CASTILLO MELGAR,FABIOLA ARLETH CRUZ AGUILAR,PRIMARIA,OFICIAL,RURAL,ABIERTA,MONOLINGUE,MATUTINA,DIARIO(REGULAR),JUTIAPA
22-01-0056-43,22-01-1219,JUTIAPA,JUTIAPA,EORM,CANTON AMAYITO,30928628,MARCO TULIO CASTILLO MELGAR,GLENDA ELIZABETH GUDIEL PÉREZ,PRIMARIA,OFICIAL,RURAL,ABIERTA,MONOLINGUE,MATUTINA,DIARIO(REGULAR),JUTIAPA
22-01-0057-43,22-01-1225,JUTIAPA,JUTIAPA,EORM,ALDEA RIO DE LA VIRGEN,42902422,CECILIA ISABEL ALDECOA CASASOLA,ALDINA ESPERANZA ESTRADA GARCÍA,PRIMARIA,OFICIAL,RURAL,ABIERTA,BILINGUE,MATUTINA,DIARIO(REGULAR),JUTIAPA
22-01-0058-43,22-01-1226,JUTIAPA,JUTIAPA,EORM,"CASERIO EL CALVARIO, CANTON AMAYITO",59987823,REMBERTO RECINOS SARCEÑO,VICTOR MANUEL MÉNDEZ MATEO,PRIMARIA,OFICIAL,RURAL,ABIERTA,MONOLINGUE,MATUTINA,DIARIO(REGULAR),JUTIAPA
22-01-0059-43,22-01-1227,JUTIAPA,JUTIAPA,EORM,CANTON ANIMAS LOMAS,55588651,CARLOS HUMBERTO CRUZ ALAY,SANDRA CARMINA ASENCIO VALENZUELA,PRIMARIA,OFICIAL,RURAL,ABIERTA,MONOLINGUE,MATUTINA,DIARIO(REGULAR),JUTIAPA
22-01-0060-43,22-01-1226,JUTIAPA,JUTIAPA,EORM,"CASERIO VALLE LINDO, CANTON TUNAS",40076427,REMBERTO RECINOS SARCEÑO,RONY MATEO HERNÁNDEZ,PRIMARIA,OFICIAL,RURAL,ABIERTA,MONOLINGUE,MATUTINA,DIARIO(REGULAR),JUTIAPA
22-01-0061-43,22-01-1220,JUTIAPA,JUTIAPA,EORM,CASERIO IMPRESIONES CANTON CANOAS,58717123,RONY ESTUARDO SANDOVAL MEDINA,LILIAN AMARILIS GONZÁLEZ CHÁVEZ,PRIMARIA,OFICIAL,RURAL,ABIERTA,MONOLINGUE,MATUTINA,DIARIO(REGULAR),JUTIAPA
22-01-0062-43,22-01-1218,JUTIAPA,JUTIAPA,EORM,"CASERIO LAS PILAS , CANTON SAN JOSÉ BUENA VISTA",57489739,EMMANUEL MONZÓN HERRERA,LUCRECIA IRINA GIL PELLECER,PRIMARIA,OFICIAL,RURAL,ABIERTA,MONOLINGUE,MATUTINA,DIARIO(REGULAR),JUTIAPA
22-01-0063-43,22-01-1220,JUTIAPA,JUTIAPA,EORM,ALDEA LAS POZAS,50511729,RONY ESTUARDO SANDOVAL MEDINA,MILDRED NOELIA GONZÁLEZ CHÁVEZ,PRIMARIA,OFICIAL,RURAL,ABIERTA,MONOLINGUE,MATUTINA,DIARIO(REGULAR),JUTIAPA
22-01-0064-43,22-01-1218,JUTIAPA,JUTIAPA,EORM,"CASERIO LA ARADITA, CANTON POTRERO GRANDE",45622151,EMMANUEL MONZÓN HERRERA,KIMBERLY ZUCELY MUÑOZ TOBAR,PRIMARIA,OFICIAL,RURAL,ABIERTA,MONOLINGUE,MATUTINA,DIARIO(REGULAR),JUTIAPA
22-01-0065-43,22-01-1227,JUTIAPA,JUTIAPA,EORM,"CASERÍO EL CUJE, CANTÓN PIPILTEPEQUE",51715296,CARLOS HUMBERTO CRUZ ALAY,SUSANA VICTORIA MARTÍNEZ ZELADA,PRIMARIA,OFICIAL,RURAL,ABIERTA,MONOLINGUE,MATUTINA,DIARIO(REGULAR),JUTIAPA
22-01-0066-43,22-01-1227,JUTIAPA,JUTIAPA,EORM,ALDEA QUEBRADA SECA,58882662,CARLOS HUMBERTO CRUZ ALAY,FLOR DE MARÍA GARCÍA PÉREZ,PRIMARIA,OFICIAL,RURAL,ABIERTA,MONOLINGUE,MATUTINA,DIARIO(REGULAR),JUTIAPA
22-01-0067-43,22-01-1220,JUTIAPA,JUTIAPA,EORM,"ALDEA GUACAMAYAS, CANTON CANOAS",31310118,RONY ESTUARDO SANDOVAL MEDINA,KELIN MAYARÍ PADILLA GIRÓN,PRIMARIA,OFICIAL,RURAL,ABIERTA,MONOLINGUE,MATUTINA,DIARIO(REGULAR),JUTIAPA
22-01-0068-43,22-01-1223,JUTIAPA,JUTIAPA,EORM,CANTON EL PEÑON CASERIO LA PEÑA,30797622,EDGAR ARNULFO GONZÁLEZ GUDIEL,ALBA CLAUDIA VILLAGRÁN VÁSQUEZ,PRIMARIA,OFICIAL,RURAL,ABIERTA,MONOLINGUE,MATUTINA,DIARIO(REGULAR),JUTIAPA
22-01-0069-43,22-01-1223,JUTIAPA,JUTIAPA,EORM DR. JOSE MIGUEL MEDRANO SAGASTUME,CANTON AMAYO SITIO,,EDGAR ARNULFO GONZÁLEZ GUDIEL,MARISELA ELIZABETH ALVEÑO RAMÍREZ,PRIMARIA,OFICIAL,RURAL,ABIERTA,MONOLINGUE,MATUTINA,DIARIO(REGULAR),JUTIAPA
22-01-0070-43,22-01-1227,JUTIAPA,JUTIAPA,EORM,"CASERIO EL COYOL, CANTON POTRERO GRANDE",51187099,CARLOS HUMBERTO CRUZ ALAY,JUAN MANUEL CARRERA CONTRERAS,PRIMARIA,OFICIAL,RURAL,ABIERTA,BILINGUE,MATUTINA,DIARIO(REGULAR),JUTIAPA
22-01-0071-43,22-01-1218,JUTIAPA,JUTIAPA,EORM,"CASERIO SANTA ROSITA, CANTON LAGUNILLA",42142813,EMMANUEL MONZÓN HERRERA,ROLANDO ORELLANA SANDOVAL,PRIMARIA,OFICIAL,RURAL,ABIERTA,MONOLINGUE,MATUTINA,DIARIO(REGULAR),JUTIAPA
22-01-0072-43,22-01-1226,JUTIAPA,JUTIAPA,EORM,"CASERIO LA GARITA, CANTON SAN MARCOS",40095726,REMBERTO RECINOS SARCEÑO,IRIS YANETH MEDRANO MEDRANO,PRIMARIA,OFICIAL,RURAL,ABIERTA,MONOLINGUE,MATUTINA,DIARIO(REGULAR),JUTIAPA
22-01-0073-43,22-01-1219,JUTIAPA,JUTIAPA,EORM,CANTON SAN JOSE BUENA VISTA,47174382,MARCO TULIO CASTILLO MELGAR,ELVIA MARINA GUDIEL CALDERAS,PRIMARIA,OFICIAL,RURAL,ABIERTA,MONOLINGUE,MATUTINA,DIARIO(REGULAR),JUTIAPA
22-01-0074-43,22-01-1226,JUTIAPA,JUTIAPA,EORM,"CASERIO RIO DE PAZ, CANTON SAN MARCOS",32670122,REMBERTO RECINOS SARCEÑO,LESTER MAURICIO LIMA LEONARDO,PRIMARIA,OFICIAL,RURAL,ABIERTA,MONOLINGUE,MATUTINA,DIARIO(REGULAR),JUTIAPA
22-01-0075-43,22-01-1220,JUTIAPA,JUTIAPA,EORM,"CANTON ENCINO GACHO, ALDEA SALTO DEL ARENAL",57058232,RONY ESTUARDO SANDOVAL MEDINA,WALTER ELÍ RAYMUNDO SALAZAR,PRIMARIA,OFICIAL,RURAL,ABIERTA,MONOLINGUE,MATUTINA,DIARIO(REGULAR),JUTIAPA
22-01-0076-43,22-01-1226,JUTIAPA,JUTIAPA,EORM,"CASERIO LAS ARRAYANAS, CANTON TUNAS",56357613,REMBERTO RECINOS SARCEÑO,JESSICA YAZMÍN CRUZ SALGUERO,PRIMARIA,OFICIAL,RURAL,ABIERTA,MONOLINGUE,MATUTINA,DIARIO(REGULAR),JUTIAPA
22-01-0077-43,22-01-1219,JUTIAPA,JUTIAPA,EORM,"CASERIO EL CUJE, SAN JOSE BUENA VISTA",45979276,MARCO TULIO CASTILLO MELGAR,JANNETH XIOMARA ORDOÑEZ CRUZ,PRIMARIA,OFICIAL,RURAL,ABIERTA,MONOLINGUE,MATUTINA,DIARIO(REGULAR),JUTIAPA
22-01-0078-43,22-01-1227,JUTIAPA,JUTIAPA,EORM,ALDEA LA FLOR CANTON AMAYITO,57066464,CARLOS HUMBERTO CRUZ ALAY,ZAYDA MARILÍ GARCÍA PÉREZ,PRIMARIA,OFICIAL,RURAL,ABIERTA,MONOLINGUE,MATUTINA,DIARIO(REGULAR),JUTIAPA
22-01-0079-43,22-01-1223,JUTIAPA,JUTIAPA,EORM,CASERIO LLANO LARGO CANTON VALENCIA,56252872,EDGAR ARNULFO GONZÁLEZ GUDIEL,IZABEL CRISTINA ARANA COLINDRES,PRIMARIA,OFICIAL,RURAL,ABIERTA,MONOLINGUE,MATUTINA,DIARIO(REGULAR),JUTIAPA
22-01-0080-43,22-01-1220,JUTIAPA,JUTIAPA,EORM,"CANTÓN ENCINO GACHO, ALDEA HUERTAS",34731915,RONY ESTUARDO SANDOVAL MEDINA,AMANDA ESTEFANIA LÓPEZ SALGUERO,PRIMARIA,OFICIAL,RURAL,ABIERTA,MONOLINGUE,MATUTINA,DIARIO(REGULAR),JUTIAPA
22-01-0081-43,22-01-1220,JUTIAPA,JUTIAPA,EORM,CANTON ENCINO GACHO,59799359,RONY ESTUARDO SANDOVAL MEDINA,SINDY MARÍA SALGUERO UCELO,PRIMARIA,OFICIAL,RURAL,ABIERTA,MONOLINGUE,MATUTINA,DIARIO(REGULAR),JUTIAPA
22-01-0082-43,22-01-1218,JUTIAPA,JUTIAPA,EORM,ALDEA IXTACAPA,42882173,EMMANUEL MONZÓN HERRERA,ANA MARÍA GODOY,PRIMARIA,OFICIAL,RURAL,ABIERTA,MONOLINGUE,MATUTINA,DIARIO(REGULAR),JUTIAPA
22-01-0083-43,22-01-1218,JUTIAPA,JUTIAPA,EORM MEPU VICTOR MANUEL MURGA GONZALEZ,CANTON LAGUNILLA,58792756,EMMANUEL MONZÓN HERRERA,MIRZA ALEJANDRA PEÑATE CARRILLO,PRIMARIA,OFICIAL,RURAL,ABIERTA,MONOLINGUE,MATUTINA,DIARIO(REGULAR),JUTIAPA
22-01-0084-43,22-01-1228,JUTIAPA,JUTIAPA,EORM,CASERIO EL DURAZNO CANTON VALENCIA,46038052,JULIO CÉSAR RIZO GARCÍA,JESSICA MARÍA HERNÁNDEZ,PRIMARIA,OFICIAL,RURAL,ABIERTA,MONOLINGUE,MATUTINA,DIARIO(REGULAR),JUTIAPA
22-01-0085-43,22-005,JUTIAPA,JUTIAPA,EORM,ALDEA VALENCIA,,EDGAR ARNULFO GONZALEZ GUDIEL,,PRIMARIA,OFICIAL,RURAL,CERRADA DEFINITIVAMENTE,MONOLINGUE,MATUTINA,DIARIO(REGULAR),JUTIAPA
22-01-0086-43,22-01-1218,JUTIAPA,JUTIAPA,EORM,ALDEA PIPILTEPEQUE,38146446,EMMANUEL MONZÓN HERRERA,OSCAR IVÁN LÉMUS MORALES,PRIMARIA,OFICIAL,RURAL,ABIERTA,MONOLINGUE,MATUTINA,DIARIO(REGULAR),JUTIAPA
22-01-0087-43,22-01-1226,JUTIAPA,JUTIAPA,EORM,"CASERIO MATILISGUATE, CANTON SAN MARCOS",54649442,REMBERTO RECINOS SARCEÑO,ROSAURA GABRIELA GUDIEL RUÍZ,PRIMARIA,OFICIAL,RURAL,ABIERTA,MONOLINGUE,MATUTINA,DIARIO(REGULAR),JUTIAPA
22-01-0088-43,22-01-1223,JUTIAPA,JUTIAPA,EORM,ALDEA AMAYO INGENIO,53535103,EDGAR ARNULFO GONZÁLEZ GUDIEL,ZOILA DEL ROSARIO GARCÍA HERNÁNDEZ,PRIMARIA,OFICIAL,RURAL,ABIERTA,BILINGUE,MATUTINA,DIARIO(REGULAR),JUTIAPA
22-01-0089-43,22-01-1223,JUTIAPA,JUTIAPA,EORM,CANTON AMAYO SITIO ALDEA EL AGUACATE,45128461,EDGAR ARNULFO GONZÁLEZ GUDIEL,JOSÉ SAMUEL GONZÁLEZ GUZMÁN,PRIMARIA,OFICIAL,RURAL,ABIERTA,MONOLINGUE,MATUTINA,DIARIO(REGULAR),JUTIAPA
22-01-0090-43,22-01-1226,JUTIAPA,JUTIAPA,EORM,CANTON SAN MARCOS,53390143,REMBERTO RECINOS SARCEÑO,INGRID ARACELY GARCIA YANES,PRIMARIA,OFICIAL,RURAL,ABIERTA,MONOLINGUE,MATUTINA,DIARIO(REGULAR),JUTIAPA
22-01-0091-43,22-01-1227,JUTIAPA,JUTIAPA,EORM,"CASERIO CERRO GRANDE, ALDEA NUEVA ESPERANZA",30283591,CARLOS HUMBERTO CRUZ ALAY,ROBERTO MARROQUÍN,PRIMARIA,OFICIAL,RURAL,ABIERTA,MONOLINGUE,MATUTINA,DIARIO(REGULAR),JUTIAPA
22-01-0092-43,22-01-1228,JUTIAPA,JUTIAPA,EORM,CANTON MARIAS MONTAÑAS,37556299,JULIO CÉSAR RIZO GARCÍA,SANDRA FAVIOLA MARTÍNEZ,PRIMARIA,OFICIAL,RURAL,ABIERTA,BILINGUE,MATUTINA,DIARIO(REGULAR),JUTIAPA
22-01-0093-43,22-01-1226,JUTIAPA,JUTIAPA,EORM,"CASERIO TRAPICHITOS, CANTON AMAYITO",40840479,REMBERTO RECINOS SARCEÑO,WENDY YANIRA PÉREZ ORELLANA,PRIMARIA,OFICIAL,RURAL,ABIERTA,MONOLINGUE,MATUTINA,DIARIO(REGULAR),JUTIAPA
22-01-0094-43,22-01-1223,JUTIAPA,JUTIAPA,EORM,CASERIO EL CIPRES CANTON VALENCIA,51612870,EDGAR ARNULFO GONZÁLEZ GUDIEL,MARVIN DANILO NAVARRO CORADO,PRIMARIA,OFICIAL,RURAL,ABIERTA,MONOLINGUE,MATUTINA,DIARIO(REGULAR),JUTIAPA
22-01-0095-43,22-01-1218,JUTIAPA,JUTIAPA,EORM,CASERIO PLAN DEL JOCOTE CANTON LAGUNILLA,30505010,EMMANUEL MONZÓN HERRERA,DIANA MISHELLE MARTÍNEZ GRIJALVA,PRIMARIA,OFICIAL,RURAL,ABIERTA,MONOLINGUE,MATUTINA,DIARIO(REGULAR),JUTIAPA
22-01-0096-43,22-01-1226,JUTIAPA,JUTIAPA,EORM,"CASERIO JICARO, CANTON LOMITAS",45286142,REMBERTO RECINOS SARCEÑO,RISSBIN ALKANDRO BRITO,PRIMARIA,OFICIAL,RURAL,ABIERTA,MONOLINGUE,MATUTINA,DIARIO(REGULAR),JUTIAPA
22-01-0097-43,22-01-1228,JUTIAPA,JUTIAPA,EORM,"CASERIO EL CARRIZAL, ALDEA MARIAS MONTAÑAS",45028615,JULIO CÉSAR RIZO GARCÍA,ILIANA CAMELIA CRUZ LÓPEZ,PRIMARIA,OFICIAL,RURAL,ABIERTA,MONOLINGUE,MATUTINA,DIARIO(REGULAR),JUTIAPA
22-01-0098-43,22-01-1219,JUTIAPA,JUTIAPA,EORM JM,CANTÓN PIPILTEPEQUE ABAJO,40011208,MARCO TULIO CASTILLO MELGAR,CARMEN MARITZA MURGA MAS,PRIMARIA,OFICIAL,RURAL,ABIERTA,MONOLINGUE,MATUTINA,DIARIO(REGULAR),JUTIAPA
22-01-0099-43,22-01-1220,JUTIAPA,JUTIAPA,EORM,ALDEA EL PINAL,53292839,RONY ESTUARDO SANDOVAL MEDINA,ESCARLEN DANIELA CAMBARA DÍAZ,PRIMARIA,OFICIAL,RURAL,ABIERTA,BILINGUE,MATUTINA,DIARIO(REGULAR),JUTIAPA
22-01-0100-43,22-01-1218,JUTIAPA,JUTIAPA,EORM,"CASERIO EL NARANJO, CANTON LAGUNILLA",57235648,EMMANUEL MONZÓN HERRERA,VICTORIA CORADO REVOLORIO,PRIMARIA,OFICIAL,RURAL,ABIERTA,MONOLINGUE,MATUTINA,DIARIO(REGULAR),JUTIAPA
22-01-0101-43,22-01-1223,JUTIAPA,JUTIAPA,EORM,CASERIO SITIO VIEJO CANTON AMAYO INGENIO,47607805,EDGAR ARNULFO GONZÁLEZ GUDIEL,JENIFER MELISSA PEÑATE VIRULA,PRIMARIA,OFICIAL,RURAL,ABIERTA,MONOLINGUE,MATUTINA,DIARIO(REGULAR),JUTIAPA
22-01-0102-43,22-01-1227,JUTIAPA,JUTIAPA,EORM,"CASERIO VELASQUEZ, CANTON ANIMAS LOMAS",42086555,CARLOS HUMBERTO CRUZ ALAY,BRENDA LIZETH LIMA QUIÑONEZ,PRIMARIA,OFICIAL,RURAL,ABIERTA,MONOLINGUE,MATUTINA,DIARIO(REGULAR),JUTIAPA
22-01-0103-43,22-01-1226,JUTIAPA,JUTIAPA,EORM RAFAEL AREVALO MARTINEZ,"CASERIO SANTA CLARA, CANTON SAN MARCOS",55382451,REMBERTO RECINOS SARCEÑO,KEILA ARACELY PAZ PALMA,PRIMARIA,OFICIAL,RURAL,ABIERTA,MONOLINGUE,MATUTINA,DIARIO(REGULAR),JUTIAPA
22-01-0104-43,22-01-1223,JUTIAPA,JUTIAPA,EORM,ALDEA CIENEGUILLA CANTON VALENCIA,46929780,EDGAR ARNULFO GONZÁLEZ GUDIEL,FERNÁNDO ESTÉBAN DE JESÚS MONZÓN CASTILLO,PRIMARIA,OFICIAL,RURAL,ABIERTA,MONOLINGUE,MATUTINA,DIARIO(REGULAR),JUTIAPA
22-01-0105-43,22-01-1225,JUTIAPA,JUTIAPA,EORM,ALDEA CERRO COLORADO,56252792,CECILIA ISABEL ALDECOA CASASOLA,OLGA MARINA GONZÁLEZ SARCEÑO,PRIMARIA,OFICIAL,RURAL,ABIERTA,MONOLINGUE,MATUTINA,DIARIO(REGULAR),JUTIAPA
22-01-0106-43,,JUTIAPA,JUTIAPA,EORM,ALDEA EL CARNERO,,,,PRIMARIA,OFICIAL,RURAL,CERRADA TEMPORALMENTE,MONOLINGUE,MATUTINA,DIARIO(REGULAR),JUTIAPA
22-01-0107-43,22-01-1219,JUTIAPA,JUTIAPA,EORM,"CASERIO LA CHICHITA, ALDEA SAN ANTONIO",,MARCO TULIO CASTILLO MELGAR,BEBERLY MABEL SALGUERO MORALES,PRIMARIA,OFICIAL,RURAL,ABIERTA,MONOLINGUE,MATUTINA,DIARIO(REGULAR),JUTIAPA
22-01-0108-43,22-01-1219,JUTIAPA,JUTIAPA,EORM,ALDEA LA MAJADA,41792817,MARCO TULIO CASTILLO MELGAR,SHEILA MARIBEL LEMUS LOPEZ,PRIMARIA,OFICIAL,RURAL,ABIERTA,MONOLINGUE,MATUTINA,DIARIO(REGULAR),JUTIAPA
22-01-0109-43,22-01-1219,JUTIAPA,JUTIAPA,EORM,"CASERIO LOS AMATES, CANTON POTRERO GRANDE",45711934,MARCO TULIO CASTILLO MELGAR,NERY ORLANDO LINARES CACAO,PRIMARIA,OFICIAL,RURAL,ABIERTA,MONOLINGUE,MATUTINA,DIARIO(REGULAR),JUTIAPA
22-01-0110-43,,JUTIAPA,JUTIAPA,EORM,"CANTON MAJADA, CASERIO LAS CRUCITAS",,,,PRIMARIA,OFICIAL,RURAL,CERRADA TEMPORALMENTE,MONOLINGUE,MATUTINA,DIARIO(REGULAR),JUTIAPA
22-01-0111-43,22-01-1226,JUTIAPA,JUTIAPA,EORM,"CASERIO LAS LOMAS, CANTON SAN MARCOS",53780525,REMBERTO RECINOS SARCEÑO,BLANCA SILVIA MUNGUIA SOSA,PRIMARIA,OFICIAL,RURAL,ABIERTA,MONOLINGUE,MATUTINA,DIARIO(REGULAR),JUTIAPA
22-01-0112-43,22-01-1220,JUTIAPA,JUTIAPA,EORM,"CASERIO HACIENDA VIEJA, ALDEA SAN PABLO",40096388,RONY ESTUARDO SANDOVAL MEDINA,PABLO JAVIER SANDOVAL MARTÍNEZ,PRIMARIA,OFICIAL,RURAL,ABIERTA,MONOLINGUE,MATUTINA,DIARIO(REGULAR),JUTIAPA
22-01-0113-43,22-01-1227,JUTIAPA,JUTIAPA,EORM,"CASERIO CERRO GRANDE, ALDEA EL BARREAL",55151324,CARLOS HUMBERTO CRUZ ALAY,REINA ISABEL SARCEÑO RAMOS,PRIMARIA,OFICIAL,RURAL,ABIERTA,MONOLINGUE,MATUTINA,DIARIO(REGULAR),JUTIAPA
22-01-0114-43,22-01-1228,JUTIAPA,JUTIAPA,EORM,"CASERIO TASHECA, CANTON VALENCIA",45213934,JULIO CÉSAR RIZO GARCÍA,ANDREA ESMERALDA CARRILLO ESCOBAR,PRIMARIA,OFICIAL,RURAL,ABIERTA,MONOLINGUE,MATUTINA,DIARIO(REGULAR),JUTIAPA
22-01-0115-43,22-01-1219,JUTIAPA,JUTIAPA,EORM,"CASERIO LA VEGA, CANTON PIPILTEPEQUE",54280478,MARCO TULIO CASTILLO MELGAR,CAROLINA SANTOS PÉREZ,PRIMARIA,OFICIAL,RURAL,ABIERTA,MONOLINGUE,MATUTINA,DIARIO(REGULAR),JUTIAPA
22-01-0116-43,22-01-1220,JUTIAPA,JUTIAPA,EORM,"CASERIO QUEBRADA DE AGUA, CANTON ENCINO GACHO",55966136,RONY ESTUARDO SANDOVAL MEDINA,EVELIN MARIBEL MARTÍNEZ ASENCIO,PRIMARIA,OFICIAL,RURAL,ABIERTA,MONOLINGUE,MATUTINA,DIARIO(REGULAR),JUTIAPA
22-01-0117-43,22-01-1224,JUTIAPA,JUTIAPA,INSTITUTO TECNOLOGICO BILINGUE,9A. AVE. 7-59 ZONA 1,78442338,ENMA ONDINA RIOS GONZALEZ DE CONTRERAS,MARÍA ANGELINA LÓPEZ CASTELLANOS,PRIMARIA,PRIVADO,URBANA,ABIERTA,MONOLINGUE,MATUTINA,DIARIO(REGULAR),JUTIAPA
22-01-0118-43,22-01-1228,JUTIAPA,JUTIAPA,EORM,CASERIO EL CHAGUITE CANTON VALENCIA,56921881,JULIO CÉSAR RIZO GARCÍA,GABRIELA MARÍA SANDOVAL LÓPEZ,PRIMARIA,OFICIAL,RURAL,ABIERTA,MONOLINGUE,MATUTINA,DIARIO(REGULAR),JUTIAPA
22-01-0119-43,22-01-1227,JUTIAPA,JUTIAPA,EORM,"CASERIO EL CARRIZO, ALDEA SAN PABLO",44902205,CARLOS HUMBERTO CRUZ ALAY,EDDY EMANUEL LÓPEZ VÁSQUEZ,PRIMARIA,OFICIAL,RURAL,ABIERTA,MONOLINGUE,MATUTINA,DIARIO(REGULAR),JUTIAPA
22-01-0120-43,22-01-1223,JUTIAPA,JUTIAPA,EORM,CASERIO LAS VICTORIAS CANTON MARIAS MONTAÑAS,31643377,EDGAR ARNULFO GONZÁLEZ GUDIEL,NANCY GUADALUPE ALAY GODOY,PRIMARIA,OFICIAL,RURAL,ABIERTA,MONOLINGUE,MATUTINA,DIARIO(REGULAR),JUTIAPA
22-01-0121-43,22-01-1223,JUTIAPA,JUTIAPA,EORM,"CASERIO LOS ANONOS, CANTON VALENCIA",51588722,EDGAR ARNULFO GONZÁLEZ GUDIEL,CATALINA NOHEMY CASTILLO VEGA,PRIMARIA,OFICIAL,RURAL,ABIERTA,BILINGUE,MATUTINA,DIARIO(REGULAR),JUTIAPA
22-01-0122-43,22-01-1227,JUTIAPA,JUTIAPA,EORM,"CASERIO LA LAGUNITA, ALDEA NUEVA ESPERANZA",57327710,CARLOS HUMBERTO CRUZ ALAY,SILVIA VERÓNICA GARAY SOTO,PRIMARIA,OFICIAL,RURAL,ABIERTA,MONOLINGUE,MATUTINA,DIARIO(REGULAR),JUTIAPA
22-01-0123-43,22-01-1219,JUTIAPA,JUTIAPA,EORM,CASERIO LA UNION CANTON SAN JOSE BUENA VISTA,31104212,MARCO TULIO CASTILLO MELGAR,VICTOR MANUEL LÉMUS,PRIMARIA,OFICIAL,RURAL,ABIERTA,MONOLINGUE,MATUTINA,DIARIO(REGULAR),JUTIAPA
22-01-0124-43,22-01-1228,JUTIAPA,JUTIAPA,EORM,CASERIO LA FUENTE CANTON VALENCIA,,JULIO CÉSAR RIZO GARCÍA,SANDRA ESTELA MONCHEZ BELLOSO,PRIMARIA,OFICIAL,RURAL,ABIERTA,MONOLINGUE,MATUTINA,DIARIO(REGULAR),JUTIAPA
22-01-0125-43,22-01-1227,JUTIAPA,JUTIAPA,EORM,CASERIO LAS MARIAS CANTON SAN JOSE BUENA VISTA,30940444,CARLOS HUMBERTO CRUZ ALAY,MÁX ISMAÉL ROCA GRIJALVA,PRIMARIA,OFICIAL,RURAL,ABIERTA,MONOLINGUE,MATUTINA,DIARIO(REGULAR),JUTIAPA
22-01-0126-43,22-01-1226,JUTIAPA,JUTIAPA,EORM,"CASERIO LAS MESAS, CANTON SAN MARCOS",38372306,REMBERTO RECINOS SARCEÑO,EVELYN CONSUELO NAJARRO,PRIMARIA,OFICIAL,RURAL,ABIERTA,MONOLINGUE,MATUTINA,DIARIO(REGULAR),JUTIAPA
22-01-0127-43,22-01-1228,JUTIAPA,JUTIAPA,EORM,CASERIO LA PERLA CANTON MARIAS MONTAÑAS,41875134,JULIO CÉSAR RIZO GARCÍA,ZAYDA NOHEMÍ ALAY GONZÁLEZ,PRIMARIA,OFICIAL,RURAL,ABIERTA,MONOLINGUE,MATUTINA,DIARIO(REGULAR),JUTIAPA
22-01-0129-43,22-01-1228,JUTIAPA,JUTIAPA,EORM,CASERIO MATOCHAL MURALLA CANTON VALENCIA,,JULIO CÉSAR RIZO GARCÍA,EDWIN SAÚL LÓPEZ TRIGUEROS,PRIMARIA,OFICIAL,RURAL,ABIERTA,MONOLINGUE,MATUTINA,DIARIO(REGULAR),JUTIAPA
22-01-0130-43,22-01-1223,JUTIAPA,JUTIAPA,EORM,CASERIO CHAPERNO CANTON AMAYO INGENIO,55582041,EDGAR ARNULFO GONZÁLEZ GUDIEL,HEBERTO ANÍBAL CORADO QUIÑONEZ,PRIMARIA,OFICIAL,RURAL,ABIERTA,MONOLINGUE,MATUTINA,DIARIO(REGULAR),JUTIAPA
22-01-0131-43,22-01-1227,JUTIAPA,JUTIAPA,EORM,"CASERIO EL ROSARIO, ALDEA LAS TUNAS",42141782,CARLOS HUMBERTO CRUZ ALAY,ROBERTO JOHANN PADILLA GARCIA,PRIMARIA,OFICIAL,RURAL,ABIERTA,MONOLINGUE,MATUTINA,DIARIO(REGULAR),JUTIAPA
22-01-0133-43,22-01-1225,JUTIAPA,JUTIAPA,"""LICEO CREZCO APRENDIENDO""",7A. CALLE 5-35 ZONA 3,46977703,CECILIA ISABEL ALDECOA CASASOLA,ANTONY EDIR GODOY RAMÍREZ,PRIMARIA,PRIVADO,URBANA,ABIERTA,MONOLINGUE,MATUTINA,DIARIO(REGULAR),JUTIAPA
22-01-0168-43,22-01-1219,JUTIAPA,JUTIAPA,EORM,"CASERIO EL COBANO, CANTON LOMITAS",56151261,MARCO TULIO CASTILLO MELGAR,ANA JULIETA SALGUERO TEO,PRIMARIA,OFICIAL,RURAL,ABIERTA,BILINGUE,MATUTINA,DIARIO(REGULAR),JUTIAPA
22-01-0169-43,22-01-1226,JUTIAPA,JUTIAPA,EORM,"CASERIO EL CAULOTE, CANTON AMAYITO",58339979,REMBERTO RECINOS SARCEÑO,ANA JUDITH CRÚZ AGUILAR,PRIMARIA,OFICIAL,RURAL,ABIERTA,BILINGUE,MATUTINA,DIARIO(REGULAR),JUTIAPA
22-01-0170-43,22-01-1223,JUTIAPA,JUTIAPA,EORM,CASERIO EL NARANJO CANTON VALENCIA,45250203,EDGAR ARNULFO GONZÁLEZ GUDIEL,ERICK ANTONIO RAMOS CASTILLO,PRIMARIA,OFICIAL,RURAL,ABIERTA,MONOLINGUE,MATUTINA,DIARIO(REGULAR),JUTIAPA
22-01-0171-43,22-01-1223,JUTIAPA,JUTIAPA,EORM,CASERIO EL CONGO CANTON VALENCIA,45088892,EDGAR ARNULFO GONZÁLEZ GUDIEL,OSCAR YOXAN GONZÁLEZ GUDIEL,PRIMARIA,OFICIAL,RURAL,ABIERTA,BILINGUE,MATUTINA,DIARIO(REGULAR),JUTIAPA
22-01-0172-43,22-01-1228,JUTIAPA,JUTIAPA,EORM,CASERIO BUENAS VISTAS CANTON VALENCIA,45863026,JULIO CÉSAR RIZO GARCÍA,IRMA ISABEL RAMÍREZ VELÁSQUEZ,PRIMARIA,OFICIAL,RURAL,ABIERTA,BILINGUE,MATUTINA,DIARIO(REGULAR),JUTIAPA
22-01-0173-43,22-01-1223,JUTIAPA,JUTIAPA,EORM,CANTON EL PEÑON,30560220,EDGAR ARNULFO GONZÁLEZ GUDIEL,RUTH ADALILA RAMÍREZ FLORES,PRIMARIA,OFICIAL,RURAL,ABIERTA,MONOLINGUE,MATUTINA,DIARIO(REGULAR),JUTIAPA
22-01-0174-43,22-01-1228,JUTIAPA,JUTIAPA,EORM,"CASERIO LOS LOBOS, CANTON MARIAS MONTAÑAS",,JULIO CÉSAR RIZO GARCÍA,LISDIN MEVALIN GARCÍA,PRIMARIA,OFICIAL,RURAL,ABIERTA,BILINGUE,MATUTINA,DIARIO(REGULAR),JUTIAPA
22-01-0175-43,22-01-1220,JUTIAPA,JUTIAPA,EORM,"CASERIO LAS JOYAS, CANTON VALENCIA",51811248,RONY ESTUARDO SANDOVAL MEDINA,MARCO ANTONIO LÓPEZ MÉNDEZ,PRIMARIA,OFICIAL,RURAL,ABIERTA,BILINGUE,MATUTINA,DIARIO(REGULAR),JUTIAPA
