10-01-2675-45,10-018,SUCHITEPEQUEZ,MAZATENANGO,"COLEGIO ""FROEBEL""","11 CALLE FINAL ZONA 3, COLONIA SAN ANDRES",78718047,NATALI XIOMARA DIAZ BARRIOS DE FIGUEROA,DOUGLAS ALCIRES MAATENS HERRERA,BASICO,PRIVADO,URBANA,CERRADA TEMPORALMENTE,MONOLINGUE,VESPERTINA,DIARIO(REGULAR),SUCHITEPÉQUEZ
10-01-2687-45,10-01-0480,SUCHITEPEQUEZ,MAZATENANGO,"COLEGIO PRIVADO ""RAFAEL LANDIVAR""",12 CALLE 4-57 ZONA 1,47016331,NATALI XIOMARA DÍAZ BARRIOS DE FIGUEROA,AURA BEATRIZ JACINTO CARDONA,BASICO,PRIVADO,URBANA,ABIERTA,MONOLINGUE,MATUTINA,DIARIO(REGULAR),SUCHITEPÉQUEZ
10-01-2688-45,10-01-0480,SUCHITEPEQUEZ,MAZATENANGO,COLEGIO PARTICULAR MIXTO CENTROAMERICANO,12 CALLE 5-03 ZONA 1,52729606,NATALI XIOMARA DÍAZ BARRIOS DE FIGUEROA,JOSÉ ANTONIO MEDRANO OROSCO,BASICO,PRIVADO,URBANA,ABIERTA,MONOLINGUE,MATUTINA,DIARIO(REGULAR),SUCHITEPÉQUEZ
10-01-2692-45,10-019,SUCHITEPEQUEZ,MAZATENANGO,INSTITUTO PRIVADO CRISTIANO MESOAMERICANO,CALZADA CENTENARIO 1-14 ZONA 2,,REYNA DEL ROSARIO CHAVEZ BARROW DE PACHECO,,BASICO,PRIVADO,URBANA,CERRADA TEMPORALMENTE,MONOLINGUE,VESPERTINA,DIARIO(REGULAR),SUCHITEPÉQUEZ
10-01-2702-45,10-019,SUCHITEPEQUEZ,MAZATENANGO,COLEGIO PRIVADO MIXTO 'CIENTIFICO',1A. AVENIDA FINAL ATRAS DEL CENTRO DE SALUD ZONA 1,78718869,REYNA DEL ROSARIO CHAVEZ BARROW DE PACHECO,,BASICO,PRIVADO,URBANA,CERRADA DEFINITIVAMENTE,MONOLINGUE,MATUTINA,DIARIO(REGULAR),SUCHITEPÉQUEZ
10-01-2703-45,10-019,SUCHITEPEQUEZ,MAZATENANGO,COLEGIO CENTRO DE ESTUDIOS INTEGRALES CEI,1A. CALLE BARRIO LA ESPERANZA ZONA 2,,REYNA DEL ROSARIO CHAVEZ BARROW DE PACHECO,,BASICO,PRIVADO,URBANA,CERRADA TEMPORALMENTE,MONOLINGUE,DOBLE,DOMINICAL,SUCHITEPÉQUEZ
10-01-2704-45,10-019,SUCHITEPEQUEZ,MAZATENANGO,COLEGIO CENTRO DE ESTUDIOS INTEGRALES CEI,1A. CALLE BARRIO LA ESPERANZA ZONA 2,,REYNA DEL ROSARIO CHAVEZ BARROW DE PACHECO,,BASICO,PRIVADO,URBANA,CERRADA TEMPORALMENTE,MONOLINGUE,DOBLE,DOMINICAL,SUCHITEPÉQUEZ
10-02-0003-45,10-003,SUCHITEPEQUEZ,CUYOTENANGO,"COLEGIO TECNICO PRIVADO MIXTO ""EL REDENTOR""","RESIDENCIALES ""LOS EUCALIPTOS"" DEL CENTRO UNO LA MAQUINA",41443366,CARLOS ENRIQUE JALEL DE LOS SANTOS,CESAR AUGUSTO BARCO ASENCIO,BASICO,PRIVADO,URBANA,CERRADA TEMPORALMENTE,MONOLINGUE,MATUTINA,DIARIO(REGULAR),SUCHITEPÉQUEZ
10-02-0029-45,10-02-0484,SUCHITEPEQUEZ,CUYOTENANGO,INEB,CANTON PARROQUIA,59667246,CARLOS ENRIQUE JALEL DE LOS SANTOS,SANDRA MARITZA CARDONA MAYÉN,BASICO,OFICIAL,URBANA,ABIERTA,MONOLINGUE,VESPERTINA,DIARIO(REGULAR),SUCHITEPÉQUEZ
10-02-0030-45,10-003,SUCHITEPEQUEZ,CUYOTENANGO,INEB,CENTRO UNO DEL PARCELAMIENTO LA MAQUINA,,CARLOS ENRIQUE JALEL DE LOS SANTOS,---,BASICO,OFICIAL,URBANA,CERRADA TEMPORALMENTE,MONOLINGUE,VESPERTINA,DIARIO(REGULAR),SUCHITEPÉQUEZ
10-02-0033-45,10-027,SUCHITEPEQUEZ,CUYOTENANGO,INEB DE TELESECUNDARIA,"LINEA A-9, SECTOR ICAN, PARCELAMIENTO LA MAQUINA",,CARLOS ENRIQUE JALEL DE LOS SANTOS,---,BASICO,OFICIAL,RURAL,CERRADA TEMPORALMENTE,MONOLINGUE,VESPERTINA,DIARIO(REGULAR),SUCHITEPÉQUEZ
10-02-0034-45,10-027,SUCHITEPEQUEZ,CUYOTENANGO,INEB DE TELESECUNDARIA,"LINEA A-13, SECTOR ICAN, PARCELAMIENTO LA MAQUINA",,CARLOS ENRIQUE JALEL DE LOS SANTOS,---,BASICO,OFICIAL,RURAL,CERRADA TEMPORALMENTE,MONOLINGUE,VESPERTINA,DIARIO(REGULAR),SUCHITEPÉQUEZ
10-02-0035-45,10-02-0484,SUCHITEPEQUEZ,CUYOTENANGO,INEB DE TELESECUNDARIA,CANTON GUACHIPILIN ZONA 1,56901658,CARLOS ENRIQUE JALEL DE LOS SANTOS,MARÍA LUISA VON ANSHELM MALDONADO,BASICO,OFICIAL,RURAL,ABIERTA,MONOLINGUE,MATUTINA,DIARIO(REGULAR),SUCHITEPÉQUEZ
10-02-0036-45,10-02-0512,SUCHITEPEQUEZ,CUYOTENANGO,INEB DE TELESECUNDARIA,CANTON CHACALTE APARICIO ZONA 2,41022051,CARLOS ENRIQUE JALEL DE LOS SANTOS,MARÍA VICTORIA CARDONA VARGAS,BASICO,OFICIAL,RURAL,ABIERTA,MONOLINGUE,VESPERTINA,DIARIO(REGULAR),SUCHITEPÉQUEZ
10-02-0045-45,10-027,SUCHITEPEQUEZ,CUYOTENANGO,INSTITUTO DE TELESECUNDARIA,"LINEA B-4 ICAN, PARCELAMIENTO LA MAQUINA",,CARLOS ENRIQUE JALEL DE LOS SANTOS,---,BASICO,OFICIAL,RURAL,CERRADA TEMPORALMENTE,MONOLINGUE,VESPERTINA,DIARIO(REGULAR),SUCHITEPÉQUEZ
10-02-0046-45,10-027,SUCHITEPEQUEZ,CUYOTENANGO,INSTITUTO DE TELESECUNDARIA,"LINEA B-6 EJE CENTRAL, SAN JOSE LA MAQUINA, CENTRO UNO",,CARLOS ENRIQUE JALEL DE LOS SANTOS,---,BASICO,OFICIAL,RURAL,CERRADA TEMPORALMENTE,MONOLINGUE,VESPERTINA,DIARIO(REGULAR),SUCHITEPÉQUEZ
10-02-0047-45,10-019,SUCHITEPEQUEZ,CUYOTENANGO,INSTITUTO DE TELESECUNDARIA,ALDEA CONCEPCION LA SELVA,,REYNA DEL ROSARIO CHAVEZ BARROW DE PACHECO,---,BASICO,OFICIAL,RURAL,CERRADA DEFINITIVAMENTE,MONOLINGUE,VESPERTINA,DIARIO(REGULAR),SUCHITEPÉQUEZ
10-02-0048-45,10-02-0484,SUCHITEPEQUEZ,CUYOTENANGO,INSTITUTO DE TELESECUNDARIA,ALDEA CONCEPCION LA CEIBA,41238750,CARLOS ENRIQUE JALEL DE LOS SANTOS,NERY ALFREDO CAL RABANALES,BASICO,OFICIAL,RURAL,ABIERTA,MONOLINGUE,VESPERTINA,DIARIO(REGULAR),SUCHITEPÉQUEZ
10-02-0051-45,10-02-0512,SUCHITEPEQUEZ,CUYOTENANGO,INSTITUTO TECNOLOGICO CIENTIFICO INDUSTRIAL DE SUCHITEPEQUEZ,KM. 169 CARRETERA AL PACIFICO,78683985,CARLOS ENRIQUE JALEL DE LOS SANTOS,JOSE LINO MALTEZ CASTILLO,BASICO,PRIVADO,URBANA,ABIERTA,MONOLINGUE,VESPERTINA,DIARIO(REGULAR),SUCHITEPÉQUEZ
10-02-0058-45,10-02-0512,SUCHITEPEQUEZ,CUYOTENANGO,INSTITUTO TECNOLOGICO CIENTIFICO INDUSTRIAL DE SUCHITEPEQUEZ,KM. 169 CARRETERA AL PACIFICO,78683985,CARLOS ENRIQUE JALEL DE LOS SANTOS,JOSE LINO MALTEZ CASTILLO,BASICO,PRIVADO,URBANA,ABIERTA,MONOLINGUE,DOBLE,SABATINO,SUCHITEPÉQUEZ
10-02-0060-45,10-99-0481,SUCHITEPEQUEZ,CUYOTENANGO,NUCLEO FAMILIAR EDUCATIVO PARA EL DESARROLLO NUFED NO. 343,LOTIFICACION CAÑAVERALES ACEITUNO,57160376,REYNA DEL ROSARIO CHÁVEZ BARROW DE PACHECO,CARLOS ALBERTO TELÓN MORALES,BASICO,OFICIAL,RURAL,ABIERTA,MONOLINGUE,VESPERTINA,DIARIO(REGULAR),SUCHITEPÉQUEZ
10-02-0062-45,10-003,SUCHITEPEQUEZ,CUYOTENANGO,"COLEGIO CATOLICO PRIVADO ""SAN JOSE""","CENTRO UNO, PARCELAMIENTO LA MAQUINA",79272441,CARLOS ENRIQUE JALEL DE LOS SANTOS,MARIA GUADALUPE MEJIA CALDERON,BASICO,PRIVADO,URBANA,CERRADA TEMPORALMENTE,MONOLINGUE,MATUTINA,DIARIO(REGULAR),SUCHITEPÉQUEZ
10-02-0064-45,10-02-0512,SUCHITEPEQUEZ,CUYOTENANGO,COLEGIO NUESTRA SEÑORA DE GUADALUPE,"1ERA. AVENIDA 5-75, CANTON PARROQUIA",78684590,CARLOS ENRIQUE JALEL DE LOS SANTOS,ASTRID SUCELY LAVICOUNT SAMAYOA,BASICO,PRIVADO,URBANA,ABIERTA,MONOLINGUE,VESPERTINA,DIARIO(REGULAR),SUCHITEPÉQUEZ
10-02-0069-45,10-003,SUCHITEPEQUEZ,CUYOTENANGO,COLEGIO PRIVADO MIXTO DE FORMACION INTEGRAL,CANTON CHACALTE APARICIO ZONA 1,4167037,CARLOS ENRIQUE JALEL DE LOS SANTOS,MIRIAN NINETH CACERES BERRIOS DE FIGUEROA,BASICO,PRIVADO,RURAL,CERRADA TEMPORALMENTE,MONOLINGUE,VESPERTINA,DIARIO(REGULAR),SUCHITEPÉQUEZ
10-02-0071-45,10-02-0484,SUCHITEPEQUEZ,CUYOTENANGO,INSTITUTO TECNOLOGICO CIENTIFICO INDUSTRIAL DE SUCHITEPEQUEZ,KM. 169 CARRETERA AL PACIFICO,78683985,CARLOS ENRIQUE JALEL DE LOS SANTOS,JOSE LINO MALTEZ CASTILLO,BASICO,PRIVADO,URBANA,ABIERTA,MONOLINGUE,SIN JORNADA,SEMIPRESENCIAL (UN DÍA A LA SEMANA),SUCHITEPÉQUEZ
10-02-0072-45,10-02-0484,SUCHITEPEQUEZ,CUYOTENANGO,COLEGIO PRIVADO MIXTO LICEO CUYOTECO,2A. AVENIDA 2-27 ZONA 1,47698076,CARLOS ENRIQUE JALEL DE LOS SANTOS,NELLY MISHELL DÍAZ BARRIOS,BASICO,PRIVADO,URBANA,ABIERTA,MONOLINGUE,SIN JORNADA,SEMIPRESENCIAL (UN DÍA A LA SEMANA),SUCHITEPÉQUEZ
10-02-0075-45,10-02-0512,SUCHITEPEQUEZ,CUYOTENANGO,COLEGIO PRIVADO MIXTO EINSTEIN,KM. 6.5 CANTON CHACALTE APARICIO ZONA 1,56331047,CARLOS ENRIQUE JALEL DE LOS SANTOS,JUAN PABLO URRUTIA,BASICO,PRIVADO,URBANA,ABIERTA,MONOLINGUE,VESPERTINA,DIARIO(REGULAR),SUCHITEPÉQUEZ
10-02-0137-45,10-023,SUCHITEPEQUEZ,CUYOTENANGO,IEBC,LINEA B-4 ICAN PARCELAMIENTO SAN JOSE LA MAQUINA,,CARLOS FILEMON SAMAYOA MADRID,,BASICO,COOPERATIVA,RURAL,CERRADA TEMPORALMENTE,MONOLINGUE,VESPERTINA,DIARIO(REGULAR),SUCHITEPÉQUEZ
10-02-0138-45,10-023,SUCHITEPEQUEZ,CUYOTENANGO,IEBC,LINEA A-7 LA MAQUINA,,CARLOS FILEMON SAMAYOA MADRID,GERMAN BALDEMAR XAR LÓPEZ,BASICO,COOPERATIVA,RURAL,CERRADA TEMPORALMENTE,MONOLINGUE,VESPERTINA,DIARIO(REGULAR),SUCHITEPÉQUEZ
10-02-0139-45,10-023,SUCHITEPEQUEZ,CUYOTENANGO,IEBC,CENTRO UNO LA MAQUINA,,CARLOS FILEMON SAMAYOA MADRID,,BASICO,COOPERATIVA,RURAL,CERRADA TEMPORALMENTE,MONOLINGUE,VESPERTINA,DIARIO(REGULAR),SUCHITEPÉQUEZ
10-02-0140-45,10-02-0484,SUCHITEPEQUEZ,CUYOTENANGO,IEBC,"CAMPO DE LA FERIA, CANTÓN SANTA TERESA",78684108,CARLOS ENRIQUE JALEL DE LOS SANTOS,BYRON HURTADO BALAÑÁ,BASICO,COOPERATIVA,URBANA,ABIERTA,MONOLINGUE,VESPERTINA,DIARIO(REGULAR),SUCHITEPÉQUEZ
10-02-0451-45,10-003,SUCHITEPEQUEZ,CUYOTENANGO,IPMB 'SUPERACION',"CENTRO URBANO NO.1, LOTE NO.44 PARCELAMIENTO LA MAQUINA",,CARLOS ENRIQUE JALEL DE LOS SANTOS,,BASICO,PRIVADO,URBANA,CERRADA TEMPORALMENTE,MONOLINGUE,NOCTURNA,DIARIO(REGULAR),SUCHITEPÉQUEZ
10-02-0887-45,10-003,SUCHITEPEQUEZ,CUYOTENANGO,IPMB 'EBEN-EZER',CENTRO UNO PARCELAMIENTO SAN JOSE LA MAQUINA,55642098,CARLOS ENRIQUE JALEL DE LOS SANTOS,,BASICO,PRIVADO,RURAL,CERRADA TEMPORALMENTE,MONOLINGUE,VESPERTINA,DIARIO(REGULAR),SUCHITEPÉQUEZ
10-02-0909-45,10-023,SUCHITEPEQUEZ,CUYOTENANGO,IEBC,LINEA B-10 PARCELAMIENTO LA MAQUINA,,CARLOS FILEMON SAMAYOA MADRID,,BASICO,COOPERATIVA,RURAL,CERRADA TEMPORALMENTE,MONOLINGUE,VESPERTINA,DIARIO(REGULAR),SUCHITEPÉQUEZ
10-02-2059-45,10-02-0512,SUCHITEPEQUEZ,CUYOTENANGO,INEB DE TELESECUNDARIA,CANTÓN CHACALTÉ APARICIO 1,41022051,CARLOS ENRIQUE JALEL DE LOS SANTOS,ALMA CORINA POP MALDONADO,BASICO,OFICIAL,RURAL,ABIERTA,MONOLINGUE,VESPERTINA,DIARIO(REGULAR),SUCHITEPÉQUEZ
10-02-2183-45,,SUCHITEPEQUEZ,CUYOTENANGO,COLEGIO CRISTIANO PRIVADO MIXTO LICEO SAN JOSE,CENTRO UNO PARCELAMIENTO LA MAQUINA,,,,BASICO,PRIVADO,RURAL,CERRADA TEMPORALMENTE,MONOLINGUE,MATUTINA,DIARIO(REGULAR),SUCHITEPÉQUEZ
10-02-2225-45,10-003,SUCHITEPEQUEZ,CUYOTENANGO,COLEGIO PRIVADO MIXTO CENTRO DE ESTUDIOS AVANZADOS 'NUEVO HORIZONTE' (POR MADUREZ),CENTRO UNO PARCELAMIENTO SAN JOSE LA MAQUINA,,CARLOS ENRIQUE JALEL DE LOS SANTOS,,BASICO,PRIVADO,URBANA,CERRADA TEMPORALMENTE,MONOLINGUE,MATUTINA,FIN DE SEMANA,SUCHITEPÉQUEZ
10-02-2227-45,10-003,SUCHITEPEQUEZ,CUYOTENANGO,COLEGIO PRIVADO MIXTO CENTRO DE ESTUDIOS AVANZADOS 'NUEVO HORIZONTE',CENTRO UNO SAN JOSE LA MAQUINA,,CARLOS ENRIQUE JALEL DE LOS SANTOS,,BASICO,PRIVADO,URBANA,CERRADA TEMPORALMENTE,MONOLINGUE,MATUTINA,DIARIO(REGULAR),SUCHITEPÉQUEZ
10-02-2231-45,10-003,SUCHITEPEQUEZ,CUYOTENANGO,COLEGIO PRIVADO MIXTO CAMINO DEL SABER,CALLE DE LA ESTACION CANTON ICAN,,CARLOS ENRIQUE JALEL DE LOS SANTOS,,BASICO,PRIVADO,URBANA,CERRADA TEMPORALMENTE,MONOLINGUE,MATUTINA,DIARIO(REGULAR),SUCHITEPÉQUEZ
10-02-2254-45,10-02-0512,SUCHITEPEQUEZ,CUYOTENANGO,INEB DE TELESECUNDARIA,LOTIFICACION SICAN,56973342,CARLOS ENRIQUE JALEL DE LOS SANTOS,YOSSELYN LISSETH GUTIÉRREZ GARCÍA,BASICO,OFICIAL,RURAL,ABIERTA,MONOLINGUE,VESPERTINA,DIARIO(REGULAR),SUCHITEPÉQUEZ
10-02-2256-45,10-003,SUCHITEPEQUEZ,CUYOTENANGO,COLEGIO PRIVADO MIXTO 'SUPERACION',CENTRO URBANO NO.1 LOTE NO.44 PARCELAMIENTO SAN JOSE LA MAQUINA,78580770,CARLOS ENRIQUE JALEL DE LOS SANTOS,,BASICO,PRIVADO,URBANA,CERRADA TEMPORALMENTE,MONOLINGUE,MATUTINA,DIARIO(REGULAR),SUCHITEPÉQUEZ
10-02-2257-45,10-003,SUCHITEPEQUEZ,CUYOTENANGO,COLEGIO PRIVADO MIXTO 'LICEO CUYOTECO',2A. AVENIDA 2-27 ZONA 1,78684337,CARLOS ENRIQUE JALEL DE LOS SANTOS,SERGIO AMÍLCAR DÍAZ AGUILAR,BASICO,PRIVADO,URBANA,CERRADA DEFINITIVAMENTE,MONOLINGUE,DOBLE,FIN DE SEMANA,SUCHITEPÉQUEZ
10-02-2525-45,10-02-0484,SUCHITEPEQUEZ,CUYOTENANGO,COLEGIO PRIVADO MIXTO LICEO CUYOTECO,2A. AV. 2-27 ZONA 1,78684337,CARLOS ENRIQUE JALEL DE LOS SANTOS,NELLY MISHELL DÍAZ BARRIOS,BASICO,PRIVADO,URBANA,ABIERTA,MONOLINGUE,VESPERTINA,DIARIO(REGULAR),SUCHITEPÉQUEZ
10-02-2554-45,10-003,SUCHITEPEQUEZ,CUYOTENANGO,COLEGIO CATOLICO PRIVADO SAN JOSE,"CENTRO UNO, PARCELAMIENTO LA MAQUINA",79272441,CARLOS ENRIQUE JALEL DE LOS SANTOS,,BASICO,PRIVADO,RURAL,CERRADA TEMPORALMENTE,MONOLINGUE,VESPERTINA,DIARIO(REGULAR),SUCHITEPÉQUEZ
10-02-2556-45,10-02-0484,SUCHITEPEQUEZ,CUYOTENANGO,COLEGIO PRIVADO MIXTO LICEO CUYOTECO,2A. AV. 2-27 ZONA 1,78684337,CARLOS ENRIQUE JALEL DE LOS SANTOS,NELLY MISHELL DÍAZ BARRIOS,BASICO,PRIVADO,URBANA,ABIERTA,MONOLINGUE,DOBLE,FIN DE SEMANA,SUCHITEPÉQUEZ
10-02-2558-45,10-003,SUCHITEPEQUEZ,CUYOTENANGO,COLEGIO PRIVADO MIXTO SANTO HERMANO PEDRO DE SAN JOSE DE BETANCOURT,CANTON CHACALTE APARICIO ZONA 1,,CARLOS ENRIQUE JALEL DE LOS SANTOS,,BASICO,PRIVADO,RURAL,CERRADA TEMPORALMENTE,MONOLINGUE,VESPERTINA,DIARIO(REGULAR),SUCHITEPÉQUEZ
10-02-2608-45,10-02-0484,SUCHITEPEQUEZ,CUYOTENANGO,INSTITUTO TECNOLOGICO CIENTIFICO INDUSTRIAL DE SUCHITEPEQUEZ,KM. 169 CARRETERA AL PACIFICO,78683985,CARLOS ENRIQUE JALEL DE LOS SANTOS,JOSE LINO MALTEZ CASTILLO,BASICO,PRIVADO,URBANA,ABIERTA,MONOLINGUE,MATUTINA,DIARIO(REGULAR),SUCHITEPÉQUEZ
10-02-2609-45,10-003,SUCHITEPEQUEZ,CUYOTENANGO,COLEGIO 'LICEO TECNICO DE ESTUDIOS AVANZADOS',CALLE DE LA ESTACION CANTON ICAN,78423685,CARLOS ENRIQUE JALEL DE LOS SANTOS,,BASICO,PRIVADO,RURAL,CERRADA TEMPORALMENTE,MONOLINGUE,MATUTINA,DIARIO(REGULAR),SUCHITEPÉQUEZ
10-02-2621-45,10-003,SUCHITEPEQUEZ,CUYOTENANGO,COLEGIO PRIVADO MIXTO 'DESARROLLO SOLIDARIO',LA LINEA A-5 PARCELAMIENTO LA MAQUINA,,CARLOS ENRIQUE JALEL DE LOS SANTOS,,BASICO,PRIVADO,RURAL,CERRADA DEFINITIVAMENTE,MONOLINGUE,VESPERTINA,DIARIO(REGULAR),SUCHITEPÉQUEZ
10-02-2655-45,10-003,SUCHITEPEQUEZ,CUYOTENANGO,CENTRO DE ESTUDIOS COMUNITARIO DE EDUCACION BASICA,CANTON GUACHIPILIN,,CARLOS ENRIQUE JALEL DE LOS SANTOS,,BASICO,PRIVADO,RURAL,CERRADA DEFINITIVAMENTE,MONOLINGUE,VESPERTINA,DIARIO(REGULAR),SUCHITEPÉQUEZ
10-03-0002-45,10-020,SUCHITEPEQUEZ,SAN FRANCISCO ZAPOTITLAN,CENTRO INTEGRAL EMPRESARIAL POR MADUREZ CIEM,5A. C. 2-66 ZONA 1,77650630,FREDY STUARDO QUIÑONEZ DE LEON,JOSE SAPON TAX,BASICO,PRIVADO,URBANA,CERRADA TEMPORALMENTE,MONOLINGUE,MATUTINA,FIN DE SEMANA,SUCHITEPÉQUEZ
10-03-0009-45,10-03-0485,SUCHITEPEQUEZ,SAN FRANCISCO ZAPOTITLAN,INEB DE TELESECUNDARIA,CANTON BUENA VISTA,37961466,FREDY STUARDO QUIÑÓNEZ DE LEÓN,MAYRA ARACELY RIVERA URIZAR,BASICO,OFICIAL,RURAL,ABIERTA,MONOLINGUE,VESPERTINA,DIARIO(REGULAR),SUCHITEPÉQUEZ
10-03-0011-45,10-03-0485,SUCHITEPEQUEZ,SAN FRANCISCO ZAPOTITLAN,INEB,COLONIA EL ROSARIO,58586024,FREDY STUARDO QUIÑÓNEZ DE LEÓN,RENÉ IVAN CACEROS JUÁREZ,BASICO,OFICIAL,URBANA,ABIERTA,MONOLINGUE,VESPERTINA,DIARIO(REGULAR),SUCHITEPÉQUEZ
10-03-0013-45,10-03-0485,SUCHITEPEQUEZ,SAN FRANCISCO ZAPOTITLAN,INEB DE TELESECUNDARIA,CASERIO PALESTINA,53386407,FREDY STUARDO QUIÑÓNEZ DE LEÓN,LIDIA MARÍA BERCIÁN FLORES,BASICO,OFICIAL,RURAL,ABIERTA,MONOLINGUE,VESPERTINA,DIARIO(REGULAR),SUCHITEPÉQUEZ
10-03-0017-45,10-03-0485,SUCHITEPEQUEZ,SAN FRANCISCO ZAPOTITLAN,INSTITUTO NACIONAL DE EDUCACION BASICA DE TELESECUNDARIA,"SECTOR LA CEIBA 2, ALDEA SAN JOSE",59465322,FREDY STUARDO QUIÑÓNEZ DE LEÓN,CLAUDIA VERONICA HERNÁNDEZ BARRENO,BASICO,OFICIAL,RURAL,ABIERTA,MONOLINGUE,MATUTINA,DIARIO(REGULAR),SUCHITEPÉQUEZ
10-03-0023-45,10-03-0485,SUCHITEPEQUEZ,SAN FRANCISCO ZAPOTITLAN,COLEGIO PREUNIVERSITARIO CAMINO A LA EXCELENCIA,2A. AVENIDA 2-80 ZONA 1,79389478,FREDY STUARDO QUIÑÓNEZ DE LEÓN,MELIDA BEATRIZ POROJ RODRIGUEZ,BASICO,PRIVADO,URBANA,ABIERTA,MONOLINGUE,MATUTINA,DIARIO(REGULAR),SUCHITEPÉQUEZ
10-03-0024-45,10-03-0485,SUCHITEPEQUEZ,SAN FRANCISCO ZAPOTITLAN,COLEGIO PREUNIVERSITARIO CAMINO A LA EXCELENCIA,2A. AVENIDA 2-80 ZONA 1,79389478,FREDY STUARDO QUIÑÓNEZ DE LEÓN,MELIDA BEATRIZ POROJ RODRIGUEZ,BASICO,PRIVADO,URBANA,ABIERTA,MONOLINGUE,DOBLE,FIN DE SEMANA,SUCHITEPÉQUEZ
10-03-0032-45,10-020,SUCHITEPEQUEZ,SAN FRANCISCO ZAPOTITLAN,"COLEGIO ""EL TRIUNFO""",5A. CALLE 2-66 ZONA 1,79389424,FREDY STUARDO QUIÑONEZ DE LEON,JUAN DE DIOS POLICARPIO MARÍN,BASICO,PRIVADO,URBANA,CERRADA TEMPORALMENTE,MONOLINGUE,DOBLE,FIN DE SEMANA,SUCHITEPÉQUEZ
10-03-0033-45,10-020,SUCHITEPEQUEZ,SAN FRANCISCO ZAPOTITLAN,"COLEGIO ""EL TRIUNFO""",5A. CALLE 2-66 ZONA 1,79389424,FREDY STUARDO QUIÑONEZ DE LEON,JUAN DE DIOS POLICARPIO MARIN,BASICO,PRIVADO,URBANA,CERRADA TEMPORALMENTE,MONOLINGUE,VESPERTINA,DIARIO(REGULAR),SUCHITEPÉQUEZ
10-03-0035-45,10-03-0485,SUCHITEPEQUEZ,SAN FRANCISCO ZAPOTITLAN,"COLEGIO ""MONTE VERDE""",2A. AVENIDA 1-072 ZONA 0,55101636,FREDY STUARDO QUIÑÓNEZ DE LEÓN,KARLA PAULINA RODRÍGUEZ MALDONADO,BASICO,PRIVADO,URBANA,ABIERTA,MONOLINGUE,MATUTINA,DIARIO(REGULAR),SUCHITEPÉQUEZ
10-03-0036-45,10-03-0485,SUCHITEPEQUEZ,SAN FRANCISCO ZAPOTITLAN,"INSTITUTO PRIVADO MIXTO ""EL ALFARERO""",2DA. AVENIDA 4-48 ZONA 1,55144660,FREDY STUARDO QUIÑÓNEZ DE LEÓN,FRANCISCO EVERARDO POL RAFAEL,BASICO,PRIVADO,RURAL,ABIERTA,MONOLINGUE,VESPERTINA,DIARIO(REGULAR),SUCHITEPÉQUEZ
10-03-0039-45,10-03-0485,SUCHITEPEQUEZ,SAN FRANCISCO ZAPOTITLAN,"INSTITUTO PRIVADO MIXTO ""EL ALFARERO""","CALLE PRINCIPAL, SEGUNDO CALLEJON LOTIFICACION EL PANORAMA, CANTON SAN JOSÉ",33670465,FREDY STUARDO QUIÑÓNEZ DE LEÓN,FRANCISCO EVERARDO POL RAFAEL,BASICO,PRIVADO,RURAL,ABIERTA,MONOLINGUE,DOBLE,FIN DE SEMANA,SUCHITEPÉQUEZ
10-03-0041-45,10-03-0485,SUCHITEPEQUEZ,SAN FRANCISCO ZAPOTITLAN,"INSTITUTO PRIVADO MIXTO ""EL ALFARERO""",2A. AVENIDA 4-84 ZONA 1,33670465,FREDY STUARDO QUIÑÓNEZ DE LEÓN,FRANCISCO EVERARDO POL RAFAEL,BASICO,PRIVADO,URBANA,ABIERTA,MONOLINGUE,SIN JORNADA,SEMIPRESENCIAL (UN DÍA A LA SEMANA),SUCHITEPÉQUEZ
10-03-0141-45,10-03-0485,SUCHITEPEQUEZ,SAN FRANCISCO ZAPOTITLAN,IEBC SAN FRANCISCO,4A. AVENIDA Y 3A. CALLE ZONA 3 COLONIA EL ROSARIO,79389643,FREDY STUARDO QUIÑÓNEZ DE LEÓN,NANCY MARÍA DE LEÓN AGUILAR,BASICO,COOPERATIVA,URBANA,ABIERTA,MONOLINGUE,VESPERTINA,DIARIO(REGULAR),SUCHITEPÉQUEZ
10-03-1138-45,10-03-0485,SUCHITEPEQUEZ,SAN FRANCISCO ZAPOTITLAN,COLEGIO EL TRIUNFO,5TA. CALLE 2-66 ZONA 1,79389424,FREDY STUARDO QUIÑÓNEZ DE LEÓN,JUAN DE DIOS POLICARPIO MARÍN,BASICO,PRIVADO,URBANA,ABIERTA,MONOLINGUE,MATUTINA,DIARIO(REGULAR),SUCHITEPÉQUEZ
10-03-1943-45,,SUCHITEPEQUEZ,SAN FRANCISCO ZAPOTITLAN,INEB DE TELESECUNDARIA,CANTON SAN JOSE,,,,BASICO,OFICIAL,RURAL,CERRADA TEMPORALMENTE,MONOLINGUE,VESPERTINA,DIARIO(REGULAR),SUCHITEPÉQUEZ
10-03-2304-45,10-99-0506,SUCHITEPEQUEZ,SAN FRANCISCO ZAPOTITLAN,INEB DE TELESECUNDARIA,COMUNIDAD 10 DE MAYO S.A,58531043,CARLOS FILEMÓN SAMAYOA MADRID,HEIDY PAOLA OROZCO GARCÍA,BASICO,OFICIAL,RURAL,ABIERTA,MONOLINGUE,VESPERTINA,DIARIO(REGULAR),SUCHITEPÉQUEZ
10-03-2320-45,10-020,SUCHITEPEQUEZ,SAN FRANCISCO ZAPOTITLAN,COLEGIO PRIVADO MIXTO EL TRIUNFO,5TA. CALLE 2-66 ZONA 1,,FREDY STUARDO QUIÑONEZ DE LEON,,BASICO,PRIVADO,URBANA,CERRADA TEMPORALMENTE,MONOLINGUE,DOBLE,FIN DE SEMANA,SUCHITEPÉQUEZ
10-03-2488-45,10-03-0485,SUCHITEPEQUEZ,SAN FRANCISCO ZAPOTITLAN,LICEO LA RAZON,2A. AVENIDA 4-36 ZONA 2,50186536,FREDY STUARDO QUIÑÓNEZ DE LEÓN,JAQUELINE SAMANTA SIERRA VELASQUEZ,BASICO,PRIVADO,URBANA,ABIERTA,MONOLINGUE,VESPERTINA,DIARIO(REGULAR),SUCHITEPÉQUEZ
10-03-2497-45,10-020,SUCHITEPEQUEZ,SAN FRANCISCO ZAPOTITLAN,INSTITUTO PRE-UNIVERSITARIO FRANCISCANO,5A. CALLE 2-66 ZONA 1,55655011,FREDY STUARDO QUIÑONEZ DE LEON,,BASICO,PRIVADO,URBANA,CERRADA TEMPORALMENTE,MONOLINGUE,DOBLE,FIN DE SEMANA,SUCHITEPÉQUEZ
10-03-2510-45,10-020,SUCHITEPEQUEZ,SAN FRANCISCO ZAPOTITLAN,COLEGIO ELEMENTAL SUPERIOR SAN FRANCISCO,1 CALLE 2-042 ZONA 1,55718744,FREDY STUARDO QUIÑONEZ DE LEON,,BASICO,PRIVADO,URBANA,CERRADA TEMPORALMENTE,MONOLINGUE,MATUTINA,DIARIO(REGULAR),SUCHITEPÉQUEZ
10-04-0009-45,10-99-0486,SUCHITEPEQUEZ,SAN BERNARDINO,INEB,CANTON EL JARDIN ZONA 2,41513733,JUANA MARÍA CIFUENTES PÉREZ,AMANDA MARISOL DE LEÓN SOSA,BASICO,OFICIAL,URBANA,ABIERTA,MONOLINGUE,MATUTINA,DIARIO(REGULAR),SUCHITEPÉQUEZ
10-04-0010-45,10-99-0486,SUCHITEPEQUEZ,SAN BERNARDINO,INEB DE TELESECUNDARIA,"CANTON LAS CRUCES, SECTOR II",56999044,JUANA MARÍA CIFUENTES PÉREZ,INGRID YOHANA VILLAGRÁN TALÉ,BASICO,OFICIAL,RURAL,ABIERTA,MONOLINGUE,VESPERTINA,DIARIO(REGULAR),SUCHITEPÉQUEZ
10-04-0016-45,10-99-0486,SUCHITEPEQUEZ,SAN BERNARDINO,"COLEGIO PRIVADO MIXTO ""CIENCIA Y TECNOLOGIA""",CANTON LAS FLORES,41704607,JUANA MARÍA CIFUENTES PÉREZ,GILDA MARIELA FLORES MAZARIEGOS,BASICO,PRIVADO,URBANA,ABIERTA,MONOLINGUE,DOBLE,FIN DE SEMANA,SUCHITEPÉQUEZ
10-04-0017-45,10-99-0486,SUCHITEPEQUEZ,SAN BERNARDINO,"COLEGIO PRIVADO MIXTO ""CIENCIA Y TECNOLOGIA""",CANTON LAS FLORES,56713507,JUANA MARÍA CIFUENTES PÉREZ,GILDA MARIELA FLORES MAZARIEGOS,BASICO,PRIVADO,URBANA,ABIERTA,MONOLINGUE,DOBLE,FIN DE SEMANA,SUCHITEPÉQUEZ
10-04-0020-45,10-99-0486,SUCHITEPEQUEZ,SAN BERNARDINO,"COLEGIO PRIVADO MIXTO ""CIENCIA Y TECNOLOGIA""",CANTON LAS FLORES,41704607,JUANA MARÍA CIFUENTES PÉREZ,GILDA MARIELA FLORES MAZARIEGOS,BASICO,PRIVADO,URBANA,ABIERTA,MONOLINGUE,SIN JORNADA,SEMIPRESENCIAL (UN DÍA A LA SEMANA),SUCHITEPÉQUEZ
10-04-0024-45,10-99-0486,SUCHITEPEQUEZ,SAN BERNARDINO,"COLEGIO PRIVADO MIXTO ""LICEO CIENTIFICO""","3A. CALLE 04-045 ZONA 2, CANTON EL JARDIN",52330641,JUANA MARÍA CIFUENTES PÉREZ,GILDA MARIELA FLORES MAZARIEGOS,BASICO,PRIVADO,URBANA,ABIERTA,MONOLINGUE,VESPERTINA,DIARIO(REGULAR),SUCHITEPÉQUEZ
10-04-0159-45,10-99-0486,SUCHITEPEQUEZ,SAN BERNARDINO,INSTITUTO DE EDUCACION BASICA POR COOPERATIVA,CANTON LAS FLORES,55955190,JUANA MARÍA CIFUENTES PÉREZ,AURA ELIZABETH RODAS HERNÁNDEZ,BASICO,COOPERATIVA,URBANA,ABIERTA,MONOLINGUE,VESPERTINA,DIARIO(REGULAR),SUCHITEPÉQUEZ
10-04-2049-45,10-99-0486,SUCHITEPEQUEZ,SAN BERNARDINO,COLEGIO PRIVADO MIXTO SANTA ELENA,CANTON EL JARDIN,47638639,JUANA MARÍA CIFUENTES PÉREZ,HORTENCIA JOSEFINA AJPOP AGUILAR,BASICO,PRIVADO,URBANA,ABIERTA,MONOLINGUE,MATUTINA,DIARIO(REGULAR),SUCHITEPÉQUEZ
10-04-2187-45,10-99-0486,SUCHITEPEQUEZ,SAN BERNARDINO,INEB DE TELESECUNDARIA,CANTON EL SAUCE,51277407,JUANA MARÍA CIFUENTES PÉREZ,INSY ILIANA JIMÉNEZ BARRIOS,BASICO,OFICIAL,RURAL,ABIERTA,MONOLINGUE,VESPERTINA,DIARIO(REGULAR),SUCHITEPÉQUEZ
10-05-0012-45,10-05-0487,SUCHITEPEQUEZ,SAN JOSE EL IDOLO,INEB DE TELESECUNDARIA,CASERIO PINAL DEL RIO,43874208,CARLOS EMELITÓN VALENZUELA MARROQUÍN,ERVIN RENÉ PÉREZ ALONZO,BASICO,OFICIAL,RURAL,ABIERTA,MONOLINGUE,MATUTINA,DIARIO(REGULAR),SUCHITEPÉQUEZ
10-05-0013-45,10-05-0487,SUCHITEPEQUEZ,SAN JOSE EL IDOLO,INEB,SAN JOSE EL IDOLO,50101236,CARLOS EMELITÓN VALENZUELA MARROQUÍN,ELÍAS MOISÉS MARTÍNEZ RUIZ,BASICO,OFICIAL,URBANA,ABIERTA,MONOLINGUE,VESPERTINA,DIARIO(REGULAR),SUCHITEPÉQUEZ
10-05-0014-45,10-05-0487,SUCHITEPEQUEZ,SAN JOSE EL IDOLO,INEB DE TELESECUNDARIA,LABOR LA AURORA,38095445,CARLOS EMELITÓN VALENZUELA MARROQUÍN,LUSBY HAYDÉE LÓPEZ ALVARADO,BASICO,OFICIAL,RURAL,ABIERTA,MONOLINGUE,VESPERTINA,DIARIO(REGULAR),SUCHITEPÉQUEZ
10-05-0015-45,10-05-0487,SUCHITEPEQUEZ,SAN JOSE EL IDOLO,INEB DE TELESECUNDARIA,ALDEA SAN RAMON,42193456,CARLOS EMELITÓN VALENZUELA MARROQUÍN,SONIA MARIZOL OROZCO AGUILAR,BASICO,OFICIAL,RURAL,ABIERTA,MONOLINGUE,VESPERTINA,DIARIO(REGULAR),SUCHITEPÉQUEZ
10-05-0018-45,10-006,SUCHITEPEQUEZ,SAN JOSE EL IDOLO,INSTITUTO DE TELESECUNDARIA,ALDEA NAHUALATE I,,CARLOS EMELITON VALENZUELA MARROQUIN,---,BASICO,OFICIAL,RURAL,CERRADA TEMPORALMENTE,MONOLINGUE,VESPERTINA,DIARIO(REGULAR),SUCHITEPÉQUEZ
10-05-0027-45,10-05-0487,SUCHITEPEQUEZ,SAN JOSE EL IDOLO,LICEO SAN JOSE,ENTRADA DE LA AVENIDA PRINCIPAL,41240077,CARLOS EMELITÓN VALENZUELA MARROQUÍN,ELY MAGNOLIA VAC GARCIA,BASICO,PRIVADO,URBANA,ABIERTA,MONOLINGUE,VESPERTINA,DIARIO(REGULAR),SUCHITEPÉQUEZ
10-05-0170-45,10-05-0487,SUCHITEPEQUEZ,SAN JOSE EL IDOLO,IEBC,,54569267,CARLOS EMELITÓN VALENZUELA MARROQUÍN,NORMA RAMÍREZ US,BASICO,COOPERATIVA,URBANA,ABIERTA,MONOLINGUE,VESPERTINA,DIARIO(REGULAR),SUCHITEPÉQUEZ
10-05-2419-45,10-006,SUCHITEPEQUEZ,SAN JOSE EL IDOLO,INSTITUTO PRIVADO MIXTO 'SAN JOSE',7A. CALLE Y 3A. AVENIDA JACINTO PACHECO,,CARLOS EMELITON VALENZUELA MARROQUIN,,BASICO,PRIVADO,URBANA,CERRADA DEFINITIVAMENTE,MONOLINGUE,VESPERTINA,DIARIO(REGULAR),SUCHITEPÉQUEZ
10-05-2420-45,10-006,SUCHITEPEQUEZ,SAN JOSE EL IDOLO,INSTITUTO PRIVADO MIXTO 'SAN JOSE',7A. CALLE Y 3A. AVENIDA JACINTO PACHECO,,CARLOS EMELITON VALENZUELA MARROQUIN,,BASICO,PRIVADO,URBANA,CERRADA DEFINITIVAMENTE,MONOLINGUE,DOBLE,FIN DE SEMANA,SUCHITEPÉQUEZ
10-05-2443-45,10-05-0487,SUCHITEPEQUEZ,SAN JOSE EL IDOLO,INSTITUTO DE EDUCACION BASICA POR COOPERATIVA,CASERIO NUEVO SANTIAGO CABRICAN,58768492,CARLOS EMELITÓN VALENZUELA MARROQUÍN,GASPAR RECINCOY CHÁVEZ,BASICO,COOPERATIVA,RURAL,ABIERTA,MONOLINGUE,VESPERTINA,DIARIO(REGULAR),SUCHITEPÉQUEZ
10-05-2569-45,10-006,SUCHITEPEQUEZ,SAN JOSE EL IDOLO,INSTITUTO PRIVADO MIXTO PROFESORA MARIA JOSEFINA CABRERA ROSALES,7A. CALLE Y 3AV. JACINTO PACHECO,,CARLOS EMELITON VALENZUELA MARROQUIN,,BASICO,PRIVADO,URBANA,CERRADA TEMPORALMENTE,MONOLINGUE,VESPERTINA,DIARIO(REGULAR),SUCHITEPÉQUEZ
10-05-2570-45,10-05-0487,SUCHITEPEQUEZ,SAN JOSE EL IDOLO,INSTITUTO PRIVADO MIXTO PROFESORA MARIA JOSEFINA CABRERA ROSALES,7A. CALLE Y 3AV. JACINTO PACHECO,,CARLOS EMELITÓN VALENZUELA MARROQUÍN,ELÍAS MOISÉS MARTÍNEZ RUIZ,BASICO,PRIVADO,URBANA,ABIERTA,MONOLINGUE,DOBLE,FIN DE SEMANA,SUCHITEPÉQUEZ
10-05-2618-45,10-006,SUCHITEPEQUEZ,SAN JOSE EL IDOLO,CENTRO DE ESTUDIOS COMUNITARIO DE EDUCACION BASICA,ALDEA SAN RAMON,,CARLOS EMELITON VALENZUELA MARROQUIN,,BASICO,PRIVADO,RURAL,CERRADA DEFINITIVAMENTE,MONOLINGUE,VESPERTINA,DIARIO(REGULAR),SUCHITEPÉQUEZ
10-06-0014-45,10-06-0488,SUCHITEPEQUEZ,SANTO DOMINGO SUCHITEPEQUEZ,INEB,SANTO DOMINGO SUCHITEPEQUEZ,41573558,EDDY OSWALDO DE LEÓN SOLARES,RENÉ ROLANDO IXCOY QUIÑONEZ,BASICO,OFICIAL,URBANA,ABIERTA,MONOLINGUE,VESPERTINA,DIARIO(REGULAR),SUCHITEPÉQUEZ
10-06-0015-45,10-06-0490,SUCHITEPEQUEZ,SANTO DOMINGO SUCHITEPEQUEZ,INEB,ALDEA BOLIVIA SANTO DOMINGO SUCHITEPEQUEZ,58418592,MÓNICA ANNA JOSÉ HERNÁNDEZ QUIÑONEZ,JORGE MARIO JUÁREZ ASENCIÓN,BASICO,OFICIAL,URBANA,ABIERTA,MONOLINGUE,VESPERTINA,DIARIO(REGULAR),SUCHITEPÉQUEZ
10-06-0017-45,10-06-0490,SUCHITEPEQUEZ,SANTO DOMINGO SUCHITEPEQUEZ,INEB DE TELESECUNDARIA,COMUNIDAD AGRARIA WILLY WOODS,55712307,MÓNICA ANNA JOSÉ HERNÁNDEZ QUIÑONEZ,ANAHÍ BETZABÉ GARCÍA REYNOSO,BASICO,OFICIAL,RURAL,ABIERTA,MONOLINGUE,MATUTINA,DIARIO(REGULAR),SUCHITEPÉQUEZ
10-06-0018-45,10-06-0488,SUCHITEPEQUEZ,SANTO DOMINGO SUCHITEPEQUEZ,INEB DE TELESECUNDARIA,CASERIO SANTA LUCIA,36480198,EDDY OSWALDO DE LEÓN SOLARES,CARMEN GARCÍA ALVARADO,BASICO,OFICIAL,RURAL,ABIERTA,MONOLINGUE,MATUTINA,DIARIO(REGULAR),SUCHITEPÉQUEZ
