0,1,2,3,4,5,6,7,8,9,10,11,12,13,14,15,16
CODIGO,DISTRITO,DEPARTAMENTO,MUNICIPIO,ESTABLECIMIENTO,DIRECCION,TELEFONO,SUPERVISOR,DIRECTOR,NIVEL,SECTOR,AREA,STATUS,MODALIDAD,JORNADA,PLAN,DEPARTAMENTAL
10-01-0069-45,10-01-0479,SUCHITEPEQUEZ,MAZATENANGO,INEB CON ORIENTACION OCUPACIONAL 'LIC. JULIO CESAR MENDEZ MONTENEGRO',CANTON SANTA CRISTINA ZONA 2,54142247,REYNA DEL ROSARIO CHÁVEZ BARROW DE PACHECO,CLAUDIA LORENA MARTINEZ RECINOS DE CAMEY,BASICO,OFICIAL,URBANA,ABIERTA,MONOLINGUE,MATUTINA,DIARIO(REGULAR),SUCHITEPÉQUEZ
10-01-0070-45,10-01-0479,SUCHITEPEQUEZ,MAZATENANGO,INEB CON ORIENTACION OCUPACIONAL 'LIC. JULIO CESAR MENDEZ MONTENEGRO',CANTON SANTA CRISTINA ZONA 2,55151890,REYNA DEL ROSARIO CHÁVEZ BARROW DE PACHECO,CARMEN FERNANDA TOJÍN GARCÍA,BASICO,OFICIAL,URBANA,ABIERTA,MONOLINGUE,VESPERTINA,DIARIO(REGULAR),SUCHITEPÉQUEZ
10-01-0071-45,10-99-0481,SUCHITEPEQUEZ,MAZATENANGO,INEB ADSCRITO A ESCUELA NACIONAL DE CIENCIAS COMERCIALES,CANTON SANTA CRISTINA,57172460,REYNA DEL ROSARIO CHÁVEZ BARROW DE PACHECO,VIVIAN ELISA CABRERA GRAMAJO,BASICO,OFICIAL,URBANA,ABIERTA,MONOLINGUE,NOCTURNA,DIARIO(REGULAR),SUCHITEPÉQUEZ
10-01-0073-45,10-019,SUCHITEPEQUEZ,MAZATENANGO,COLEGIO LATINOAMERICANO GOSPEL,SALIDA A GUATEMALA KM. 150.5,78723282,REYNA DEL ROSARIO CHAVEZ BARROW DE PACHECO,MARIA LEONOR PENAGOS DE LOPEZ,BASICO,PRIVADO,URBANA,CERRADA TEMPORALMENTE,MONOLINGUE,DOBLE,FIN DE SEMANA,SUCHITEPÉQUEZ
10-01-0074-45,10-01-0483,SUCHITEPEQUEZ,MAZATENANGO,INSTITUTO DE COMPUTACION INFORMATICA,"COLONIA SAN BARTOLOME, 4A. CALLE FINAL",78721357,NATALI XIOMARA DÍAZ BARRIOS DE FIGUEROA,LORENA BEATRÍZ REYNOSO GUZMÁN,BASICO,PRIVADO,URBANA,ABIERTA,MONOLINGUE,MATUTINA,DIARIO(REGULAR),SUCHITEPÉQUEZ
10-01-0075-45,10-01-0511,SUCHITEPEQUEZ,MAZATENANGO,COLEGIO LATINOAMERICANO GOSPEL,"12 CALLE 4-45, ZONA 1",77911907,HEILYN MIRELLA GONZÁLEZ XAR DE QUINTEROS,GLORIA CELESTE ROBLES RODAS,BASICO,PRIVADO,URBANA,ABIERTA,MONOLINGUE,MATUTINA,DIARIO(REGULAR),SUCHITEPÉQUEZ
10-01-0076-45,10-01-0480,SUCHITEPEQUEZ,MAZATENANGO,"COLEGIO CIENTIFICO Y TECNOLOGICO ""BLAISE PASCAL""",1RA. AV. SUR FINAL 12-70 ZONA 2,59465095,NATALI XIOMARA DÍAZ BARRIOS DE FIGUEROA,JAQUELINE ESPERANZA LIMA LINARES,BASICO,PRIVADO,URBANA,ABIERTA,MONOLINGUE,MATUTINA,DIARIO(REGULAR),SUCHITEPÉQUEZ
10-01-0077-45,10-018,SUCHITEPEQUEZ,MAZATENANGO,COLEGIO PRIVADO MIXTO EL CARMEN,,78720430,NATALI XIOMARA DIAZ BARRIOS DE FIGUEROA,,BASICO,PRIVADO,URBANA,CERRADA DEFINITIVAMENTE,MONOLINGUE,MATUTINA,DIARIO(REGULAR),SUCHITEPÉQUEZ
10-01-0078-45,10-01-0479,SUCHITEPEQUEZ,MAZATENANGO,COLEGIO PRIVADO MIXTO LICEO MAZATECO,6A. AVENIDA 2-21 ZONA 1,78720482,REYNA DEL ROSARIO CHÁVEZ BARROW DE PACHECO,SINDY CARLOTA MANCIO MÉNDEZ,BASICO,PRIVADO,URBANA,ABIERTA,MONOLINGUE,VESPERTINA,DIARIO(REGULAR),SUCHITEPÉQUEZ
10-01-0079-45,10-01-0479,SUCHITEPEQUEZ,MAZATENANGO,"COLEGIO PRIVADO MIXTO ""PERPETUO SOCORRO""",1A CALLE 3-39 ZONA 1,41614325,REYNA DEL ROSARIO CHÁVEZ BARROW DE PACHECO,SENAIDA ANAVELA BARRIENTOS CASEROS,BASICO,PRIVADO,URBANA,ABIERTA,MONOLINGUE,MATUTINA,DIARIO(REGULAR),SUCHITEPÉQUEZ
10-01-0080-45,,SUCHITEPEQUEZ,MAZATENANGO,IPMB 'REPUBLICA DE GUATEMALA',8A CALLE 2-35 ZONA 1,,,,BASICO,PRIVADO,URBANA,CERRADA TEMPORALMENTE,MONOLINGUE,VESPERTINA,DIARIO(REGULAR),SUCHITEPÉQUEZ
10-01-0081-45,,SUCHITEPEQUEZ,MAZATENANGO,IPMB 'REPUBLICA DE GUATEMALA',3A AVE. 6-29 ZONA 1,78720041,,,BASICO,PRIVADO,URBANA,CERRADA TEMPORALMENTE,MONOLINGUE,NOCTURNA,DIARIO(REGULAR),SUCHITEPÉQUEZ
10-01-0082-45,,SUCHITEPEQUEZ,MAZATENANGO,COLEGIO PRIVADO MIXTO EL ROSARIO,2A. AVENIDA 4-84 ZONA 1,78724768,,,BASICO,PRIVADO,URBANA,CERRADA DEFINITIVAMENTE,MONOLINGUE,MATUTINA,DIARIO(REGULAR),SUCHITEPÉQUEZ
10-01-0083-45,10-01-0479,SUCHITEPEQUEZ,MAZATENANGO,INSTITUTO PRIVADO MIXTO TECNOLOGICO DEL SUROCCIDENTE,FINCA CHOJOJA,55103188,REYNA DEL ROSARIO CHÁVEZ BARROW DE PACHECO,LIDIA ELIZABETH JEREZ DE LEÓN,BASICO,PRIVADO,URBANA,ABIERTA,MONOLINGUE,MATUTINA,DIARIO(REGULAR),SUCHITEPÉQUEZ
10-01-0084-45,10-01-0479,SUCHITEPEQUEZ,MAZATENANGO,"COLEGIO PARTICULAR MIXTO ""LA ILUSTRACION""",3A AVE. 4-92 ZONA 1,41639696,REYNA DEL ROSARIO CHÁVEZ BARROW DE PACHECO,MARÍA ELENA ROCHA NAVARRO,BASICO,PRIVADO,URBANA,ABIERTA,MONOLINGUE,MATUTINA,DIARIO(REGULAR),SUCHITEPÉQUEZ
10-01-0085-45,,SUCHITEPEQUEZ,MAZATENANGO,IPMB 'LA JUVENTUD',2A CALLE 3-13 ZONA 1,78722297,,,BASICO,PRIVADO,URBANA,CERRADA DEFINITIVAMENTE,MONOLINGUE,MATUTINA,DIARIO(REGULAR),SUCHITEPÉQUEZ
10-01-0092-45,10-019,SUCHITEPEQUEZ,MAZATENANGO,"COLEGIO PRIVADO ""RAFAEL LANDIVAR""",12 CALLE 4-57 ZONA 1,78720425,REYNA DEL ROSARIO CHAVEZ BARROW DE PACHECO,BONNY KELLY DIANA RAMÍREZ MORALES,BASICO,PRIVADO,URBANA,CERRADA TEMPORALMENTE,MONOLINGUE,DOBLE,FIN DE SEMANA,SUCHITEPÉQUEZ
10-01-0093-45,10-99-0481,SUCHITEPEQUEZ,MAZATENANGO,INEB 'RAFAEL LANDIVAR',CANTON SANTA CRISTINA,78725695,REYNA DEL ROSARIO CHÁVEZ BARROW DE PACHECO,BRENDA LISSETTE SÁNCHEZ ALVAREZ,BASICO,OFICIAL,URBANA,ABIERTA,MONOLINGUE,MATUTINA,DIARIO(REGULAR),SUCHITEPÉQUEZ
10-01-0094-45,10-019,SUCHITEPEQUEZ,MAZATENANGO,IPMB RAFAEL LANDIVAR,12 CALLE 4-57 ZONA 1,78720425-78722086,REYNA DEL ROSARIO CHAVEZ BARROW DE PACHECO,,BASICO,PRIVADO,URBANA,CERRADA TEMPORALMENTE,MONOLINGUE,VESPERTINA,DIARIO(REGULAR),SUCHITEPÉQUEZ
10-01-0096-45,10-018,SUCHITEPEQUEZ,MAZATENANGO,IPMB DE CIENCIAS COMERCIALES,7A AVE. 8A CALLE ZONA 1,,NATALI XIOMARA DIAZ BARRIOS DE FIGUEROA,.,BASICO,PRIVADO,URBANA,CERRADA TEMPORALMENTE,MONOLINGUE,NOCTURNA,DIARIO(REGULAR),SUCHITEPÉQUEZ
10-01-0101-45,10-018,SUCHITEPEQUEZ,MAZATENANGO,INSTITUTO PRIVADO MIXTO PROFESIONAL VISION EDUCATIVA 2000,"2A. CALLE 2-65 ZONA 2, COLONIA MAYA BARRIO LA UNION",77911552,NATALI XIOMARA DIAZ BARRIOS DE FIGUEROA,LUIS ALBERTO LINARES CHAPETON,BASICO,PRIVADO,URBANA,CERRADA TEMPORALMENTE,MONOLINGUE,MATUTINA,DIARIO(REGULAR),SUCHITEPÉQUEZ
10-01-0102-45,10-01-0511,SUCHITEPEQUEZ,MAZATENANGO,INSTITITO PRIVADO MIXTO PROFESIONAL VISION EDUCTIVA 2000,"2A. CALLE 2-65 ZONA 2, COLONIA MAYA BARRIO LA UNION",77911552,HEILYN MIRELLA GONZÁLEZ XAR DE QUINTEROS,LUIS ALBERTO LINARES CHAPETON,BASICO,PRIVADO,URBANA,ABIERTA,MONOLINGUE,DOBLE,FIN DE SEMANA,SUCHITEPÉQUEZ
10-01-0103-45,10-018,SUCHITEPEQUEZ,MAZATENANGO,INSTITUTO PRIVADO MIXTO PROFESIONAL VISOIN EDUCATIVA 2000,"2A. CALLE 2-65 ZONA 2, COLONIA MAYA BARRIO LA UNION",77911552,NATALI XIOMARA DIAZ BARRIOS DE FIGUEROA,SANDRA TRINIDAD PEREZ DOMINGUEZ,BASICO,PRIVADO,URBANA,CERRADA TEMPORALMENTE,MONOLINGUE,DOBLE,FIN DE SEMANA,SUCHITEPÉQUEZ
10-01-0107-45,10-018,SUCHITEPEQUEZ,MAZATENANGO,COLEGIO TECNICO SUCHITEPEQUEZ,CALZADA CENTENARIO 1-00 ZONA 2 1ER. GRUPO COLONIA FLOR DEL CAFÉ,78679530,NATALI XIOMARA DIAZ BARRIOS DE FIGUEROA,BRENDA LORENY PEREZ MAYORGA,BASICO,PRIVADO,URBANA,CERRADA TEMPORALMENTE,MONOLINGUE,DOBLE,FIN DE SEMANA,SUCHITEPÉQUEZ
10-01-0109-45,10-018,SUCHITEPEQUEZ,MAZATENANGO,CENTRO INTEGRAL EMPRESARIAL POR MADUREZ CIEM,4A. CALLE 2-23 ZONA 1,78727161,NATALI XIOMARA DIAZ BARRIOS DE FIGUEROA,EDGAR MISAEL CHUVAC BOJ,BASICO,PRIVADO,URBANA,CERRADA DEFINITIVAMENTE,MONOLINGUE,DOBLE,FIN DE SEMANA,SUCHITEPÉQUEZ
10-01-0110-45,10-01-0480,SUCHITEPEQUEZ,MAZATENANGO,COLEGIO CENTRO DE ESTUDIOS INTEGRALES,1A. CALLE BARRIO LA ESPERANZA ZONA 2,55127329,NATALI XIOMARA DÍAZ BARRIOS DE FIGUEROA,DASIA YOSELINE CASTILLO LAM,BASICO,PRIVADO,URBANA,ABIERTA,MONOLINGUE,DOBLE,FIN DE SEMANA,SUCHITEPÉQUEZ
10-01-0111-45,10-018,SUCHITEPEQUEZ,MAZATENANGO,COLEGIO CENTRO DE ESTUDIOS INTEGRALES CEI,1A. CALLE BARRIO LA ESPERANZA ZONA 2,79373035,NATALI XIOMARA DIAZ BARRIOS DE FIGUEROA,DASIA YOSELINE CASTILLO LAM,BASICO,PRIVADO,URBANA,CERRADA TEMPORALMENTE,MONOLINGUE,DOBLE,FIN DE SEMANA,SUCHITEPÉQUEZ
10-01-0147-45,10-01-0483,SUCHITEPEQUEZ,MAZATENANGO,INEB,CANTON SAN BENITO,56903631,NATALI XIOMARA DÍAZ BARRIOS DE FIGUEROA,NORMA RAQUEL LÓPEZ MENJIVAR,BASICO,OFICIAL,URBANA,ABIERTA,MONOLINGUE,VESPERTINA,DIARIO(REGULAR),SUCHITEPÉQUEZ
10-01-0148-45,10-99-0510,SUCHITEPEQUEZ,MAZATENANGO,INEB,COMUNIDAD AGRARIA LA VEGA,40665582,FREDY ARMANDO DE LEÓN ZUM,HANSON GERARDO HERNANDEZ ALVAREZ,BASICO,OFICIAL,RURAL,ABIERTA,MONOLINGUE,VESPERTINA,DIARIO(REGULAR),SUCHITEPÉQUEZ
10-01-0149-45,10-01-0480,SUCHITEPEQUEZ,MAZATENANGO,INEB,ALDEA SAN RAFAEL TIERRAS DEL PUEBLO,,NATALI XIOMARA DÍAZ BARRIOS DE FIGUEROA,HENRY ZACHARÍAS BATZ LIGORRÍA,BASICO,OFICIAL,URBANA,ABIERTA,MONOLINGUE,VESPERTINA,DIARIO(REGULAR),SUCHITEPÉQUEZ
10-01-0157-45,10-01-0479,SUCHITEPEQUEZ,MAZATENANGO,"COLEGIO CENTRO EDUCATIVO INTEGRAL CRISTIANO ""FUENTE DE BENDICION""",7A. AVENIDA 8-31 ZONA 1,78720315,REYNA DEL ROSARIO CHÁVEZ BARROW DE PACHECO,ANA DELFINA FUENTES RIVAS,BASICO,PRIVADO,URBANA,ABIERTA,MONOLINGUE,DOBLE,FIN DE SEMANA,SUCHITEPÉQUEZ
10-01-0160-45,10-01-0479,SUCHITEPEQUEZ,MAZATENANGO,COLEGIO PRIVADO MIXTO ROSARIO,"2AV. 4-84, ZONA 1",51591615,REYNA DEL ROSARIO CHÁVEZ BARROW DE PACHECO,CARLOS ALBERTO SARDÁ,BASICO,PRIVADO,URBANA,ABIERTA,MONOLINGUE,DOBLE,FIN DE SEMANA,SUCHITEPÉQUEZ
10-01-0164-45,10-019,SUCHITEPEQUEZ,MAZATENANGO,COLEGIO PRIVADO MIXTO RODRIGO MANUEL ROBLES DE LEON,"1A. AVENIDA FINAL LOTE 46 MANZANA C, RESIDENCIALES LAS AMANDAS ZONA 2",78725094,REYNA DEL ROSARIO CHAVEZ BARROW DE PACHECO,CLAUDIA ANGÉLICA ROBLES RODAS DE URRUTIA,BASICO,PRIVADO,URBANA,CERRADA TEMPORALMENTE,MONOLINGUE,VESPERTINA,DIARIO(REGULAR),SUCHITEPÉQUEZ
10-01-0165-45,10-99-0481,SUCHITEPEQUEZ,MAZATENANGO,INSTITUTO DE TELESECUNDARIA,1A. AVENIDA Y 1A. CALLE ZONA 2 COLONIA LA INDEPENDENCIA,43869294,REYNA DEL ROSARIO CHÁVEZ BARROW DE PACHECO,MABEL DANIZA LEÓN GARCÍA,BASICO,OFICIAL,URBANA,ABIERTA,MONOLINGUE,VESPERTINA,DIARIO(REGULAR),SUCHITEPÉQUEZ
10-01-0168-45,10-029,SUCHITEPEQUEZ,MAZATENANGO,"INSTITUTO PRIVADO MIXTO ""MEIT""",5A. AVENIDA FINAL NORTE 0-258 ZONA 1,78727029,GLODY SUCELY OSORIO FIGUEROA DE MORALES,NORMA AMARILIS JIMENEZ ESPINOZA,BASICO,PRIVADO,URBANA,CERRADA TEMPORALMENTE,MONOLINGUE,DOBLE,A DISTANCIA,SUCHITEPÉQUEZ
10-01-0171-45,10-01-0482,SUCHITEPEQUEZ,MAZATENANGO,NUCLEO FAMILIAR EDUCATIVO PARA EL DESARROLLO NUFED NO. 346,CASERIO MANGALES,48157871,ANDREA MARÍA MORALES LÓPEZ,CINTIA LISBET RAMIREZ,BASICO,OFICIAL,RURAL,ABIERTA,MONOLINGUE,MATUTINA,DIARIO(REGULAR),SUCHITEPÉQUEZ
10-01-0176-45,10-01-0511,SUCHITEPEQUEZ,MAZATENANGO,"COLEGIO PRIVADO MIXTO ""PESTALOZZI""",1A. CALLE 1-63 ZONA 1,78723161,HEILYN MIRELLA GONZÁLEZ XAR DE QUINTEROS,SILVIA VANESSA OCAL PACAY,BASICO,PRIVADO,URBANA,ABIERTA,MONOLINGUE,DOBLE,FIN DE SEMANA,SUCHITEPÉQUEZ
10-01-0177-45,10-01-0511,SUCHITEPEQUEZ,MAZATENANGO,"COLEGIO PRIVADO MIXTO ""PESTALOZZI""",1A. CALLE 1-63 ZONA 1,59333795,HEILYN MIRELLA GONZÁLEZ XAR DE QUINTEROS,SILVIA VANESSA OCAL PACAY,BASICO,PRIVADO,URBANA,ABIERTA,MONOLINGUE,DOBLE,FIN DE SEMANA,SUCHITEPÉQUEZ
10-01-0185-45,10-01-0511,SUCHITEPEQUEZ,MAZATENANGO,COLEGIO BILINGUE AMERICANO,KM. 1.2 CARRETERA A SAN FRANCISCO ZAPOTITLAN,37624876,HEILYN MIRELLA GONZÁLEZ XAR DE QUINTEROS,MARÍA ESTHER MÉNDEZ ARRIOLA,BASICO,PRIVADO,URBANA,ABIERTA,MONOLINGUE,MATUTINA,DIARIO(REGULAR),SUCHITEPÉQUEZ
10-01-0187-45,10-019,SUCHITEPEQUEZ,MAZATENANGO,COLEGIO PRIVADO MIXTO NUESTRA SEÑORA DEL CARMEN,"1A. CALLE 1-14 ZONA 2, LOTIFICACION EL ROBLE",78679092,REYNA DEL ROSARIO CHAVEZ BARROW DE PACHECO,EDGAR RENÉ DOMÍNGUEZ,BASICO,PRIVADO,URBANA,CERRADA TEMPORALMENTE,MONOLINGUE,DOBLE,FIN DE SEMANA,SUCHITEPÉQUEZ
10-01-0188-45,10-99-0481,SUCHITEPEQUEZ,MAZATENANGO,COLEGIO PRIVADO MIXTO NUESTRA SEÑORA DEL CARMEN,"1A. CALLE 1-14 ZONA 2, LOTIFICACION EL ROBLE",78679092,REYNA DEL ROSARIO CHÁVEZ BARROW DE PACHECO,MARIELA AZUCENA MEZA DE LEÓN,BASICO,PRIVADO,URBANA,ABIERTA,MONOLINGUE,DOBLE,FIN DE SEMANA,SUCHITEPÉQUEZ
10-01-0192-45,10-01-0511,SUCHITEPEQUEZ,MAZATENANGO,COLEGIO PRIVADO MIXTO SANTA MARIA DEL CAMINO,1A. CALLE 1-33 ZONA 1,79385728,HEILYN MIRELLA GONZÁLEZ XAR DE QUINTEROS,CARLOS ROLANDO FLORES SARDÁ,BASICO,PRIVADO,URBANA,ABIERTA,MONOLINGUE,DOBLE,FIN DE SEMANA,SUCHITEPÉQUEZ
10-01-0197-45,10-01-0482,SUCHITEPEQUEZ,MAZATENANGO,INEB DE TELESECUNDARIA,PARCELAMIENTO JAPON NACIONAL SECTOR B,51790478,ANDREA MARÍA MORALES LÓPEZ,VICENTE HERRERA CALEL,BASICO,OFICIAL,RURAL,ABIERTA,MONOLINGUE,MATUTINA,DIARIO(REGULAR),SUCHITEPÉQUEZ
10-01-0198-45,10-01-0511,SUCHITEPEQUEZ,MAZATENANGO,INSTITUTO NACIONAL DE EDUCACION BASICA Y DIVERSIFICADA NUEVO AMANCER CON VISION,"5TA. AVENIDA FINAL AVENIDA DOLORES, ZONA 1",55884849,HEILYN MIRELLA GONZÁLEZ XAR DE QUINTEROS,GLENDA CHAMALE,BASICO,OFICIAL,URBANA,ABIERTA,MONOLINGUE,VESPERTINA,DIARIO(REGULAR),SUCHITEPÉQUEZ
10-01-0203-45,10-01-0511,SUCHITEPEQUEZ,MAZATENANGO,COLEGIO DE ESTUDIOS SUPERIORES INTEGRALES,6A. AVENIDA NORTE 4-28 ZONA 1,79376223,HEILYN MIRELLA GONZÁLEZ XAR DE QUINTEROS,DAVID CASTILLO PADILLA,BASICO,PRIVADO,URBANA,ABIERTA,MONOLINGUE,DOBLE,FIN DE SEMANA,SUCHITEPÉQUEZ
10-01-0204-45,10-018,SUCHITEPEQUEZ,MAZATENANGO,COLEGIO DE ESTUDIOS SUPERIORES INTEGRALES,6A. AVENIDA NORTE 4-28 ZONA 1,78720984,NATALI XIOMARA DIAZ BARRIOS DE FIGUEROA,OVIDIO AUGUSTO ALONZO VELÁSQUEZ,BASICO,PRIVADO,URBANA,CERRADA DEFINITIVAMENTE,MONOLINGUE,DOBLE,FIN DE SEMANA,SUCHITEPÉQUEZ
10-01-0207-45,10-01-0479,SUCHITEPEQUEZ,MAZATENANGO,"COLEGIO PRIVADO MIXTO ""CENTRO EDUCATIVO MAZATECO""",3A. CALLE NO. 214 ZONA 2 BARRIO LA UNION,51517422,REYNA DEL ROSARIO CHÁVEZ BARROW DE PACHECO,OTTO ERIC NEFTALÍ MARTINEZ OBREGON,BASICO,PRIVADO,URBANA,ABIERTA,MONOLINGUE,DOBLE,FIN DE SEMANA,SUCHITEPÉQUEZ
10-01-0208-45,10-01-0479,SUCHITEPEQUEZ,MAZATENANGO,"COLEGIO PRIVADO MIXTO ""CENTRO EDUCATIVO MAZATECO""",3A. CALLE NO. 214 ZONA 2 BARRIO LA UNION,51517422,REYNA DEL ROSARIO CHÁVEZ BARROW DE PACHECO,OTTO ERIC NEFTALÍ MARTINEZ OBREGON,BASICO,PRIVADO,URBANA,ABIERTA,MONOLINGUE,DOBLE,FIN DE SEMANA,SUCHITEPÉQUEZ
10-01-0216-45,10-01-0480,SUCHITEPEQUEZ,MAZATENANGO,INSTITUTO TECNOLOGICO PRIVADO URBANO MIXTO FERDINAND LASSALLE,"AVENIDA DEL ESTADIO 2-50 CANTON RAYOS DEL SOL, ZONA 2",45301993,NATALI XIOMARA DÍAZ BARRIOS DE FIGUEROA,MARVIN GUSTAVO OROZCO BAUTISTA,BASICO,PRIVADO,URBANA,ABIERTA,MONOLINGUE,VESPERTINA,DIARIO(REGULAR),SUCHITEPÉQUEZ
10-01-0218-45,10-01-0511,SUCHITEPEQUEZ,MAZATENANGO,INSTITUTO PRIVADO MIXTO DE EDUCACION MEDIA MIGUEL ANGEL ASTURIAS,7MA. CALLE 0-54 ZONA 1,47185464,HEILYN MIRELLA GONZÁLEZ XAR DE QUINTEROS,GRISELDA NOHEMÍ TELLO ALDANA,BASICO,PRIVADO,URBANA,ABIERTA,MONOLINGUE,DOBLE,FIN DE SEMANA,SUCHITEPÉQUEZ
10-01-0220-45,10-019,SUCHITEPEQUEZ,MAZATENANGO,CENTRO DE EDUCACIÓN EXTRAESCOLAR CEEX-GRUPO CEIBA,"AV. LA LIBERTAD, 11 CALLE ZONA 1",22381970,REYNA DEL ROSARIO CHAVEZ BARROW DE PACHECO,AROLDO GARCIA BARRERA,BASICO,OFICIAL,URBANA,CERRADA TEMPORALMENTE,MONOLINGUE,DOBLE,FIN DE SEMANA,SUCHITEPÉQUEZ
10-01-0224-45,10-99-0481,SUCHITEPEQUEZ,MAZATENANGO,"INEB ""FLOR DEL CAFE""","2DO. GRUPO COLONIA FLOR DEL CAFE, 8A. CALLE 5-020 ZONA 2",58738575,REYNA DEL ROSARIO CHÁVEZ BARROW DE PACHECO,PAULA LUCRECIA MARTINEZ TORRES DE GONZÁLEZ,BASICO,OFICIAL,URBANA,ABIERTA,MONOLINGUE,VESPERTINA,DIARIO(REGULAR),SUCHITEPÉQUEZ
10-01-0227-45,10-01-0479,SUCHITEPEQUEZ,MAZATENANGO,CENTRO EDUCATIVO ADVENTISTA DEL SUR,"3A. CALLE Y 10A. AVENIDA, COLONIA LA INDEPENDENCIA",77911543,REYNA DEL ROSARIO CHÁVEZ BARROW DE PACHECO,CARMEN MARÍA ALVAREZ RODAS,BASICO,PRIVADO,URBANA,ABIERTA,MONOLINGUE,MATUTINA,DIARIO(REGULAR),SUCHITEPÉQUEZ
10-01-0229-45,10-019,SUCHITEPEQUEZ,MAZATENANGO,COLEGIO PANAMERICANO NO. 8,RURALES 2 ZONA 3 SALIDA A GUATEMALA,78679728,REYNA DEL ROSARIO CHAVEZ BARROW DE PACHECO,EVELYN MAGALI CRUZ ALVARADO,BASICO,PRIVADO,URBANA,CERRADA DEFINITIVAMENTE,MONOLINGUE,MATUTINA,DIARIO(REGULAR),SUCHITEPÉQUEZ
10-01-0232-45,10-021,SUCHITEPEQUEZ,MAZATENANGO,COLEGIO PANAMERICANO NO. 8,RURALES 2 ZONA 3 SALIDA A GUATEMALA,78679728,TANIA GISEL ESPAÑA DE LEON DE RODRIGUEZ,EVELYN MAGALI CRUZ ALVARADO,BASICO,PRIVADO,URBANA,CERRADA DEFINITIVAMENTE,MONOLINGUE,DOBLE,FIN DE SEMANA,SUCHITEPÉQUEZ
10-01-0233-45,10-021,SUCHITEPEQUEZ,MAZATENANGO,COLEGIO PANAMERICANO NO. 8,RURALES 2 ZONA 3 SALIDA A GUATEMALA,78679728,TANIA GISEL ESPAÑA DE LEON DE RODRIGUEZ,EVELYN MAGALI CRUZ ALVARADO,BASICO,PRIVADO,URBANA,CERRADA DEFINITIVAMENTE,MONOLINGUE,DOBLE,FIN DE SEMANA,SUCHITEPÉQUEZ
10-01-0236-45,10-019,SUCHITEPEQUEZ,MAZATENANGO,COLEGIO PRIVADO MIXTO JUAN DIEGUEZ OLAVERRI,1A. CALLE 3-39 ZONA 1,78725645,REYNA DEL ROSARIO CHAVEZ BARROW DE PACHECO,LETTY ALEXANDRA OSORIO FIGUEROA,BASICO,PRIVADO,URBANA,CERRADA DEFINITIVAMENTE,MONOLINGUE,DOBLE,FIN DE SEMANA,SUCHITEPÉQUEZ
10-01-0238-45,10-019,SUCHITEPEQUEZ,MAZATENANGO,COLEGIO PRIVADO MIXTO JUAN DIEGUEZ OLAVERRI,1A. CALLE 3-39 ZONA 1,78725645,REYNA DEL ROSARIO CHAVEZ BARROW DE PACHECO,LETTY ALEXANDRA OSORIO FIGUEROA,BASICO,PRIVADO,URBANA,CERRADA DEFINITIVAMENTE,MONOLINGUE,DOBLE,FIN DE SEMANA,SUCHITEPÉQUEZ
10-01-0240-45,10-019,SUCHITEPEQUEZ,MAZATENANGO,LICEO DE EDUCACION SUPERIOR PREUNIVERSITARIO,AVENIDA DEL ESTADIO 2-50 ZONA 2,78727363,REYNA DEL ROSARIO CHAVEZ BARROW DE PACHECO,MARVIN GUSTAVO OROZCO BAUTISTA,BASICO,PRIVADO,URBANA,CERRADA DEFINITIVAMENTE,MONOLINGUE,DOBLE,FIN DE SEMANA,SUCHITEPÉQUEZ
10-01-0243-45,10-029,SUCHITEPEQUEZ,MAZATENANGO,MODALIDADES FLEXIBLES PARA LA EDUCACION MEDIA DR. MARIANO GALVEZ CICLO BASICO,7A. AV. Y 8A. CALLE ZONA 1,78718338,GLODY SUCELY OSORIO FIGUEROA DE MORALES,CARMELA HERNÁNDEZ REYNOSO,BASICO,PRIVADO,URBANA,CERRADA TEMPORALMENTE,MONOLINGUE,DOBLE,FIN DE SEMANA,SUCHITEPÉQUEZ
10-01-0244-45,10-019,SUCHITEPEQUEZ,MAZATENANGO,MODALIDADES FLEXIBLES PARA LA EDUCACION MEDIA DR. MARIANO GALVEZ CICLO BASICO,7A. AV. Y 8A. CALLE ZONA 1,51256172,REYNA DEL ROSARIO CHAVEZ BARROW DE PACHECO,JEREMIAS OCAÑA LOPEZ,BASICO,PRIVADO,URBANA,CERRADA TEMPORALMENTE,MONOLINGUE,NOCTURNA,DIARIO(REGULAR),SUCHITEPÉQUEZ
10-01-0246-45,10-01-0480,SUCHITEPEQUEZ,MAZATENANGO,"COLEGIO PRIVADO MIXTO ""ESTHER CARRANZA""",3RA. AVENIDA 1-40 ZONA 2,78725047,NATALI XIOMARA DÍAZ BARRIOS DE FIGUEROA,MYNOR JOSE FARFÁN PELLECER,BASICO,PRIVADO,URBANA,ABIERTA,MONOLINGUE,MATUTINA,DIARIO(REGULAR),SUCHITEPÉQUEZ
10-01-0248-45,10-01-0483,SUCHITEPEQUEZ,MAZATENANGO,"LICEO DE EDUCACION SUPERIOR ""PREUNIVERSITARIO""",AVENIDA DEL ESTADIO 2-50 ZONA 2,45301993,NATALI XIOMARA DÍAZ BARRIOS DE FIGUEROA,MARVIN GUSTAVO OROZCO BAUTISTA,BASICO,PRIVADO,URBANA,ABIERTA,MONOLINGUE,DOBLE,FIN DE SEMANA,SUCHITEPÉQUEZ
10-01-0250-45,10-019,SUCHITEPEQUEZ,MAZATENANGO,COLEGIO PRIVADO MIXTO PESTALOZZI,1A. CALLE 1-63 ZONA 1,78723161,REYNA DEL ROSARIO CHAVEZ BARROW DE PACHECO,AURORA GARCIA CASTRO DE AGUILAR,BASICO,PRIVADO,URBANA,CERRADA DEFINITIVAMENTE,MONOLINGUE,MATUTINA,DIARIO(REGULAR),SUCHITEPÉQUEZ
10-01-0257-45,10-021,SUCHITEPEQUEZ,MAZATENANGO,COLEGIO PANAMERICANO CON MODALIDAD A DISTANCIA,"LOCAL 10, DEL CENTRO COMERCIAL PLAZA AMERICAS, KILOMETRO 158",,TANIA GISEL ESPAÑA DE LEON DE RODRIGUEZ,MARIANO OBDULIO SERRANO CIFUENTES,BASICO,PRIVADO,URBANA,CERRADA DEFINITIVAMENTE,MONOLINGUE,DOBLE,IRREGULAR,SUCHITEPÉQUEZ
10-01-0262-45,10-001,SUCHITEPEQUEZ,MAZATENANGO,COLEGIO BILINGUE MONTE BELLO,7A. CALLE 1-181 ZONA 3,78718760,HEILYN MIRELLA GONZÁLEZ XAR DE QUINTEROS,LUISA FIDELIA DIAZ MALDONADO DE CARRANZA,BASICO,PRIVADO,URBANA,CERRADA DEFINITIVAMENTE,MONOLINGUE,MATUTINA,DIARIO(REGULAR),SUCHITEPÉQUEZ
10-01-0263-45,10-001,SUCHITEPEQUEZ,MAZATENANGO,COLEGIO BILINGUE MONTE BELLO,7A. CALLE 1-181 ZONA 3,78718760,HEILYN MIRELLA GONZÁLEZ XAR DE QUINTEROS,LUISA FIDELIA DIAZ MALDONADO DE CARRANZA,BASICO,PRIVADO,URBANA,CERRADA DEFINITIVAMENTE,MONOLINGUE,MATUTINA,DIARIO(REGULAR),SUCHITEPÉQUEZ
10-01-0264-45,10-001,SUCHITEPEQUEZ,MAZATENANGO,COLEGIO BILINGUE MONTE BELLO,7A. CALLE 1-181 ZONA 3,78718760,HEILYN MIRELLA GONZÁLEZ XAR DE QUINTEROS,LUISA FIDELIA DIAZ MALDONADO DE CARRANZA,BASICO,PRIVADO,URBANA,CERRADA DEFINITIVAMENTE,MONOLINGUE,MATUTINA,DIARIO(REGULAR),SUCHITEPÉQUEZ
10-01-0265-45,10-01-0483,SUCHITEPEQUEZ,MAZATENANGO,COLEGIO BILINGUE MONTE BELLO,7A. CALLE 1-181 ZONA 3,56923007,NATALI XIOMARA DÍAZ BARRIOS DE FIGUEROA,ANA PATRICIA PIEDRASANTA JUÁREZ,BASICO,PRIVADO,URBANA,ABIERTA,MONOLINGUE,MATUTINA,DIARIO(REGULAR),SUCHITEPÉQUEZ
10-01-0270-45,10-01-0479,SUCHITEPEQUEZ,MAZATENANGO,"COELGIO PRIVADO MIXTO CRISTIANO ""EMANUEL""",6A. CALLE FINAL CANTON SAN JOSE ZONA 1,78726386,REYNA DEL ROSARIO CHÁVEZ BARROW DE PACHECO,VIVIAN ELISA CABRERA GRAMAJO,BASICO,PRIVADO,URBANA,ABIERTA,MONOLINGUE,MATUTINA,DIARIO(REGULAR),SUCHITEPÉQUEZ
10-01-0272-45,10-01-0511,SUCHITEPEQUEZ,MAZATENANGO,"INSTITUTO PRIVADO ""PAULO FREIRE""",7A. AVENIDA 8-15 ZONA 1,47335125,HEILYN MIRELLA GONZÁLEZ XAR DE QUINTEROS,ANDREA ESPERANZA LARES LÓPEZ,BASICO,PRIVADO,URBANA,ABIERTA,MONOLINGUE,DOBLE,FIN DE SEMANA,SUCHITEPÉQUEZ
10-01-0276-45,10-01-0511,SUCHITEPEQUEZ,MAZATENANGO,"INSTITUTO TECNICO PRIVADO ""JOSE ORTEGA Y GASSET""",2DA. AVENIDA 1-37 ZONA 2 COLONIA ACEITUNO,56944704,HEILYN MIRELLA GONZÁLEZ XAR DE QUINTEROS,CLAUDIA NOHEMI GUZMÁN MARTÍNEZ,BASICO,PRIVADO,URBANA,ABIERTA,MONOLINGUE,DOBLE,FIN DE SEMANA,SUCHITEPÉQUEZ
10-01-0277-45,10-018,SUCHITEPEQUEZ,MAZATENANGO,"INSTITUTO TECNICO PRIVADO ""JOSE ORTEGA Y GASSET""",2DA. AVENIDA 1-37 ZONA 2 COLONIA ACEITUNO,79386702,NATALI XIOMARA DIAZ BARRIOS DE FIGUEROA,CLAUDIA NOHEMI GUZMÁN MARTÍNEZ,BASICO,PRIVADO,URBANA,CERRADA TEMPORALMENTE,MONOLINGUE,DOBLE,FIN DE SEMANA,SUCHITEPÉQUEZ
10-01-0279-45,10-99-0481,SUCHITEPEQUEZ,MAZATENANGO,COLEGIO CENTRO DE ESTUDIOS INTEGRALES,1A. CALLE BARRIO LA ESPERANZA ZONA 2,55133318,REYNA DEL ROSARIO CHÁVEZ BARROW DE PACHECO,LINDA MARIELOS DE LEÓN BOLAÑOS,BASICO,PRIVADO,URBANA,ABIERTA,MONOLINGUE,MATUTINA,DIARIO(REGULAR),SUCHITEPÉQUEZ
10-01-0286-45,10-019,SUCHITEPEQUEZ,MAZATENANGO,CENTRO INTEGRAL EMPRESARIAL POR MADUREZ CIEM,4A. CALLE 2-23 ZONA 1,56939176,REYNA DEL ROSARIO CHAVEZ BARROW DE PACHECO,EDGAR MISAEL CHUVAC BOJ,BASICO,PRIVADO,URBANA,CERRADA TEMPORALMENTE,MONOLINGUE,MATUTINA,DIARIO(REGULAR),SUCHITEPÉQUEZ
10-01-0288-45,10-01-0511,SUCHITEPEQUEZ,MAZATENANGO,"COLEGIO PRIVADO MIXTO ""SANTA MARIA DEL CAMINO""",1A. CALLE 1-33 ZONA 1,79385728,HEILYN MIRELLA GONZÁLEZ XAR DE QUINTEROS,CARLOS ROLANDO FLORES SARDÁ,BASICO,PRIVADO,URBANA,ABIERTA,MONOLINGUE,DOBLE,FIN DE SEMANA,SUCHITEPÉQUEZ
10-01-0290-45,10-01-0483,SUCHITEPEQUEZ,MAZATENANGO,COMPLEJO EDUCATIVO BILINGUE DEL SUR OCCIDENTE,FINCA EL DELIRIO KILOMETRO 157 DE LA RUTA CA-2,57913479,NATALI XIOMARA DÍAZ BARRIOS DE FIGUEROA,JOSUÉ DANIEL MANCIO RAMÍREZ,BASICO,PRIVADO,URBANA,ABIERTA,MONOLINGUE,MATUTINA,DIARIO(REGULAR),SUCHITEPÉQUEZ
10-01-0295-45,10-01-0511,SUCHITEPEQUEZ,MAZATENANGO,"INSTITUTO PRIVADO MIXTO ""JOSE ERNESTO MONZON""",2A. AVENIDA FINAL NORTE 1-27 ZONA 1,78718805,HEILYN MIRELLA GONZÁLEZ XAR DE QUINTEROS,PATRICIA ELIZABETH LURSSEN DE LEÓN,BASICO,PRIVADO,URBANA,ABIERTA,MONOLINGUE,MATUTINA,DIARIO(REGULAR),SUCHITEPÉQUEZ
10-01-0304-45,10-01-0479,SUCHITEPEQUEZ,MAZATENANGO,CENTRO INTEGRAL EMPRESARIAL POR MADUREZ CIEM,4A. CALLE 2-23 ZONA 1,78724489,REYNA DEL ROSARIO CHÁVEZ BARROW DE PACHECO,EDGAR MISAEL CHUVAC BOJ,BASICO,PRIVADO,URBANA,ABIERTA,MONOLINGUE,DOBLE,FIN DE SEMANA,SUCHITEPÉQUEZ
10-01-0310-45,10-01-0479,SUCHITEPEQUEZ,MAZATENANGO,"COLEGIO PRIVADO MIXTO ""LICEO MAZATECO""",6A. AVENIDA 2-21 ZONA 1,58602635,REYNA DEL ROSARIO CHÁVEZ BARROW DE PACHECO,SANDRY ZIOMARA MANCIO MÉNDEZ,BASICO,PRIVADO,URBANA,ABIERTA,MONOLINGUE,DOBLE,FIN DE SEMANA,SUCHITEPÉQUEZ
10-01-0311-45,10-019,SUCHITEPEQUEZ,MAZATENANGO,"COLEGIO PRIVADO MIXTO ""LICEO MAZATECO""",6A. AVENIDA 2-21 ZONA 1,58602635,REYNA DEL ROSARIO CHAVEZ BARROW DE PACHECO,SANDRY ZIOMARA MANCIO MÉNDEZ,BASICO,PRIVADO,URBANA,CERRADA TEMPORALMENTE,MONOLINGUE,DOBLE,FIN DE SEMANA,SUCHITEPÉQUEZ
10-01-0317-45,10-99-0481,SUCHITEPEQUEZ,MAZATENANGO,"COLEGIO PRIVADO MIXTO DE LIDERAZGO ""ILAG""",4A. AVENIDA 1-54 ZONA 2 COLONIA ACEITUNO,33422295,REYNA DEL ROSARIO CHÁVEZ BARROW DE PACHECO,MARIO ALBERTO ARRIAGA AVILA,BASICO,PRIVADO,URBANA,ABIERTA,MONOLINGUE,MATUTINA,DIARIO(REGULAR),SUCHITEPÉQUEZ
10-01-0320-45,10-018,SUCHITEPEQUEZ,MAZATENANGO,"INSTITUTO PRIVADO MIXTO ""JOSE ERNESTO MONZON""",2A. AVENIDA FINAL NORTE 1-27 ZONA 1,78718805,NATALI XIOMARA DIAZ BARRIOS DE FIGUEROA,GLODY SUCELY OSORIO FIGUEROA,BASICO,PRIVADO,URBANA,CERRADA TEMPORALMENTE,MONOLINGUE,DOBLE,FIN DE SEMANA,SUCHITEPÉQUEZ
10-01-0324-45,10-018,SUCHITEPEQUEZ,MAZATENANGO,COLEGIO TECNICO SUCHITEPEQUEZ,"CALZADA CENTENARIO 1-00 ZONA 2 1ER. GRUPO, COLONIA FLOR DEL CAFE",786795,NATALI XIOMARA DIAZ BARRIOS DE FIGUEROA,ASTRID JOHANA AYALA CUETO,BASICO,PRIVADO,URBANA,CERRADA TEMPORALMENTE,MONOLINGUE,MATUTINA,DIARIO(REGULAR),SUCHITEPÉQUEZ
10-01-0326-45,10-01-0479,SUCHITEPEQUEZ,MAZATENANGO,COLEGIO BILINGUE STEWART¨S,1A. CALLE FINAL 1-00 ZONA 3 LOTIFICACION RAMIREZ,41066503,REYNA DEL ROSARIO CHÁVEZ BARROW DE PACHECO,VILSER JOSVIN RAMÍREZ ROBLES,BASICO,PRIVADO,URBANA,ABIERTA,MONOLINGUE,MATUTINA,DIARIO(REGULAR),SUCHITEPÉQUEZ
10-01-0327-45,10-018,SUCHITEPEQUEZ,MAZATENANGO,"COLEGIO PRIVADO MIXTO ""PESTALOZZI""",1A. CALLE 1-63 ZONA 1,78723161,NATALI XIOMARA DIAZ BARRIOS DE FIGUEROA,JOSSELYN MARLENY RAMIREZ MARTINEZ,BASICO,PRIVADO,URBANA,CERRADA DEFINITIVAMENTE,MONOLINGUE,VESPERTINA,DIARIO(REGULAR),SUCHITEPÉQUEZ
10-01-0330-45,10-01-0479,SUCHITEPEQUEZ,MAZATENANGO,COLEGIO PRIVADO MIXTO ROSARIO,2A. AVENIDA 4-84 ZONA 1,51591615,REYNA DEL ROSARIO CHÁVEZ BARROW DE PACHECO,CARLOS ALBERTO SARDÁ,BASICO,PRIVADO,URBANA,ABIERTA,MONOLINGUE,DOBLE,FIN DE SEMANA,SUCHITEPÉQUEZ
10-01-0331-45,10-01-0511,SUCHITEPEQUEZ,MAZATENANGO,COLEGIO LATINOAMERICANO GOSPEL,12 CALLE 4-45 ZONA 1,77911907,HEILYN MIRELLA GONZÁLEZ XAR DE QUINTEROS,GLORIA CELESTE ROBLES RODAS,BASICO,PRIVADO,URBANA,ABIERTA,MONOLINGUE,DOBLE,FIN DE SEMANA,SUCHITEPÉQUEZ
10-01-0332-45,10-018,SUCHITEPEQUEZ,MAZATENANGO,COLEGIO LATINOAMERICANO GOSPEL,12 CALLE 4-45 ZONA 1,77911907,NATALI XIOMARA DIAZ BARRIOS DE FIGUEROA,BRENDA LETICIA RAMOS PÉREZ,BASICO,PRIVADO,URBANA,CERRADA TEMPORALMENTE,MONOLINGUE,DOBLE,FIN DE SEMANA,SUCHITEPÉQUEZ
10-01-0335-45,10-027,SUCHITEPEQUEZ,MAZATENANGO,COORDINACIÓN DEPARTAMENTAL DE TELESECUNDARIA DE SUCHITEPÉQUEZ,8A. CALLE 7-24 ZONA 1,78720350,CARLOS ENRIQUE JALEL DE LOS SANTOS,CARLOS ENRIQUE JALEL DE LOS SANTOS,BASICO,OFICIAL,URBANA,TEMPORAL NOMBRAMIENTO,MONOLINGUE,VESPERTINA,DIARIO(REGULAR),SUCHITEPÉQUEZ
